Landing Page,Impressions,Url Clicks,URL CTR,title,subtitle,date_published,date_updated
https://www.israelhayom.co.il/animals/article/16212851,97395,4261,0.04374967914,"""לא חיפשתי לאמץ כלב עיוור, אבל סטיבי ממש התאים לי""","כשעופרי רוזנטל תכננה לאמץ כלב, היא לא חשבה לאמץ כלב נכה • לאחר שפגשה בסטיבי והבינה שהוא מתאים למה שחיפשה, היא הכניסה אותו לביתה – והתאהבה: ""אני בכלל לא מרגישה את המוגבלות שלו"" • וגם: לוח השנה של חיות המחמד הנכות שהופך אותן לגיבורי על",2024-08-06T14:29:40.000Z,2024-08-07T14:06:01.000Z
https://www.israelhayom.co.il/animals/article/15743155,104117,4539,0.04359518618,"""המדינה לא מסייעת בדבר"": הישראלי שזכה בתחרות הכלבים החשובה בעולם פותח הכל","למרות שהוא מממן הכל מכיסו הפרטי, רן לוי ממשיך להתחרות עם כלבו תור בתחרויות המונדיאורינג – ואף לזכות בשלל מדליות ותארים • ""כשדגל ישראל מונף על הפודיום, זו גאווה ישראלית שמוצגת בפני מיליוני צופים – ולכן אני חושב שהמדינה צריכה לתמוך בספורט הזה""",2024-05-14T13:54:30.000Z,2024-05-15T07:57:55.000Z
https://www.israelhayom.co.il/animals/article/14809636,103646,3143,0.03032437335,"""מצב בלתי נסבל"": קריאה לממשלה לאפשר למפונים להכניס חיות מחמד למלונות","במכתב בהול שפורום עורכי הדין להגנה על בעלי החיים העביר לארבעה שרים, נכתב כי האיסור של כמה בתי מלוו פוגע במפונים ובחיות כאחד • ""הם תומכים ומנחמים אחד את השני, הפרידה גורמת צער ועוגמת נפש בלתי מתוארים""",2023-11-11T09:10:07.000Z,2023-11-11T09:10:07.000Z
https://www.israelhayom.co.il/animals/article/15135639,90954,4150,0.04562746003,יחיד במינו: פינגווין נדיר במיוחד תועד באנטרקטיקה,"צלם צ'יליאני הצליח לצלם ביבשת הקרה פינגווינית שסובלת מבעיית פיגמנטציה גנטית, שהותירה אותה לבנה לגמרי • הדבר מעמיד אותה בסכנת חיים, שכן כשהיא צוללת במים היא תבלוט מאוד לטורפים פוטנציאליים",2024-01-21T10:13:42.000Z,2024-01-21T10:13:42.000Z
https://www.israelhayom.co.il/animals/adoption/article/14914697,92693,3688,0.0397872547,דווקא עכשיו: הכלבים והחתולים שמחכים לבית חם | פינת האימוץ,"המתוקים שתראו פה ממתינים לבית שייקח אותם באהבה ובחום לחיים מאושרים ומלאי ליטופים וליקוקים • הכירו את טופי, אלישע, ביאנקה, גשם, אבירם, מאצ'ו, גולדי, אמילי ועוד – ואמצו אותם עוד היום",2023-12-06T13:28:16.000Z,2023-12-06T13:28:16.000Z
https://www.israelhayom.co.il/animals/article/14809945,83519,2273,0.02721536417,"""ללא הגנה על מיליוני הציפורים הנודדות שעוברות בארץ, עתידן לא יהיה מזהיר""","כ-300 מיני ציפורים חולפים בשמי ישראל בעונת הנדידה, אך לדברי כותבי ספר חדש שעוסק בנושא – חוסר השמירה עליהן עלול לפגוע בהן • ""כשלנו בהעלאת המודעות לכך, אבל כאנשי מחקר ושימור הטבע – אנו לא מתייאשים ממאבקנו""",2023-11-12T09:36:49.000Z,2023-11-13T07:53:40.000Z
https://www.israelhayom.co.il/animals/article/15604912,88567,2780,0.03138866621,דווקא עכשיו: הכלבים והחתולים שמחכים לבית חם | פינת האימוץ,"המתוקים שתראו פה מחכים לבית חם שייקח אותם באהבה לחיים מאושרים ומלאי ליטופים וליקוקים • הכירו את גפן, צ'רנובה, אוסקר, מילקי, טרזן, אפורית, סובי, קופר ועוד – ואמצו אותם עוד היום",2024-04-15T14:34:13.000Z,2024-04-15T14:34:13.000Z
https://www.israelhayom.co.il/animals/article/15248880,84013,5647,0.06721578803,"במהלך פעילות מבצעית: מילואימניקים חילצו 3 צבאים מיו""ש","חיילים מגדוד 43 של חטיבת כפיר חילצו את החיות לאחר שהבחינו בהן מוחזקות בשבי בבית פרטי • לאחר שחולצו בשלום, הן נבדקו – והתגלה כי הן סובלות מרזון וממצב גופני לקוי • אחרי שטופלו, הן שוחררו בחזרה לטבע",2024-02-11T14:38:59.000Z,2024-02-11T14:40:39.000Z
https://www.israelhayom.co.il/animals/article/17216706,83101,7651,0.0920686875,קבלו את השמות הכי מקוריים לכלבים בישראל לשנת 2024,"הידעתם? ""בול עץ"" ו""אל פצ'ינו"" יכלוים להיות גם שמות של כלבים • סקר הכלבים הגדול כולל את השמות המיוחדים ביותר שניתנו לכלבים בשנה שעברה, הגזע הכי פופולארי, כמה כלבים אומצו וכמה כלבים נולדו השנה בארץ • משרד החקלאות חושף את נתונים מעניינים על חברו הטוב של האדם",2025-01-23T12:26:28.000Z,2025-01-29T17:38:43.000Z
https://www.israelhayom.co.il/animals/article/15869543,81749,2414,0.0295294132,"""הדרך הטובה ביותר לחגוג את יום הולדתו"": אירוע אימוץ כלבים מיוחד למען החטוף","עידן שתיוי נחטף לעזה ב-7 באוקטובר לאחר שנפצע מירי מחבלים • סתיו, בת זוגו, סיפרה ל""ישראל היום"" כי הוא רק רוצה לעשות טוב: ""הוא מאוד אוהב חיות וגידל כלבים כל חייו, זו הדרך שלנו לציין את ערכיו""",2024-06-05T17:53:47.000Z,2024-06-06T14:04:33.000Z
https://www.israelhayom.co.il/animals/article/17471316,83036,4656,0.05607206513,"מרגש: בעלי החיים המצויים בסכנת הכחדה שוחררו מגן החיות התנ""כי - ושבו לטבע","שישה יחמורים פרסיים, שלושה זכרים ושלוש נקבות שוחררו להרי ירושלים - במטרה להגדיל את תפוצתם בטבע • ההשבה הנוכחית היא חלק ממבצע רב שנים להשבת החיה הנדירה לטבע • גן החיות מנהל כבר שני עשורים להשבת החיה הנדירה לטבע, כאשר בשטח משוטטים יותר מ-150 פריטים, חלקם כבר הומלטו בטבע • גן החיות התנכ""י הוא היחיד בעולם שמתקיימים בו 6 פרוייקטים של גידול והשבה אל הטבע",2025-03-03T18:52:09.000Z,2025-03-04T08:03:27.000Z
https://www.israelhayom.co.il/animals/article/14860296,82026,1865,0.02273669324,מדאיג: ירידה במספר השקנאים שנודדים דרך ישראל,"לפי רשות הטבע והגנים, חלה ירידה משמעותית גם במספר השקנאים שנשאר בארץ במהלך עונת הנדידה • ספירת ימי שהות השקנאים נעשית כדי להיערך להאכלתם בדגים מהסוג שלא נמכר לציבור",2023-11-25T09:00:19.000Z,2023-11-25T09:00:19.000Z
https://www.israelhayom.co.il/animals/article/16101779,82258,9837,0.1195871526,"""תוכנית המדינה לעיקור וסירוס חתולי רחוב היא הרת אסון""","לאחר הפרסום ב""ישראל היום"" לפיו מיליוני שקלים יועברו לעשרות רשויות מקומיות לטיפול בתופעת החתולים המשוטטים, בעמותת ""תנו לחיות לחיות"" טענו כי הצעד של משרד החקלאות מהווה בכלל עיכוב חמור בהקצאת תקציב שקבוע בחוק • ""זו דוגמה נוספת לכך שנושא הגנת החיות בארץ צריך לעבור לרשות עצמאית, כזו שתדאג להן באמת""",2024-07-18T12:13:58.000Z,2024-07-18T12:18:27.000Z
https://www.israelhayom.co.il/animals/article/15851097,75459,5338,0.07074040207,המומחה מזהיר: היכונו - הקיץ הקרוב יהיה מלא במדוזות | כך תתכוננו בהתאם,"""אנו רואים כבר את הסנוניות הראשונות של נחיל ענק שיגיע ככל הנראה לקראת סוף החודש"", אומר ד""ר דור אדליסט, מומחה העוסק בחקר המדוזות • אז מה עושים אם נעקצנו ומאיזה חופים כדאי להימנע? • כל מה שרציתם לדעת על ""החוטית הנודדת"" שתלווה אותנו לאורך הימים החמים",2024-06-02T17:30:02.000Z,2024-06-02T17:30:02.000Z
https://www.israelhayom.co.il/animals/article/15770530,76057,1902,0.02500756012,כשבחוץ חום אימים: כך תגרמו לחתול שלכם לשתות יותר מים,"מזג האוויר הרותח גורם לכולנו לשתות יותר נוזלים – וכך גם אצל חיות המחמד שלנו • אז כמה בדיוק חתול צריך לשתות, איך החלפת קערת המים תעזור לו וכיצד תוכלו לדעת אם הוא בכלל התייבש? כל הפרטים",2024-05-19T11:50:39.000Z,2024-05-19T12:35:13.000Z
https://www.israelhayom.co.il/animals/adoption/article/16088152,72953,2797,0.03833975299,דווקא עכשיו: הכלבים והחתולים שמחכים לבית חם | פינת האימוץ,"המתוקים שתראו פה מחכים לבית חם שייקח אותם באהבה לחיים מאושרים ומלאי ליטופים וליקוקים • הכירו את פלורה, סילי, ג'ולי, סנופי, שוורץ, לוציוס ועוד – ואמצו אותם עוד היום",2024-07-16T12:44:42.000Z,2024-07-16T12:44:42.000Z
https://www.israelhayom.co.il/animals/article/15410300,72600,4270,0.058815427,"""הכל נשרף בתוך דקות בודדות – חוות החיות, הבית שלי וגם חלום חיי""","רן פחימה הציל מאז 7 באוקטובר אלפי חיות, אותן חיבר עם בעליהן או העניק להן טיפול רפואי • אחרי הזוועות שראה ביישובי עוטף עזה, ביתו ופנסיון בעלי החיים שלו נשרפו לגמרי • כעת, הוא מבקש את עזרת הציבור בשיקום המקום: ""אני קרוע שלא הצלחתי להציל את כל החיות, זה שובר אותי""",2024-03-12T13:11:27.000Z,2024-03-12T13:11:27.000Z
https://www.israelhayom.co.il/animals/article/15101468,81215,3576,0.04403127501,חסד אחרון: איך מטפלים בספארי בדובה שסובלת מגידול ממאיר?,"מאז שחזר הגידול של הדובה החומה הסורית בו, רגליה מתקשות לשאת את משקל גופה • כעת, בספארי מאפשרים לה לחיות ברווחה ככל האפשר – ומתכוננים ליום שבו תלך לעולמה • אז, יאפשרו לבבט, אחותה שצמודה אליה מאז נולדו, להיפרד ממנה: ""זה קשה מאוד לראות חיה סובלת""",2024-01-15T09:25:15.000Z,2024-01-16T14:22:50.000Z
https://www.israelhayom.co.il/animals/article/16342180,70882,2313,0.03263169775,לא רק נסחפות: המדוזות יודעות בדיוק לאן הן שוחות,"במחקר שבדק את דפוסי הנדידה של סוג המדוזות הנפוצות ביותר בישראל התגלה שהן שוחות באופן מכוון ומאורגן לכיוון מערב • עורך המחקר ד""ר להן: ""אם הן היו נסחפות היינו יכולים לחזות את התנועה של הנחילים""",2024-08-28T11:15:02.000Z,2024-08-28T11:15:50.000Z
https://www.israelhayom.co.il/animals/article/16327803,65749,2071,0.03149857793,"סקאר, רופרט, שושוק: התל-אביבים שהולכים על ארבע","לרגל יום הכלב הבינלאומי יצאנו לפגוש כלבים ובעליהם • גזעים כמו שיצו, פומרניאן ורועה גרמני נהנים מפופולריות רבה בישראל, אך גם כלבים מעורבי גזע זוכים לאהבה רבה • הב שמח",2024-08-26T10:28:24.000Z,2024-08-26T14:29:15.000Z
https://www.israelhayom.co.il/animals/article/14994399,67515,2322,0.03439235725,הכלב פוחד מהרעמים? כך תוכלו להקל עליו,"גם חברו הטוב ביותר של האדם עלול לפחד מרעמים, וכמובן שנרצה לסייע לו להתמודד עם החששות • למה זה קורה לו, מה צריך לעשות בזמן התקף חרדה ואיך נוכל לסייע לכלב שלנו להתמודד עם הפחד?",2023-12-24T09:52:59.000Z,2023-12-24T09:54:56.000Z
https://www.israelhayom.co.il/animals/article/14973553,65004,3637,0.05595040305,איזו מתיקות: כלבי השירות שהגיעו לבקר חיילים פצועים,"מתנדבים הגיעו עם כלבי שירות למרכז הרפואי ברזילי, כדי להעלות חיוך בקרב החיילים שנפצעו במלחמה אשר אושפזו במקום • רס""ן מיתר סלע, שהקימה את הפרויקט: ""כשכלב מרגיש שאתה זקוק לו, הוא יהיה שם בשבילך""",2023-12-19T11:35:44.000Z,2023-12-19T11:35:44.000Z
https://www.israelhayom.co.il/animals/article/14820121,72486,1933,0.0266672185,"אל תשאירו אותן בחוץ: ""אפשרו גם לחיות המחמד להיכנס למקלטים""","לאחר מספר מקרים שבהם שכנים התווכחו על הכנסת בעלי חיים למקלט בזמן הישמע אזעקה, במשרד החקלאות קראו לציבור ולרשויות המקומיות לאפשר את כניסתם • זו הסיבה שהדבר חשוב לחיה ולבעליה, וכך תוכלו להפחית את הפחד מהחוששים ממנה",2023-11-14T07:00:57.000Z,2023-11-14T07:19:12.000Z
https://www.israelhayom.co.il/animals/article/16153936,61964,4979,0.08035310826,הדג הגדול ביותר בעולם: כ-100 מטרים מהחוף - כריש לווייתן תועד במפרץ אילת,"כריש לווייתן באורך של כ-6 מטרים, שמגיע בשיאו למשקל של כ-20 טונות, תועד בשמורת האלמוגים בעיר הדרומית • שגיא דוד כברה, מדריך צלילה חופשית שצילם אותו: ""המפגש האחרון היה לפני חצי שנה - חיכיתי הרבה זמן לראות אותו שוב"" • צפו",2024-07-28T06:11:28.000Z,2024-07-28T09:36:57.000Z
https://www.israelhayom.co.il/animals/article/17159037,57973,1491,0.02571886913,מבצע הצלה בערבה: חמישה אפרוחי יען נדירים שוחררו בחי בר יוטבתה,"האפרוחים שבגרו שוחררו לשטח פתוח אחרי שהגיעו כמעט לגודל ולמשקל מלאים • היענים הצעירים, בני 10 חודשים, הם חלק מקבוצה בת 9 יענים שבגרו בחי בר",2025-01-15T13:05:00.000Z,2025-01-15T13:05:00.000Z
https://www.israelhayom.co.il/animals/article/16853181,57957,3118,0.05379850579,"הספארי נפרד בכאב: שאול ה""דרקון"" הלך לעולמו","שאול, לטאת הכוח מסוג קומודו הגיע לפני עשור לספארי כחלק מניסיונות לשימור המין אשר הולך ונכחד • הוא נמצא בחצרו ללא רוח חיים, מטפליו כמו גם מבקרים רבים שהכירו אותו מתקשים להיפרד • מאז הגעתו, הוא היווה שגריר מצוין לבני מינו והיה חלק חשוב ממאמצי החינוך וההסברה של הספארי בנושא שימור זוחלים",2024-11-26T15:28:15.000Z,2024-11-26T15:30:49.000Z
https://www.israelhayom.co.il/animals/article/15791119,64370,6440,0.1000466056,כבר לא מעצמה: המעמד של ישראל נפגע – וזו הסיבה,"אם בעבר חלפו דרך הארץ מיליארד ציפורים בשנה, משבר האקלים הביא לצניחה של עשרות אחוזים במספרן • מה עוד פוגע בהן וכיצד פועלים בקק""ל לשמירה על ציפורי הבר? כל הפרטים",2024-05-22T10:34:38.000Z,2024-05-22T10:49:27.000Z
https://www.israelhayom.co.il/animals/article/15578939,62663,2737,0.04367808755,האם חיות מזהות את עצמן – ומה זה בעצם אומר עליהן?,"לא כל החיות עוברות את מבחן המראה, שבודק אם בעלי חיים מסוגלים לזהות את ההשתקפות של עצמם • כמה מחקרים שניסו לבחון את התחום מעבר למבחן, בדקו מה משמעות התוצאות",2024-04-10T13:33:04.000Z,2024-04-10T13:33:04.000Z
https://www.israelhayom.co.il/animals/article/15096413,57369,1467,0.02557130157,"""עולם שלא היינו מודעים לו"": ספירת הציפורים השנתית יוצאת לדרך","מאות אוהבי ציפורים ומתנדבים מתעדים ומדווחים בכל שנה על מיני ציפורים שונים אותן הם רואים באזור מגוריהם • כך, המשתתפים מבצעים פעילות מהנה, מתחברים לטבע – ואפילו מסייעים לחוקרים • איך תעשו זאת בעצמכם? כל הפרטים",2024-01-14T12:33:49.000Z,2024-01-14T12:49:59.000Z
https://www.israelhayom.co.il/animals/article/15896953,55727,2065,0.03705564628,לרגל חג השבועות: האם כדאי לתת מאכלי חלב לחתולים וכלבים?,"רבים נוהגים לשתף את חיות המחמד שלהם במאכלי החג – אך מסתבר שכל עוד הם אוכלים מזון מאוזן ומלא, הם לא זקוקים לתוספות שונות • אבל האם הם כדאי לתת להם לאכול פירות? זה מה שהמומחה ענה",2024-06-10T14:40:37.000Z,2024-06-10T14:49:31.000Z
https://www.israelhayom.co.il/animals/article/15750670,57396,2625,0.04573489442,בשורה מעודדת: גדילה משמעותית באוכלוסיית העופות שנודדים דרך ישראל,"לפי נתוני הספירה השנתית של הקורמורן הגדול, יותר מ-19 אלף פרטים נספרו ב-14 אתרים • ההערכה היא כי המספר גבוה אף יותר, שכן בשל המצב הביטחוני, לא בוצעה ספירה בשלושה אתרים בצפון הארץ",2024-05-15T13:50:07.000Z,2024-05-15T13:53:32.000Z
https://www.israelhayom.co.il/animals/article/15520146,57874,3857,0.06664478004,מי רוצה להפריד בין הציפור והכלבה שהפכו לחברות הכי טובות?,"הכלבה פגי התחברה לעקעק אוסטרלי בשם מולי, שהפכו לאושיות רשת של ממש במדינה • לאחר שהתפרסמו, הבעלים של הציפור נאלצו להעביר אותה לרשויות, שטענו שהוחזקה שלא כחוק – ועוררו סערה גדולה",2024-04-01T09:24:32.000Z,2024-04-01T09:24:32.000Z
https://www.israelhayom.co.il/animals/article/16049302,57826,1391,0.02405492339,"בית ספר לקופים: ""הם מגיעים אלינו ללמוד כיצד לתקשר עם קופים אחרים""","במקלט הקופים הישראלי מתגוררים מאות קופים, רבים מהם יוצאי מעבדות • מייסדת ומנהלת המקום שיתפה בתהליך שעוברים הקופים המגיעים אליו – וסיפרה על כמה חיבורים מרגשים במיוחד",2024-07-09T12:55:15.000Z,2024-07-09T12:55:15.000Z
https://www.israelhayom.co.il/animals/article/15229860,51166,2590,0.05061955205,המהלך שיטפל בתופעת זיווג ומכירת חתולים וכלבים,"הכנסת אישרה בקריאה טרומית הצעת חוק שנועדה לשים סוף לתעשייה האכזרית, שבה כלבות מוחזקות בכלובים כדי שיספקו לבעליהן גורים קטנים • כיצד ייפגעו אלו שיעברו על החוק – ואילו כלבים יוחרגו ממנו? כל הפרטים",2024-02-07T12:21:21.000Z,2024-02-07T14:40:26.000Z
https://www.israelhayom.co.il/animals/article/15009951,52799,1860,0.03522793992,חברם הטוב ביותר: הלוחמים שמספרים על חיות המחמד שלהם,"אחרי יותר מ-80 ימי לחימה, מפגש קצר של החיילים מהחזית עם חיית המחמד האהובה שלהם מספיק כדי להעניק להם אושר, אהבה וכוח • חמישה לוחמים מספרים על ""בן המשפחה הנוסף"" שלהם",2023-12-27T09:21:57.000Z,2023-12-27T09:21:57.000Z
https://www.israelhayom.co.il/animals/article/15462190,44240,1358,0.03069620253,"מיוחד לפורים: החיות ש""מתחפשות"" בכל יום","בעלי חיים רבים נוהגים להסוות את עצמם על מנת לשרוד את נחת זרועם של טורפים פוטנציאליים, או כדי להצליח לטרוף חיות אחרות בעצמם • מי נטמע במים בזכות גבו השחור ומי דואג דווקא להבליט את צבעיו? פרויקט מיוחד לחג",2024-03-21T09:53:53.000Z,2024-03-21T11:34:58.000Z
https://www.israelhayom.co.il/animals/article/16121251,49242,1447,0.02938548394,"מחקר חדש מגלה: כך צלופחים יכולים להשתלב בדנ""א של דגים אחרים","חוקרים גילו כי הזרם שצלופח חשמלי מייצר מסוגל לגרום לדנ""א שנמצא במים לחדור לתאים של דגי זברה • לאחר מכן, מצליח הזרם להשתלב בחומר התורשתי שלהם - וגורם בתורו לתופעה מופלאה",2024-07-22T10:16:34.000Z,2024-07-23T12:06:39.000Z
https://www.israelhayom.co.il/animals/article/16764085,48374,3893,0.08047711581,"מרעידן, זאבן וששן: מאילו עכבישים ארצישראליים צריך להיזהר?","לעכבישים יש יחסי ציבור גרועים, אבל בפועל מדובר בבעל חיים פחדן שמביא לבני האדם תועלת רבה • כך תוכלו לזהות אותם ולדעת מי מסוכן, ומי יעזור לכם להדביר מזיקים",2024-11-11T18:37:18.000Z,2024-11-13T12:08:10.000Z
https://www.israelhayom.co.il/animals/article/14871718,43366,1049,0.02418945718,הכלב בדיכאון מהחורף? הטיפים שיעזרו לכם לטפל בו,"מסתבר שגם חברו הטוב ביותר של האדם עלול לסבול מ""דיכאון עונתי"", תופעה המוכרת גם בבני אדם שנגרמת מחילופי עונות - ובעיקר בחורף • רוצים לסייע לכלב שלכם? קבלו את הטיפים של המומחים",2023-11-27T08:45:38.000Z,2023-11-27T08:45:38.000Z
https://www.israelhayom.co.il/animals/article/16844083,41428,783,0.01890026069,"הספארי מתחדש: שני סייחים מתוקים, זכר ונקבה, הצטרפו לאחרונה לעדר הזברות","הסייחים נולדו לפני שמונה ימים לשתי נקבות זברה שונות, משקלם מוערך בכ-30 ק״ג • הם מסתובבים בסוואנה האפריקאית וניתן לראותם לצד האמהות שלהם • קוראי ""ישראל היום"" מוזמנים להציע עבורם שמות, אותם נעביר לספארי",2024-11-25T11:14:34.000Z,2024-11-25T12:47:47.000Z
https://www.israelhayom.co.il/animals/article/14675937,41894,1441,0.0343963336,הכלב אוכל מזון מבוסס דגים? זה מה שאתם חייבים לדעת עליו,"ידוע שבדגים יש חלבון וחומצות שונות שתורמות לא רק לבני האדם, אלא גם לכלבים • מעבר לכך שאוכל שמתבסס על דגים מסייע לפרווה מבריקה, במה עוד הוא יכול לסייע בריאותית לחברו הטוב ביותר של האדם?",2023-11-07T11:50:39.000Z,2023-11-07T11:50:39.000Z
https://www.israelhayom.co.il/animals/article/15960486,39894,5592,0.1401714544,התוכנית של המדינה לטיפול בתופעת החתולים המשוטטים בארץ,"מיליוני שקלים יועברו לעשרות רשויות מקומיות לטיפול בתופעה, שבמסגרתה חיים בישראל כמיליון חתולים משוטטים • ""התמיכה תגדיל את יכולתן של רשויות חלשות כלכלית לקדם את הנושא, שלו השפעה ישירה על איכות חיי התושבים ורווחת החיות המשוטטות""",2024-06-24T05:30:25.000Z,2024-06-25T09:59:55.000Z
https://www.israelhayom.co.il/animals/article/14886582,41537,2750,0.06620603318,הכלבה בלה שוחררה מהשבי: כיצד בעלי חיים מתמודדים עם טראומה?,"לאחר ששהתה יותר מ-50 ימים בשבי חמאס עם מיאה ליימברג ואמה גבריאלה, גם בלה יצאה לחופשי • כיצד השהות המשותפת שלהן חיזקה אותן ואיך היא תוכל לחזור לשגרה שלפני החטיפה?",2023-11-30T10:05:12.000Z,2023-11-30T10:05:12.000Z
