Landing Page,Impressions,Url Clicks,URL CTR,title,subtitle,date_published,date_updated
https://www.israelhayom.co.il/animals/article/14902631,38131,1292,0.03388319215,יותר מסתם ליקוק: כך כלבים יכולים לסייע לאנשים שחוו אירועים טראומטיים,"ליטוף, ליקוק ומגע ישיר הם כמה מהדרכים שבהן כלבי שירות יכולים לעזור לפוסט-טראומטיים לנסות לחזור לשגרה • ""זו חיה לא שיפוטית שתמשיך לאהוב את בעליה ללא סייג – וזאת תמיכה בעלת עוצמה והשפעה רבה""",2023-12-04T09:52:13.000Z,2023-12-04T09:52:13.000Z
https://www.israelhayom.co.il/animals/article/16929604,37751,1015,0.02688670499,"התרגשות גדולה בספארי: ""רעי"" הקרנף נולד בסוואנה של רמת גן","ריהאנה, קרנפה רחבת שפה בת 15, ילדה את הגור הרביעי שלה במשקל 50 ק""ג • הספארי העניק לו את השם ""רעי"" כמסר של תקווה ואחדות ברוח התקופה • הקרנף הקטן יבלה את השבועות הקרובים במתחם מבודד לפני שיצטרף לשאר הקרנפים בסוואנה",2024-12-09T08:31:51.000Z,2024-12-09T08:31:51.000Z
https://www.israelhayom.co.il/animals/article/15002156,39011,1779,0.04560252237,רק אתם תחליטו: מי תהיה ציפור השנה של ישראל?,"כמדי שנה, גם ב-2023 מתקיימת התחרות - שיכולה אפילו לספק מעט אסקפיזם ברקע המלחמה • מיהן המועמדות השנה, מה הסיפור שלהן - ואיך אפשר להצביע ולהשפיע? כל הפרטים",2023-12-26T07:15:21.000Z,2023-12-26T08:58:20.000Z
https://www.israelhayom.co.il/animals/article/17503999,39284,1050,0.02672843906,לאן נעלמו הפרפרים? ירידה של כ-34 אחוז במספרם בישראל מאז שנת 2000,51 מתוך 133 מיני הפרפרים המקומיים מוגדרים בסכנת הכחדה • מחקר חדש מציג נתונים בעייתים גם בארצות הברית • הצניחה במספר הפרפרים היא סימן מדאיג למצב מצב המערכת האקולוגית כולה,2025-03-09T10:08:33.000Z,2025-03-09T10:08:33.000Z
https://www.israelhayom.co.il/animals/article/17522625,39462,925,0.02344027165,לסקרן את הגורילה: תלמידים בנו אטרקציות מיוחדות לבעלי החיים בספארי,"התלמידים תכננו ובנו שידות ייחודיות המיועדות לאתגר את הגורילות, השימפנזים וחיות נוספות בגן החיות • ""פרויקט זה מדגים את ההשפעה המשמעותית של העשרה סביבתית על חיות הבר, ואת החשיבות של שילוב מחקר מדעי עם יצירתיות חינוכית"", אומרת המורה האחראית על המיזם",2025-03-11T17:40:58.000Z,2025-03-13T08:30:24.000Z
https://www.israelhayom.co.il/animals/article/16044264,28970,1394,0.04811874353,"""סלבס שקונים כלבים הם חלק משרשרת נוראית של ניצול, התעללות ומוות""","כשקרן פלס פרסמה שקנתה כלב, הרשת געשה – אבל לא נראה שרבים טרחו בכלל להתעמק במשמעות הקשה של המעשה • תעשיית הכלבים הגזעיים יוצרת בעיות קשות מאוד שגורמות לכלבות לשמש כמכונות לייצור גורים, מה שגורם, בין היתר, לכך שאלפי כלבים בריאים מומתים בישראל בכל שנה",2024-07-08T14:30:55.000Z,2024-07-18T11:52:19.000Z
https://www.israelhayom.co.il/animals/article/15726203,32573,3756,0.1153102263,"לאחר ש-12 לוחמים הגיעו לביה""ח: עד כמה צרעות מסוכנות לנו, ואיך מתמודדים?","בעקבות המקרה החריג בו 11 לוחמים נפצעו קל ועוד אחד בינוני, לאחר שעלו על קן צרעות ברצועת עזה, יצאנו לבדוק עד כמה עקיצתן עלולה לפגוע באדם • ואם נעקצים - אלו התסמינים, איך תתמודדו איתם - ובאילו מקרים עליכם לפנות לטיפול רפואי?",2024-05-10T13:30:46.000Z,2024-05-10T17:51:33.000Z
https://www.israelhayom.co.il/animals/article/15377732,30154,932,0.03090800557,בדרך לקריאה ראשונה: רשויות מקומיות יוכלו להקים מאגר DNA לצואת כלבים – לצורך אכיפה,"במהלך דיון בוועדת הכלכלה בכנסת, עלה כי אף משרד לא רוצה לקבל אחריות על יישום הצעת החוק • ח""כ שירי: ""ההצעה לא עוסקת רק בלא לדרוך בקקי, היא אמורה להתמודד עם הבעיה"" • יו""ר הוועדה ח""כ ביטן ביקש לבחון להטיל אחריות ליישום החוק על השלטון המקומי • למרות זאת, בעלי הכלבים לא יחויבו למסור דגימת דנ""א",2024-03-06T13:06:45.000Z,2024-03-06T13:56:08.000Z
https://www.israelhayom.co.il/animals/article/16074760,31371,904,0.02881642281,לאחר שחולצו מהאש: הנשרים שניצלו מהשריפה בצפון הושבו לכלובם,"כמה ימים לאחר שששת הנשרים פונו משמורת הטבע גמלא בעקבות הדליקה שפרצה בסמוך לכלובים שבהם שהו – הם הוחזרו אליהם בריאים ושלמים • ""הם היו פחות לחוצים מהחילוץ עצמו, אז ההשבה הייתה פשוטה יותר""",2024-07-14T09:44:46.000Z,2024-07-14T09:44:46.000Z
https://www.israelhayom.co.il/animals/article/17346611,29070,3535,0.1216030272,"""רגע לפני שהאדמה רועדת, החמורים שלי בוכים""","גיורגוס סיריגוס מסנטוריני מגדל חמורים ופרדות שסוחבים את התיירים בהרי האי • הוא החליט להישאר באי הרועד בכל יום: ""אני לא מפחד, אבל החמורים שלי כן"" • בבירת האי, פירה, אנטוניס מנסה להרגיע את מאות הכלבים והחתולים שנותרו מאחור",2025-02-12T07:40:42.000Z,2025-02-12T07:40:42.000Z
https://www.israelhayom.co.il/animals/adoption/article/15141209,26891,1758,0.06537503254,דווקא עכשיו: הכלבים והחתולים שמחכים לבית חם | פינת האימוץ,"המתוקים שתראו פה מחכים לבית חם שייקח אותם באהבה לחיים מאושרים ומלאי ליטופים וליקוקים • הכירו את אוליבר, ניקו, פינצ'י, דנונה, לונה, פרינס, תאיר, מילקי ועוד – ואמצו אותם עוד היום",2024-01-28T10:27:08.000Z,2024-01-28T10:27:08.000Z
https://www.israelhayom.co.il/animals/article/15236281,26716,837,0.03132954035,שוקלים לאמץ כלב? אלו היתרונות בגידולו כחיית מחמד,"מעבר לתפיסתו כחברו הטוב ביותר של האדם, הכלב עושה פלאים לרווחת בעליהם – גם ברמה הפיזית והרגשית • איך כלבים מסייעים להתמודד עם בדידות, עוזרים לילדים ולקשישים – ואפילו שומרים על הבריאות שלנו?",2024-02-08T12:24:30.000Z,2024-02-08T12:30:19.000Z
https://www.israelhayom.co.il/animals/article/15043321,28584,702,0.02455919395,הכלב נרטב בגשם? הטיפים האלה יעזרו לכם לשמור על הפרווה שלו בחורף,"שגרת טיפוח קבועה היא דבר חשוב מאוד עבור כל כלב, והעונה הקרה של השנה לא שונה בכך • כדי שהוא לא יחווה קור או רטיבות וכמובן שלא יקבל זיהום, קבלו כמה עצות שיעזרו בשמירה על פרוות חברכם הטוב ביותר",2024-01-03T10:52:25.000Z,2024-01-03T10:53:29.000Z
https://www.israelhayom.co.il/animals/article/16835756,27396,1936,0.07066725069,נתפסו ציידים לא חוקיים: בזבוז הלבנון הנדיר ניצל והושב לטבע,"23 ציפורי שיר, בהן שלושה בזבוזי לבנון בסכנת הכחדה עולמית, נתפסו במבצע אכיפה באזור חברון • הציידים השתמשו ברשתות וקשרו ציפורי פיתיון • החשודים יועמדו לדין • ""מתמודדים עם תופעה רחבה של סחר לא חוקי""",2024-11-24T07:20:37.000Z,2024-11-24T07:20:37.000Z
https://www.israelhayom.co.il/animals/article/15261833,27142,1146,0.04222238597,גם החיות חוגגות אהבה: דרכי החיזור המוזרות של בעלי החיים,"לקראת הוולנטיין יצאנו לבדוק את ההרגלים הרומנטיים של החיות • אלה שמביאים מתנות רעילות, אלה שחושבים שאבן זו מתנה, אלה שנותנים בחינם ועוד",2024-02-13T14:53:29.000Z,2024-02-14T09:19:21.000Z
https://www.israelhayom.co.il/animals/article/14816036,25669,565,0.02201098601,למרות המלחמה: צפו בעגורים שהגיעו לאגמון החולה,"העגורים הרבים מצטרפים לעשרות אלפי הציפורים שכבר הגיעו למקום, שמזכירים שהטבע ממשיך בשלו • ""האגמון, שסגור למבקרים בשל המצב הביטחוני, מהווה תחנת עצירה קריטית לציפורים הנודדות בין אירופה לאפריקה – וחזרה""",2023-11-13T09:45:16.000Z,2023-11-13T09:45:16.000Z
https://www.israelhayom.co.il/animals/article/15182532,25744,1219,0.04735083903,הראם שהיה צריך לעבור טיפול מיוחד בעינו הימנית,"כדי לטפל בראמים בחי בר ביטבתה, צריך לבדוק אותן בהרדמה – משימה לא פשוטה כשמדובר בחיות שמגיעות למשקל של עשרות ואף מאות קילוגרמים • כיצד בוצע בו הטיפול והאם הוא הצליח? כל הפרטים",2024-01-29T10:56:02.000Z,2024-01-29T11:29:10.000Z
https://www.israelhayom.co.il/animals/article/15035655,24273,558,0.02298850575,"""אנו יכולים לתמוך בציפורים הנודדות גם במקום מגורינו""","ספר הילדים ""קוטן בוטן"" של ורד לבר, העוקב אחר ילדה שמחליטה להציל גוזל ולגדלו עד שתשחררו לטבע, קיבל משמעות חדשה מאז פרצה המלחמה: ""הוא מראה שבכל זאת יש אהבה בעולם"" • בנה יוחאי, שדמות הילדה מבוססת עליו: ""גם אם לפעמים זה נראה חסר סיכוי, יחד נוכל להעניק לטבע חיים""",2024-01-02T10:14:36.000Z,2024-01-02T10:14:36.000Z
https://www.israelhayom.co.il/animals/article/16198616,26277,785,0.02987403433,לא רק חברו הטוב של האדם: כל העובדות הכי חשובות על כלבי נחייה,"לרגל יום כלבי הסיוע והנחייה, אספנו עבורכם כמה עובדות שאתם חייבים להכיר עליהם – שיוכלו לעזור לכם להבין כיצד לסייע בעצמכם לאלו שצריכים את עזרת הכלבים • כל הפרטים",2024-08-04T11:27:22.000Z,2024-08-04T11:27:22.000Z
https://www.israelhayom.co.il/animals/article/16162400,25055,3775,0.1506685292,מזעזע: עשרות כלבים חולצו מפנסיון שבו הוחזקו בתנאים מחפירים | חשיפה,"פקחי משרד החקלאות שפשטו על המקום גילו בו 23 כלבים במצב גופני ירוד, כשהם מלוכלכים ומזוהמים – ושעל גופם נמצאו, בין היתר, צלקות מזיהום, טפילי עור ואף קצוות אוזניים אכולות • חלק מהכלבים הוחזקו בכלובים שהיו קטנים לגודלם • בעלי הפנסיון חשוד גם שהקים במקום בית הרבעה",2024-07-29T11:46:42.000Z,2024-07-29T12:19:15.000Z
https://www.israelhayom.co.il/animals/article/16376176,23744,2062,0.08684299191,"מקרה חריג בנתב""ג: תושב ירושלים ניסה להבריח עשרות נחשים במזוודה",יחידה 747 במרחב נמל התעופה בן גוריון עיכבה את הנוסע ומצאה במזוודתו את הנחשים מסוגים שונים האסורים ביבוא • פקחי רשות הטבע והגנים והשירות הווטרינרי ינסו להשיב את הזוחלים לארצם,2024-09-03T06:35:11.000Z,2024-09-03T06:36:40.000Z
https://www.israelhayom.co.il/animals/article/16761383,21058,1286,0.0610694273,עוברים דירה עם חתול? כך תעשו את זה כמו שצריך,"מעבר דירה הוא שינוי משמעותי בשבילכם, ופי כמה וכמה בשביל החתול שלכם • אפשר להקל על הסיטואציה המלחיצה בכמה צעדים פשוטים, שיהפכו את המעבר לנעים ונטול סטרס",2024-11-11T14:15:18.000Z,2024-11-11T14:15:18.000Z
https://www.israelhayom.co.il/animals/article/14702563,22428,934,0.04164437311,מה צריך לעשות בזמן אזעקה כשמטיילים עם הכלב מחוץ לבית?,"בזמן שמלחמת ""חרבות ברזל"" נמצאת בעיצומה, חיות המחמד עדיין צריכות להמשיך בשגרה שלהן • אז מה עושים אם יש אזעקה כשאתם מחוץ לבית והאם מותר להכניס כלבים למיגוניות?",2023-10-12T12:57:05.000Z,2023-10-12T12:57:05.000Z
https://www.israelhayom.co.il/animals/article/14844598,18026,2163,0.1199933429,גיבור על ארבע: כלב של יחידת עוקץ נהרג בעזה – והציל חיים,"במהלך פעילות של כוחות צה""ל בצפון הרצועה, הם שלחו את טייגה בן ה-3 לאתר מחבלים במבנה בעזה • לאחר שנתקל ב-5 מחבלים, הם ירו לעברו והרגו אותו • בהמשך, הכוחות חיסלו אותם",2023-11-20T11:24:54.000Z,2023-11-20T12:31:45.000Z
https://www.israelhayom.co.il/animals/article/16123137,22657,1716,0.07573818246,מחשש לקדת הנילוס המערבי: זה מה שאתם צריכים לעשות אם ציפור מתה בביתכם,"במטרה לבצע מעקב ארצי אחר מקרי תחלואה בעופות, משרד החקלאות פרסם דרך חדשה לדווח על החשש מהקדחת, שהוכחה כשיטה יעילה לניטור שלה • כל הפרטים",2024-07-22T13:58:20.000Z,2024-07-22T14:53:40.000Z
https://www.israelhayom.co.il/animals/article/17534032,16525,804,0.04865355522,"ה""ריאליטי של הטבע"" חזר: קינוני הנשרים והטיפול בגוזלים יועברו בשידור חי","סיפורם של ""הנשר האלמן"", בת זוגו החדשה וארבעת הגוזלים הצעירים שלהם ריגש מיליוני צופים ברחבי העולם בשנים האחרונות • גם בעונה החדשה של ""עופות דורסים בשידור חי"" ניתן יהיה לצפות בהם, כמו גם בעקבים, רחמים ועיטים נוספים •",2025-03-13T10:48:15.000Z,2025-03-13T10:51:02.000Z
https://www.israelhayom.co.il/animals/article/15741841,17581,2272,0.1292304192,"""חשש שהאם תתקוף ילדים"": 12 גורי תנים נמצאו בבית הספר במרכז הארץ","בעקבות פניות הורים מודאגים, הגורים הובאו למרפאה של עמותת ""למען חיות הבר"" • מייסד העמותה, אביהוא שרווד: ""קוראים לציבור לסייע לנו במימון ההוצאות כדי שנוכל להעניק טיפול מיטבי לכולם""",2024-05-13T19:08:31.000Z,2024-05-14T14:05:34.000Z
https://www.israelhayom.co.il/animals/article/15318162,16172,1264,0.07815978234,מחווה מרגשת: הנצחה לכלבי עוקץ שמתו במלחמה,"פארקי הכלבים בפתח תקווה ייקראו על שמותיהם של 18 כלבי יחידת הכלבנים, שנהרגו במהלך הלחימה מ-7 באוקטובר ועד היום • ראש העיר רמי גרינברג: ""פועלים גם להנצחת הכלבים שסייעו לכוחותינו בלחימה בשטח האש, תוך הקרבת חייהם""",2024-02-25T06:00:12.000Z,2024-02-25T08:59:29.000Z
https://www.israelhayom.co.il/animals/article/16700075,16903,919,0.05436904691,מחליקים ימינה: האפליקציה שתמצא עבורכם את חיית המחמד המושלמת,"שאלוני אישיות שמתאימים את החתול או הכלב לאורח החיים שלכם וליווי צמוד גם אחרי האימוץ: תכירו, הטינדר לכלבים והחתולים שימצא לכם את ההתאמה המושלמת",2024-10-31T13:44:31.000Z,2024-10-31T16:07:01.000Z
https://www.israelhayom.co.il/animals/article/15481608,17682,516,0.02918221921,"מיקה, לאקי או ג'ניפר לופז? אלה שמות הכלבים הפופולריים ביותר בארץ",כ־64 אלף כלבים חדשים נרשמו בשנה שעברה במאגר המרכז הארצי לרישום כלבים – כמעט 29 אלף מהם גורים • הישראלים הציגו יצירתיות בבחירת השמות לחברם הטוב ביותר – שיוכל למצוא לעצמו הכי הרבה חברים בעלי זנב בתל אביב,2024-03-25T07:53:48.000Z,2024-03-25T16:30:28.000Z
https://www.israelhayom.co.il/animals/article/17175970,13737,966,0.07032103079,"""ברבריות נוראה"": מרוקו מתכננת להרוג 3 מיליון כלבים לקראת מונדיאל 2030","המונדיאל שיתקיים בין היתר במדינה הצפון אפריקאית מביא להמתה של כלבים בדרכים שונות, בהן הזרקת רעל, ירי, ובתי מטבחיים  • ארגוני בעלי חיים קראו לפיפ""א לפעול בהקדם נגד ההרג השיטתי - אך היא מצידה טרם התייחסה",2025-01-18T12:58:11.000Z,2025-01-18T13:17:46.000Z
https://www.israelhayom.co.il/animals/article/15676464,12895,674,0.05226832105,תגלית נדירה: נמצא מין שפירית חדש בישראל,"בקיבוץ נאות סמדר שבערבה, התגלתה שפירית שלא תועדה עד כה בארץ • עדיין אין שם רשמי בעברית, אך ניתן לה השם הזמני ""מלקטית סיני"" • ""לאחר שנים רבות של תצפיות וסקרים ישנם עדיין פערי ידע משמעותיים בהבנה של תפוצת חרקים""",2024-05-01T10:21:38.000Z,2024-05-01T10:21:38.000Z
https://www.israelhayom.co.il/animals/article/14985746,14936,1551,0.1038430637,"שותפים לדרך: לוחם מ""עוקץ"" וכלבו נפצעו בפעילות מבצעית - ואושפזו יחד","לאחר שה' נפצע ברצועת עזה, הוא פונה לבית החולים סורוקה לצד כלבו סאטר, שהובהל יחד איתו לחדר הטראומה אחרי שנפצע בעצמו בפעילות • לאחר שמצבו הרפואי השתפר, סאטר  השתחרר - וה' עצמו צפוי להשתחרר בקרוב מאוד, ולהיפגש עם כלבו האהוב",2023-12-21T13:43:42.000Z,2023-12-21T16:15:59.000Z
https://www.israelhayom.co.il/animals/article/15810187,13511,651,0.04818296203,איפה בישראל תוכלו לראות את אחד המעופפים הקדומים ביותר?,"עשרות מיני שפיראים פוקדים כיום את אגמון החולה – ויוצרים מחזות מרהיבים, עם מגוון רחב של זנים וצבעים • מדוע הם כה חשובים למערכת האקולוגית שלנו ולאיזו מהירות גבוהה הם מסוגלים להאיץ בתוך שנייה בלבד? כל הפרטים",2024-05-26T09:40:35.000Z,2024-05-26T12:25:58.000Z
https://www.israelhayom.co.il/animals/article/17097920,14132,868,0.06142088876,"רומן, בגידה ושברון לב: סיפור אהבה מסעיר את הפינגווינים בספארי","טלנובלה אמיתית מתרחשת בקהילת הפינגווינים האפריקניים • במרכז הסיפור צ'ופצ'יקוני שעזבה את בת זוגה סוקי והתחברה לנועם המבוגר • אח""כ בגדה בו עם פינגווין צעיר, בעוד נועם מצא נחמה בזרועותיה של דמקה •  כשהמאהב הצעיר מת, חזרה צ'ופצ'יקוני לנועם ודמקה נותרה שבורת לב",2025-01-06T06:35:04.000Z,2025-01-06T06:36:57.000Z
https://www.israelhayom.co.il/animals/article/15942718,12342,850,0.06887052342,לפני שחיית המחמד תחלה: זה מה שאתם צריכים לעשות,"כל מי שיש לו חתול או כלב, נאלץ מתישהו לשלם סכומים שונים עבור טיפול רפואי עבור החיה שלו • ישנה דרך לחסוך את התשלום הזה, שעלול להיות לא מבוטל, שהופכת פופולרית יותר ויותר",2024-06-20T08:02:14.000Z,2024-06-20T08:02:14.000Z
https://www.israelhayom.co.il/animals/article/15714640,11567,761,0.06579061122,הספארי באבל: השימפנזה המבוגרת ביותר הלכה לעולמה,"שושי, שמתה כשהיא בת כ-60, נראתה לאחרונה כשהיא עייפה וחלשה • השימפנזים האחרים בספארי היו לידה כאשר נשמה את נשימתה האחרונה, ולאחר מכן חלקו לה כבוד אחרון",2024-05-08T11:15:54.000Z,2024-05-08T11:31:43.000Z
https://www.israelhayom.co.il/animals/article/15371613,10870,989,0.09098436063,"""הרג הכלבים המשוטטים יחמיר את המצב"": האם ניתן לפתור את הבעיה בדרום הארץ?","במשרד החקלאות יעבירו כ-2 מיליון שקלים לטיפול בנושא, כשלפי תזכיר תיקון לחוק – פקחי המשרד יוכלו להרוג הכלבים בשטח אופן מיידי • יעל ארקין, מנכ""לית ""תנו לחיות לחיות"": ""המצב רק יחמיר את הבעיה""",2024-03-05T15:20:25.000Z,2024-03-31T14:20:16.000Z
https://www.israelhayom.co.il/animals/article/15327550,12802,617,0.04819559444,בזכות החיילים: יעל פצוע טופל – ושוחרר בחזרה לטבע,"מילואימניקים שמשרתים בהרי אילת הבחינו ביעל שהתקשה ללכת ושלא ברח כשהתקרבו אליו • פקח רשות הטבע והגנים הגיע אליהם עם וטרינר, ואלה מצאו ברגל החיה קוץ עצום – אותו שלפו בקלות, מבלי שהיה צורך לקחת את היעל להמשך טיפול",2024-02-26T11:27:54.000Z,2024-02-26T11:27:54.000Z
https://www.israelhayom.co.il/animals/article/15272105,11248,1317,0.1170874822,"""קיווה שכמה שיותר ימותו"": תושב בית שמש הורשע בהרעלת חתולי רחוב","לפי כתב האישום שהוגש נגד המדביר לשעבר יהודה ביטון, לפחות שישה חתולים מתו בייסורים מרעל שהוא החדיר לפיתיונות שהציב סמוך לביתו • הוא טען שהוא רק רצה להרחיק חתול אחד מהאזור - וכי לא הומתו חיות אחרות",2024-02-15T11:04:31.000Z,2024-02-15T14:14:54.000Z
https://www.israelhayom.co.il/animals/article/16094199,10637,391,0.03675848454,לא רק לכם חם בטירוף: כך תשמרו על הכלבים שלכם ממכת חום,"ככל שמזג האוויר נהייה חם יותר ויותר, גם כלבים עלולים לסבול מהתחממות יתר – מה שעלול לגרום להם לנזקים רבים • מומחית סיפקה כמה טיפים שיגרמו לכלב שלכם לשמור על רעננותו – וגם על הבריאות שלו",2024-07-17T10:41:52.000Z,2024-07-17T10:41:52.000Z
https://www.israelhayom.co.il/animals/article/14868804,9354,1066,0.1139619414,מרגש: הילדות ששוחררו משבי חמאס נפגשו עם כלביהן,"אמילי הנד בת ה-9 והילה רותם בת ה-14 פגשו לאחר שחרורן לא רק את בני משפחתן, אלא גם את הכלבים שלהן • סגן מנהל ביה""ח ספרא סיפר: ""הן שמחו לראות את הכלבים, שהקנו להן תחושת ביטחון""",2023-11-26T15:08:22.000Z,2023-11-26T16:54:49.000Z
https://www.israelhayom.co.il/animals/article/16723396,9253,767,0.08289203502,תופעת טבע ייחודית: מדוע שוניות האלמוגים של אילת הלבינו?,"העלייה חסרת התקדים בטמפרטורת המים כתוצאה מגל החום הקיצוני של עונת 2024 משנה את גן העדן הדרומי במפרץ אילת • כתוצאה מכך, לראשונה בצפון מפרץ אילת, נרשם השנה אירוע משמעותי של הלבנת אלמוגים • למרות חוסנן הידוע, גם שוניות אילת הוכרעו עקב עומס החום המצטבר שהיה גבוה פי 3.75 מזה שגורם לאירועי הלבנה חמורים בשוניות אחרות בעולם",2024-11-05T06:59:16.000Z,2024-11-05T07:00:34.000Z
