Landing Page,Impressions,Url Clicks,URL CTR,title,subtitle,date_published,date_updated
https://www.israelhayom.co.il/viralai/article/14934760,3174,184,0.05797101449,מהבת של אלוויס ועד מת'יו פרי: המפורסמים שלא ייחגגו איתנו את הסילבסטר,"רגע לפני סיומה של 2023, חזרנו, עם קצת עזרה מ-Bard, להיפרד מענקי הבידור שכבר אינם איתנו - מטופול וליסה פרסלי, דרך טינה טרנר וג'רי ספרינגר ועד מת'יו פרי",2023-12-11T12:26:29.000Z,2023-12-11T13:22:06.000Z
https://www.israelhayom.co.il/viralai/article/14890813,3266,214,0.06552357624,מדענים נגד מאסק: כדי להגיע למאדים הוא הורס את כדור הארץ,הטילים של SpaceX מבטיחים להביא את האנושות למאדים – אבל באיזה מחיר? מדענים חוששים שהטילים עלולים לגרום להשלכות בלתי צפויות על החיים בכדור הארץ,2023-11-30T15:01:57.000Z,2023-11-30T15:01:57.000Z
https://www.israelhayom.co.il/viralai/article/15230241,2974,284,0.09549428379,מי זוכר? כך תוכלו לזכור כל דבר שאתם יכולים להעלות על הדעת,מתקשים לזכור רשימות קניות או פרטים חשובים אחרים? יש שיטה פשוטה למדי ויעילה בטירוף שהופכת כל אחד לאשף זיכרון שמסוגל לשלוף פרטים מהמוח ברגע. כתבה שכדאי לזכור,2024-02-10T05:41:13.000Z,2024-02-10T05:41:13.000Z
https://www.israelhayom.co.il/viralai/article/15149699,3045,177,0.05812807882,"האוניברסיטה תארח מרצים מחו""ל – בלי להטיס אותם לקמפוס","אוניברסיטה באנגליה שמנסה לצמצם את הטיסות המזהמות של מרצים מחו""ל התחילה לנסות מערכת שמאפשרת למרצים מחו""ל להופיע כהולוגרמות מול הסטודנטים",2024-01-23T11:54:22.000Z,2024-01-23T11:54:22.000Z
https://www.israelhayom.co.il/viralai/article/14866501,3151,381,0.1209139956,זו הסיבה שאנחנו עדיין תקועים עם מטוסים איטיים,"מצד אחד, יותר ויותר חברות מפתחות טילי שיגור לחלל המגיעים למהירויות אדירות. מצד שני, המטוסים שלנו עדיין טסים באותה מהירות כמו לפני 50 שנה. סיפורו של המטוס שניסה לפרוץ את גבולות המהירות – ונכשל כישלון מהדהד",2023-11-26T07:13:33.000Z,2023-11-26T11:11:03.000Z
https://www.israelhayom.co.il/viralai/article/16009285,3058,282,0.09221713538,6 דרכים להציל יום רע - מלהיות גרוע ממש,"גם אם נראה שהכל אבוד, מצב טוב שזה לא המצב. נסו את הדברים הבאים, מה יש לכם להפסיד?",2024-07-02T11:30:24.000Z,2024-07-02T11:30:24.000Z
https://www.israelhayom.co.il/viralai/article/16523645,3256,199,0.06111793612,כל מה שלא רציתם לדעת על ממתיקים מלאכותיים,"ממתיקים מלאכותיים: הפתרון המתוק לדילמת הסוכר או מקור לדאגות בריאותיות? במשקה הדיאטטי שלכם או בקינוח ""ללא סוכר"", הם כאן כדי להישאר • אבל מה באמת מסתתר מאחורי ההבטחה למתיקות ללא רגשות אשם? חשיפת כל מה שלא רציתם לדעת על ממתיקים מלאכותיים",2024-09-30T09:56:22.000Z,2024-09-30T09:56:22.000Z
https://www.israelhayom.co.il/viralai/article/15982282,3001,84,0.02799066978,אירוע נוצץ של מגזין ווג בפריז • מי לבשו שמלות שבקושי שם?,"אירוע אופנה מרהיב, ""ווג עולם"", של מגזין האופנה שהתקיים בפריז, הפך את כיכר ונדום ההיסטורית למסלול תצוגה מרהיב, עם נוכחות של זמרים, דוגמניות-על וכמובן, אייקוני ספורט, רגע לפני פתיחת המשחקים האולימפיים בבירת צרפת. מה לבשו? אופנה מקורית ויוצאת דופן, במיוחד השלוש להלן",2024-06-27T10:42:12.000Z,2024-06-27T12:12:09.000Z
https://www.israelhayom.co.il/viralai/article/16850553,2752,204,0.07412790698,השוקולד מדובאי שמשגע את אירופה,סרטון טיק-טוק עם מעל 90 מיליון צפיות הפך את 'שוקולד דובאי' לטרנד עולמי. יצרנית השוקולד תתחיל לייצר גרסא מקומית שלו,2024-11-26T13:11:59.000Z,2024-11-26T13:11:59.000Z
https://www.israelhayom.co.il/viralai/article/15005111,2820,117,0.0414893617,מדוע יהודים אוכלים אוכל סיני בחג המולד?,"בימים הקדחתניים של עונת החגים, מתגלה מסורת מסקרנת. מסתבר שיהודי ארצות-הברית נוהגים כבר שנים בחג המולד לאכול במסעדות סיניות. כשריח רוטב הסויה ונקישת צ'ופסטיקס ממלאים את האוויר, קשה שלא לתהות: מדוע יהודים אוכלים אוכל סיני בחג המולד?",2023-12-26T08:21:30.000Z,2024-06-11T18:50:43.000Z
https://www.israelhayom.co.il/viralai/article/15678774,2684,159,0.05923994039,הולנד נפרדת? הסמל הלאומי בסכנה,"מה שנחשב בעבר ל""זהב ההולנדי"" נפגע באופן משמעותי מהמצב הנוכחי בעולם, וייתכן שבשנים הקרובות ימות לגמרי. האם השיגעון הלאומי באמת הולך להיעלם?",2024-05-01T13:19:56.000Z,2024-05-01T13:19:56.000Z
https://www.israelhayom.co.il/viralai/article/15260135,2936,344,0.1171662125,7 סימנים שהגיע הזמן לסיים את מערכת היחסים הרומנטית שלכם ולהיפרד,"בעוד שזוגיות יכולה להיות חוויה מתגמלת, עלינו להיות מסוגלים להבחין אם מערכת היחסים תומכת בצמיחה שלנו או חונקת אותה. עלינו גם לדעת להבדיל בין קשיים נפוצים שניתן לטפל בהם, לעומת דגלים אדומים שמסמנים את סוף הקשר, כמו השבעה להלן",2024-02-13T10:53:06.000Z,2024-02-13T14:58:25.000Z
https://www.israelhayom.co.il/viralai/article/15243980,2858,279,0.09762071379,רגועים ויוצרים קשר עין: השיטות של שקרנים להוליך אתכם שולל,"אנחנו בני אדם, לא מכונות פוליגרף מהלכות. אבל אנחנו יכולים להיעזר בטכניקות כדי לזהות מתי אנשים לא ישרים איתנו ביתר קלות. איך שקרנים גדולים מצליחים להפיל שולל? ואיך מזהים אותם?",2024-02-10T16:00:58.000Z,2024-02-12T09:04:23.000Z
https://www.israelhayom.co.il/viralai/article/14929046,2934,176,0.05998636673,צפו בשידור החי: מאסק משגר לראשונה מטוס לחלל,"אחרי ששיגר לוויינים, אספקה ואסטרונאוטים לתחנת החלל הבינלאומית, הלילה תשגר החברה של אילון מאסק מטוס צבאי למשימה מסווגת סביב כדור הארץ. צפו",2023-12-10T10:25:49.000Z,2023-12-10T10:25:49.000Z
https://www.israelhayom.co.il/viralai/article/15001646,2706,246,0.09090909091,"יותר מדהים מיירוטים של ""כיפת ברזל"": הסיבה שאירופים התחילו לצלם את השמים","בשבוע האחרון עולים לרשת המוני סרטונים של תושבי צפון אירופה שמכוונים את מצלמותיהם אל השמים בכל ערב. הסיבה לכך אינה אמונה בכך שהם עומדים לצלם יירוטים, אלא תופעת טבע צבעונית ויפה במיוחד",2023-12-25T14:22:25.000Z,2023-12-25T14:22:25.000Z
https://www.israelhayom.co.il/viralai/article/14826811,2865,292,0.1019197208,עברה ביניהם מייגן: כך הידרדרה מערכת היחסים בין הנסיך הארי למשפחתו,"המלך צ'ארלס חגג השבוע את יום הולדתו ה-75. בנו, הארי, לא טרח להופיע לאירוע, ולפי הדיווחים הסתפק בשיחת טלפון ובהודעת וידאו שבה שרו ילדיו ""יום הולדת שמח, סבא"". זו שורת האירועים שהובילו לנתק במשפחת המלוכה",2023-11-16T06:16:30.000Z,2023-11-27T08:46:46.000Z
https://www.israelhayom.co.il/viralai/article/15307373,2780,403,0.1449640288,הגיע הזמן לומר את האמת על עבודה מהבית,"עם כל הכבוד ליכולת לעבוד מכל מקום ובכל זמן, מחקר חדש מצביע על כך שעבודה מהבית פוגעת לא רק במעסיקים, אלא גם בעובדים עצמם",2024-02-22T09:31:59.000Z,2024-02-22T09:31:59.000Z
https://www.israelhayom.co.il/viralai/article/17144346,2733,143,0.05232345408,"קרואסון, קפה ושיר בלב: שלושת ארוחות הבוקר הטובות ביותר בפריז","היכן למצוא את ארוחות הבוקר הכי טובות בפריז? בואו לגלות שלושה מקומות שמגישים חוויה צרפתית מלאה – עם קרואסונים חמאתיים, קפה משובח, ונוף שלא משאיר מקום לספק: זו בירת הבוקר האמיתית",2025-01-13T16:01:40.000Z,2025-01-13T16:01:40.000Z
https://www.israelhayom.co.il/viralai/article/14983267,2668,234,0.08770614693,חגיגות 60: זה האמן הישראלי שבראד פיט והחברה חגגו איתו,"הכוכב ההוליוודי וזוגתו נצפו בבירה הצרפתית במסגרת עוד אירוע יום הולדת, והפעם מלון יוקרה ליד כיכר קונקורד, בלונים כסופים בצורת '60' והופעה של אסף אבידן. למוחרת, יום הולדתה של הבתזוג, הם שבו ללוס-אנג'לס לעוד מסיבה",2023-12-21T07:16:40.000Z,2024-06-11T19:17:26.000Z
https://www.israelhayom.co.il/viralai/article/15300991,2615,568,0.217208413,האיפור הטיל צל על בן: ג'ניפר לופז בעוד מראה שטיח בלתי נשכח,"בהקרנת הבכורה של סרטה החדש 'This Is Me...Now: A Love Story', ג'יי לו הציגה מראה עוצר נשימה ושידרה ויברציות שמימיות. לשמלת הקוטור וכמובן גם לבן אפלק שהתלווה אליה היה חלק בגלאם ההוליוודי הכולל, אבל האיפור באדיבות קו ג'יי לו ביוטי של עצמה, היה המגנט האמיתי",2024-02-21T10:02:59.000Z,2024-02-21T10:08:00.000Z
https://www.israelhayom.co.il/viralai/article/14918620,2352,390,0.1658163265,"מטריד: אי חדש הופיע על המפה, והוא הולך וגדל כל הזמן","יפן, מדינת האיים שכבר למודה פעילות סיסמית וגעשית, ‘קיבלה’ לאחרונה לשורותיה אי חדש, שנוצר מהתפרצות הר געש מתחת לפני הים – וגדל ללא הפסקה. עדיין לא ידוע האם הפעילות שהביאה ליצירתו תשמיד אותו בקרוב, או שיהפוך לחלק ממפת העולם",2023-12-07T08:35:34.000Z,2023-12-07T08:35:34.000Z
https://www.israelhayom.co.il/viralai/article/14950777,2499,536,0.2144857943,"עזבו אתכם מאוֹזֶמְפּיק: טרנד הדיאטה החדש בטיקטוק הוא ""אוֹטְסֶמְפּיק""","""תרופת פלא"" חדשה עם שם שמזכיר את התרופה שהפכה לאחרונה ללהיט זוכה להמלצות רבות ברשתות החברתיות – אך מומחים אומרים שהיא לא באמת תעזור לכם לרזות לאורך זמן",2024-04-10T06:45:05.000Z,2024-04-10T06:47:35.000Z
https://www.israelhayom.co.il/viralai/article/15215916,2368,228,0.09628378378,קשה שפה: ילדים שמדברים שתי שפות מפתחים ‘פיצול אישיות’,"לימדתם את הילדים שפה שנייה מעבר לזו שהם מדברים ביומיום? כל הכבוד – אבל כדאי להיות מודעים לכך שהם קולטים יחד עם אוצר המלים הנפרד גם את ההבדל בין התרבויות, ומתנהגים בהתאם",2024-02-05T06:29:30.000Z,2024-02-05T06:29:30.000Z
https://www.israelhayom.co.il/viralai/article/14913872,2378,152,0.06391925988,זה מקליט? הטכנולוגיה ששינתה את חיינו לנצח,"החשמל בגרסת הזרם הישר, נורת הלהט, הראינוע – את כל אלה המציא תומאס אלווה אדיסון. אבל אחת ההמצאות הגדולות ביותר שלו היתה דווקא המכשיר שנועד לצרכים בידוריים יותר",2023-12-06T09:36:53.000Z,2023-12-06T09:36:53.000Z
https://www.israelhayom.co.il/viralai/article/15181752,2449,400,0.1633319722,מחקר: אלו 15 הגורמים המגבירים את הסיכון לדמנציה,"מחקר מקיף חושף 15 גורמי סגנון חיים ובריאות שיכולים להגביר את הסיכון לדמנציה מוקדמת. כמה מגורמים אלו ניתנים לשליטה וניהול על ידינו, מה שעשוי למנוע כמעט 40% מכלל מחלות הדמנציה בעתיד. מומחים ממליצים להתחיל לאמץ מיד הרגלי חיים בריאים שיכולים להוריד את הסיכון. הזמן לפעול הוא כעת!",2024-01-29T10:30:37.000Z,2024-01-29T19:36:01.000Z
https://www.israelhayom.co.il/viralai/article/15968946,2254,173,0.07675244011,הניצחון האינדיאני המוחץ שלא שינה את פני ההיסטוריה,"ב-25 ביוני 1876, על גדות נהר במונטנה, ארצות-הברית, התרחש קרב שהפך לאגדה: קרב ליטל ביגהורן. ברית לוחמי שלושה שבטים אינדיאניים גברה באופן מוחץ על חייליו של קולונל ג'ורג' קסטר, אך הקרב לא שינה מהותית את מדיניות ממשל האמריקאי כלפי האינדיאנים, שהמשיכו להידחק לשמורות",2024-06-25T11:08:03.000Z,2024-06-25T17:01:48.000Z
https://www.israelhayom.co.il/viralai/article/16847926,2667,96,0.03599550056,טיפוח עצמאות בילדים − המפתח להצלחה בעתיד,"עצמאות היא מתנה שלא נגמרת – היכולת של ילד להתמודד עם אתגרי החיים בכוחות עצמו היא המפתח לביטחון עצמי ולהצלחה. כהורים, תפקידנו הוא לא רק להגן, אלא גם ללמד ולהעצים. הנה 11 צעדים שיעזרו לכם לגדל ילדים עצמאיים עם תחושת מסוגלות",2024-11-26T09:05:19.000Z,2024-11-26T09:05:19.000Z
https://www.israelhayom.co.il/viralai/article/16015905,2317,66,0.02848511006,חופש גדול • משחק בבלגן יכול להיות בעל יתרונות רבים ומשמעותיים להתפתחות הילד,"החופש הגדול הוא זמן מצוין לילדים לפרוק אנרגיות, לחקור את העולם ולהתנסות בפעילויות חדשות. אחת מהפעילויות המרתקות עבור ילדים היא משחקי בלגן. בניגוד למה שהורים רבים עלולים לחשוב, אין מקום לבהלה - משחקים אלו מאפשרים לילדים לחקור, ליצור ולבטא את עצמם בחופשיות, וכל זאת תוך כדי שהם נהנים ומשתעשעים",2024-07-03T11:50:06.000Z,2024-07-03T12:33:53.000Z
https://www.israelhayom.co.il/viralai/article/15649922,2162,400,0.185013876,צלקות נסתרות: 15 סימנים שבן או בת הזוג גדלו עם אם רעילה,"האם הם חסרי ביטחון, ביקורתיים ביותר, או חוששים מעימותים? להתנהגויות אלו בקרב שותפיכם לחיים יש סיבה מסוימת. אמנם חוויות ילדות שליליות נותרות לא פעם חבויות, אבל יש רמזים. הנה 15 כאלו",2024-04-24T16:41:42.000Z,2024-06-13T06:58:19.000Z
https://www.israelhayom.co.il/viralai/article/15253421,2234,263,0.1177260519,15 שילובי מזון בריא שמחזקים את בריאותכם באופן דרמטי,"מחיזוק המערכת החיסונית שלכם ועד לשיפור ספיגת החומרים התזונתיים, מאכלים מסוימים טובים יותר ביחד. גלו את הכוח של התאמה בין המזונות הנכונים באמצעות מדריך תיבת נח לשילובי מזון בריאים. להלן זוגות שיכולים לשפר באופן דרמטי את הבריאות הכללית שלכם. והם גם טעימים",2024-02-12T09:35:42.000Z,2024-02-12T09:55:49.000Z
https://www.israelhayom.co.il/viralai/article/15458711,1996,97,0.04859719439,מתי צמים? זו התשובה לשאלה מסביב לעולם,"ביהדות, רוב הצומות מיועדים לזכור אירועים טרגיים – מלבד יום כיפור, שבו הצום מיועד לטהר את הנפש. אילו צומות קיימים בדתות ותרבויות אחרות?",2024-03-20T15:13:04.000Z,2024-03-20T15:13:04.000Z
https://www.israelhayom.co.il/viralai/article/15212673,2091,155,0.07412721186,צפו: זה הדבר הכי קרוב לחייזרים על כדור הארץ,מדענים מצאו יצורים שנראים כמו חייזרים קטנים ביערות טנזניה – וכעת הם מתכוונים ‘לשתף איתם פעולה’ בחקר היערות כדי לנתח את מצב העצים,2024-02-04T12:28:59.000Z,2024-02-04T12:28:59.000Z
https://www.israelhayom.co.il/viralai/article/15095473,2128,169,0.07941729323,אל תעופו על עצמכם: 9 כללים להתנהגות בטיסה,נוסע מתמיד שמחשיב את עצמו למומחה פרסם רשימה של כללים שלדעתו יש להקפיד עליהם במטוסים. כמה מהם הצליחו לעצבן נוסעים אחרים – כמו השאלה מי מקבל את משען היד שבין המושבים,2024-01-14T09:13:31.000Z,2024-01-14T12:52:24.000Z
https://www.israelhayom.co.il/viralai/article/15518001,2116,272,0.1285444234,"לראשונה: מדענים מצאו דרך ""להצעיר"" מערכות בגוף","בניסוי ראשון מסוגו בעכברים, הצליחו חוקרים להוכיח את היתכנותה של אפשרות לשפר את תפקוד גוף האדם בגיל מתקדם על ידי עידוד המערכת החיסונית לחזור לתפקוד ""צעיר"" יותר",2024-03-31T13:02:44.000Z,2024-03-31T13:02:44.000Z
https://www.israelhayom.co.il/viralai/article/16371598,2003,490,0.2446330504,התוספת הזו ליוגורט משפרת את בריאות המעיים,"לא שיבולת שועל, לא פירות ולא ירקות; מדענים גילו כי דווקא המתקת היוגורט שלכם בדרך הנכונה יכול לתרום לבריאות מערכת העיכול ואף המערכת החיסונית",2024-09-02T11:44:48.000Z,2024-09-02T11:44:48.000Z
https://www.israelhayom.co.il/viralai/article/15246540,2176,394,0.1810661765,השמלות הבלתי נשכחות של ה'אוסקר הבריטי': מקייט מידלטון ועד ליידי גאגא,"לקראת טקס פרסי האקדמיה הבריטית לקולנוע וטלוויזיה (BAFTA), גלריית שמלות אופנת על בלתי נשכחות שביטאו אינדיבידואליות, קידמו מסרים והיו השראה ודוגמא לאומנות מעולה. כולל טאץ' מלכותי אמיתי",2024-02-11T09:11:39.000Z,2024-02-11T10:09:49.000Z
https://www.israelhayom.co.il/viralai/article/16485156,2157,213,0.09874826147,מה חשוב לעשות עבור חיות המחמד שלכם במקרה חירום?,"אם, חלילה, יהיה כאן מצב שבו המוני אזרחים נוספים יפונו מהבית, חשוב לזכור לטפל גם בחיות המחמד. הנה כל מה שצריך לדעת על היערכות לדאגה לכלבים ולחתולים שלכם לקראת מצב חירום",2024-09-22T08:47:11.000Z,2024-09-22T08:47:11.000Z
https://www.israelhayom.co.il/viralai/article/15486129,2249,306,0.1360604713,7 סימנים שהילד שלכם מפונק ומה אפשר לעשות,"כולנו רוצים את הטוב ביותר עבור ילדינו, ולא פעם זה אומר לתת להם את כל מה שהם רוצים. עם זאת, חשוב למצוא איזון בין אהבה ותמיכה לבין פינוק יתר. ילדים מפונקים עלולים להיתקל בקשיים בהמשך חייהם, כגון אי עצמאות, קשיי התמודדות עם תסכול, וחוסר יכולת לקבל ""לא"" כתשובה. 7 סימנים המעידים שיש לכם ילד מפונק והצעות התמודדות",2024-03-25T17:30:33.000Z,2024-03-25T17:45:22.000Z
https://www.israelhayom.co.il/viralai/article/15176561,1601,156,0.09743910056,מסרבים להיכחד: בעלי החיים האלה פגשו את הדינוזאורים,"למרות שבעלי החיים המיתולוגיים נכחדו מכדור הארץ לפני מיליוני שנים, יצורים אחרים שחלקו איתם את האדמה והים שרדו ועדיין קיימים כיום בדיוק באותה צורה שהיו אז. קבלו את ""המאובנים החיים"" שלא צריך לנסות להקים לתחייה כדי לראות בגן חיות",2024-01-28T17:55:01.000Z,2024-01-28T17:55:01.000Z
https://www.israelhayom.co.il/viralai/article/15018278,1606,194,0.1207970112,הנפילה הכואבת של מאסק מהשיא ההיסטורי לתקרית מצערת,"יממה לאחר ששבר שיא עולם נוסף, התרסק הטיל הרב-שימושי של SpaceX בנסיבות כמעט מגוכחות. החברה מיהרה להצהיר כי הפיקה לקחים ולא תיתן לאסון כזה לקרות שוב",2023-12-28T11:50:11.000Z,2023-12-28T11:50:11.000Z
https://www.israelhayom.co.il/viralai/article/15252630,1740,193,0.1109195402,מציעים לכם חשמל בזול – אז למה אתם לא עוברים?,"סלקום, פרטנר ועוד כ-20 חברות בישראל כבר מציעות ללקוחות חשבונות חשמל מוזלים אם רק יתקשרו ויבקשו להתחבר – אז למה כמעט אף אחד לא עוזב את חברת החשמל? בדנמרק, שבה יושמה רפורמה דומה, בדקו את הסיבות",2024-02-12T07:51:38.000Z,2024-02-12T07:51:38.000Z
https://www.israelhayom.co.il/viralai/article/15026443,1573,21,0.01335028608,ויהי אור: היום שבו הפסקנו להשתמש בלפידים כדי לגרש את החושך,"היום אנחנו מציינים 144 שנים לרגע היסטורי, הרגע שבו העולם נחשף לא להממצאה אחת ששינתה אותו לנצח, אלא לשתי המצאות בו-זמנית: הנורה – והחשמל",2023-12-31T08:04:52.000Z,2023-12-31T08:04:52.000Z
https://www.israelhayom.co.il/viralai/article/14753699,1720,114,0.06627906977,מה אוכלים חיילים במדינות אחרות?,"מנות הקרב הצה""ליות הן נושא לבדיחות כבר עשרות שנים – אבל האם הן יוצאות דופן בנוף הקולנרי הצבאי? מתברר שברוב המדינות היום מנות קרב מגוונות כמעט כמו מסעדות גורמה",2023-10-26T08:40:41.000Z,2023-10-26T08:42:33.000Z
https://www.israelhayom.co.il/viralai/article/16323139,1848,117,0.06331168831,הכי יפה בהוליווד • הכוכבת שטום פורד הזעיק לקמפיין שפתונים,"בין ההתכתשויות המשפטיות עם האקס בראד פיט היא מוצאת זמן להצטלם לקמפיין ביוטי חדש • עם השיער בגרסתו הבהירה והמחמיאה, עיני החתול הירוקות והשפתון האדום, אנג'לינה ג'ולי מוכיחה שגם בגיל 49 היא הבחירה הנכונה לקמפיין ביוטי",2024-08-25T16:08:06.000Z,2024-08-26T05:00:02.000Z
https://www.israelhayom.co.il/viralai/article/15622853,1786,45,0.02519596865,הארוחות האלו יקררו לכם את הלשון בקיץ,"השאירו את הפיצות, הטוסטים, ההמבורגרים והסטייקים לחורף. בעונה החמה, הכי כיף לאכול ארוחות קרות וקלות להכנה, שבדרך כלל דורשות בסך הכל כמה דקות של חיתוך והעברה בבלנדר",2024-04-18T09:03:40.000Z,2024-04-18T09:03:40.000Z
https://www.israelhayom.co.il/viralai/article/16949996,1957,42,0.02146142054,מכאוס לאיזון: 5 דרכים להפיכת צוותים למכונה משומנת,"צוותי עובדים נתקלים לא פעם ברגעים של בלבול וחוסר תיאום, בהם המטרות מתעמעמות והדרך קדימה אינה ברורה. אך במקום להתייאש, ניתן להפוך את הכאוס להזדמנות. חמשת הכלים הבאים יסייעו להפוך כל צוות ליעיל, מגובש, ופרודוקטיבי",2024-12-11T18:49:15.000Z,2024-12-11T18:49:15.000Z
