Landing Page,Impressions,Url Clicks,URL CTR,title,subtitle,date_published,date_updated
https://www.israelhayom.co.il/viralai/article/15409408,155883,11162,0.07160498579,סוד הגן המבושם: 7 פרחים שאתם צריכים לגינה ריחנית מושלמת,"דמיינו את זה: אתם מטיילים להנאתכם בגינה שלכם, שואפים סימפוניה של ניחוחות משכרים, כל צעד משחרר פרץ חדש של מתיקות משלו.  זה לא רק חלום. עם הפרחים הנכונים, אתם יכולים להפוך את המרחב החיצוני שלכם לגן עדן ריחני שהוא מענג כמו שהוא יפהפה",2024-03-12T10:56:35.000Z,2024-03-15T07:10:31.000Z
https://www.israelhayom.co.il/viralai/article/16260314,158470,14757,0.09312172651,האם חומר הטעם המוכר בעולם באמת רעיל?,"מונוסודיום גלוטמט נמצא בהמוני מוצרי מזון שנמכרים בכל חנות, למרות שכבר עשרות שנים נטען כי הוא מסוכן וגורם לבעיות בריאותיות שונות. האם יש בסיס מדעי לטענות הללו?",2024-08-14T13:30:55.000Z,2024-08-14T13:30:55.000Z
https://www.israelhayom.co.il/viralai/article/15195909,157882,9167,0.05806235036,עשרת מותגי היופי הצרפתיים האלה הם מהטובים בעולם,"מוצרי היופי הצרפתיים נחגגים ברחבי העולם בזכות האיכות והתחכום שלהם. מהאלגנטיות הנצחית של שאנל ועד למומחיות הדרמטולוגית של לה רוש-פוזה, הפלאים הבוטניים של קלורן והיוקרה הטבעית של נוקסה, הנה תשעה ממוצרי היופי הצרפתיים הטובים ביותר המייצגים את הקרם של תעשיית היופי המפוארת של ארץ הבאגטים והיין",2024-02-01T08:45:28.000Z,2024-02-01T13:03:23.000Z
https://www.israelhayom.co.il/viralai/article/15049807,154926,14667,0.09467100422,כך חברות מנסות ‘לעבוד’ על מועמדים לעבודה בנוגע לשכר,המגמה הפושטת של דרישות שקיפות בנוגע לשכר בעבודה כופה על חברות במדינות מסוימות לפרסם טווחי שכר במודעות דרושים – אז הן מצאו שיטה חדשה להשאיר את המידע הזה מוסתר. כעת מתברר שמועמדים לא אוהבים את הטריק הזה,2024-01-04T13:19:36.000Z,2024-01-04T13:19:36.000Z
https://www.israelhayom.co.il/viralai/article/15147913,156835,9590,0.06114706539,תחנת החלל של מייסד אמזון התפוצצה עוד לפני ששוגרה,תא מגורים מתנפח המיועד לאסטרונאוטים בתחנת החלל המסחרית של מייסד אמזון התפוצץ השבוע על אדמת כדור הארץ. למה החברה שייצרה אותו דווקא מאוד מרוצה מהפיצוץ? צפו,2024-01-23T07:57:09.000Z,2024-01-23T09:30:40.000Z
https://www.israelhayom.co.il/viralai/article/16707072,159152,12911,0.08112370564,"תעלומת הגרביים הנעלמות: מדוע הן נעלמות בכביסה, ואיך המדע מסביר זאת?","היעלמות גרביים בכביסה היא אחת התעלומות היומיומיות שמעסיקות רבים בעולם. כיצד ייתכן שכל כך הרבה גרביים בודדות פשוט נעלמות, ולעולם אינן חוזרות? האם יש ארץ חד גרב מסתורית שכולן הולכות אליה? במקום להמשיך להאשים את היקום בחוסר צדק, להלן כמה הסברים מבוססים",2024-11-03T07:05:55.000Z,2024-11-03T07:05:55.000Z
https://www.israelhayom.co.il/viralai/article/16741893,155196,5487,0.03535529266,הכביסה החכמה: כך מכבסים ביעילות ובאופן ידידותי לסביבה,"כשמדברים על כביסה, רובנו חושבים על מטלה ביתית קבועה ולא על דרך לשפר את חיי הבגדים שלנו, לחסוך במשאבים ולתרום לסביבה. אבל האם ידעתם שאפשר לכבס חכם יותר? כמה צעדים פשוטים יכולים להפוך את הכביסה היומיומית שלנו לחוויה יעילה, חסכונית ואפילו ירוקה יותר",2024-11-07T13:59:27.000Z,2024-11-07T20:10:20.000Z
https://www.israelhayom.co.il/viralai/article/15944762,156193,9955,0.06373525062,מהו רטינול ולמה הוא הפך לכוכב בעולם הטיפוח והיופי?,"בעולם המהיר והמתפתח של טיפוח העור, אנו נתקלים במושג שחוזר שוב ושוב: רטינול. רכיב זה הוא אחד המובילים בתחום ומומלץ על ידי מומחים. מהו בעצם רטינול? איך הוא פועל על העור ומהם היתרונות והחסרונות בשימוש בו?",2024-06-20T09:25:46.000Z,2024-06-20T09:25:46.000Z
https://www.israelhayom.co.il/viralai/article/16304978,157262,7426,0.04722056186,סודות הבריאות במרק עצמות ואיך להכין אותו בבית,"מרק עצמות הוא הרבה יותר ממנה מחממת לב - הוא סוד עתיק יומין לבריאות טובה. עם שפע של רכיבים תזונתיים מועילים, כמו קולגן ומינרלים חיוניים, מרק העצמות יכול לשפר את בריאות המפרקים, לחזק את מערכת החיסון, ולתרום לעור שזוהר מבפנים",2024-08-22T08:33:10.000Z,2024-08-22T10:02:28.000Z
https://www.israelhayom.co.il/viralai/article/16930195,158138,15392,0.09733270941,דיאטה לנשים בגיל 50: שלוש פרקטיקות מרכזיות,"גיל 50 הוא לא רק ציון דרך, אלא גם הזדמנות להפוך אתגרים להזדמנויות. עם שינויים חכמים, תוכלי לאזן את הגוף, לשפר את האנרגיה ולהשיל קילוגרמים מיותרים. שלוש פרקטיקות פשוטות אך אפקטיביות ממתינות לך, כדי להתחיל מסע לבריאות וחיוניות חדשה",2024-12-09T08:41:12.000Z,2024-12-09T08:41:12.000Z
https://www.israelhayom.co.il/viralai/article/17029277,152516,5160,0.03383251593,הורות עדינה: 9 נקודות למחשבה ולמידה,"הורות עדינה היא גישה שמתמקדת באמפתיה, הבנת רגשות הילד ויצירת תקשורת חיובית, במקום עונשים ומשמעת קשוחה. גישה זו מציעה יתרונות רבים, אך גם דורשת התמודדות עם אתגרים. במאמר זה נציג 9 נקודות שיעזרו לכם להבין את הגישה לעומק ולבחון את התאמתה למשפחתכם",2024-12-25T11:14:59.000Z,2024-12-25T11:14:59.000Z
https://www.israelhayom.co.il/viralai/article/16081017,150535,16193,0.1075696682,איך לגרום לבית שלכם להיראות מדהים ב-10 דקות (ומה הקשר לקוקו שאנל),לפעמים לא הכל צריך להיות נורא מסובך או יקר. יש כמה דרכים פשוטות לשדרג את מרחב המחייה שלכם - ופשוט ליהנות ממנו,2024-07-15T10:34:57.000Z,2024-07-15T10:34:57.000Z
https://www.israelhayom.co.il/viralai/article/17557255,154486,15306,0.09907693901,💡 איך לדעת שהקשר שלכם יציב? ❤️ 3 סימנים שיעזרו לכם לזהות זוגיות בריאה,"אם אתם רוצים לדעת אם הקשר שלכם בטוח ומאוזן, הנה שלושה סימנים מבוססי מחקר שיעזרו לכם להבין האם מצאתם את מה שחיפשתם. כי אהבה אמיתית לא אמורה להרגיש כמו הליכה על ביצים!",2025-03-17T11:58:42.000Z,2025-03-17T12:02:35.000Z
https://www.israelhayom.co.il/viralai/article/16524367,150246,8860,0.05896995594,שמן קנולה מול שמן צמחי: מה עדיף לבריאותכם?,"האם אי פעם עצרתם לחשוב איזה שמן באמת עדיף לבריאות שלכם? שמן קנולה ושמן צמחי נראים דומים כל כך, אך ההשפעות הבריאותיות שלהם שונות בתכלית. לפני שאתם מציתים את להבת המחבת ובוחרים באחד מהם, כדאי להבין את היתרונות והחסרונות של כל שמן – כי לא כל שמן נולד שווה",2024-09-29T08:51:36.000Z,2024-09-29T08:51:36.000Z
https://www.israelhayom.co.il/viralai/article/15482791,150999,11453,0.07584818443,"תגידו שלום לחדר הכושר והריצות: מדענים פיתחו ""גלולות אימון""","מחקר חדש הצליח להוכיח היתכנו לתרופות עתידיות שיגרמו לגוף להגיב כמו שהוא מגיב לאימון, מבלי שנצטרך להתאמץ ולהזיע במשך שעות",2024-03-25T08:46:50.000Z,2024-03-25T08:46:50.000Z
https://www.israelhayom.co.il/viralai/article/14856783,152792,9948,0.06510812084,הכוכב הכי גדול בטלוויזיה חוגג 60 – ואף אחד עדיין לא יודע את שמו,"דורות של צופי טלוויזיה מרותקים למעלליו ברחבי החלל והזמן; מספר השחקנים שגילמו אותו עבר מזמן את העשרה, ועצם ההצעה לשחק אותו נחשב לכבוד ענק; אבל כשהוא מציג את עצמו כולם שואלים: “דוקטור הו?”",2023-11-23T07:06:15.000Z,2023-11-23T12:00:29.000Z
https://www.israelhayom.co.il/viralai/article/15875636,150585,21539,0.1430354949,מומחים אומרים ששני הדברים האלה יכולים למנוע גירושים,"הבדלים ביו בני זוג יכולים להיות דבר קסום, אך לאורך זמן הם עלולים להפוך לנקודות מחלוקת. גם אם אתם מרגישים שהחיכוך הולך וגדל, אפשר לגשת לזה אחרת",2024-06-06T13:02:48.000Z,2024-06-06T13:04:40.000Z
https://www.israelhayom.co.il/viralai/article/16283357,152706,4554,0.02982201092,סלמון עד קרפיון • דגים עשירים בשמנים לבריאות מיטבית,"מרכיב חשוב בתזונה בריאה הוא הם השמן הבריא הנמצא בעיקר במזונות מן הים וממאגרי מים מתוקים • שמנים אלו, בעיקר שמני דגים, מכילים חומצות שומן אומגה 3 החיוניות לבריאות הלב, המוח והמערכת החיסונית • 9 דגים שהם אוצרות תזונה טבעיים",2024-08-19T09:40:58.000Z,2024-08-19T11:35:55.000Z
https://www.israelhayom.co.il/viralai/article/17481385,152465,13241,0.08684616141,9 סימנים שאתם מתמודדים עם 'נרקיסיסט' (ומדוע זו לא בהכרח המילה הנכונה לשימוש) 🔍,"הם מרתקים, מלאי ביטחון וכובשים כל חדר – אבל מה מסתתר מאחורי הקסם? 🤯 האם זה ביטחון אמיתי או מנגנון הגנה מתוחכם? הכירו את הסימנים שיעזרו לכם להבין אם אתם מתמודדים עם נרקיסיסט בתחפושת!",2025-03-05T08:09:32.000Z,2025-03-05T13:11:22.000Z
https://www.israelhayom.co.il/viralai/article/16569096,150966,5982,0.03962481618,האם מוצרי טיפוח טבעיים באמת טובים יותר לעור שלכם?,"המגמה הירוקה הגלובלית כבשה כמובן גם את שגרת הטיפוח שלנו – ה""טבעי"" והאורגני"" ממלאים את המדפים. אבל לפני שמתמסרים לקסם הטבעי, עולה השאלה – האם מוצרי טיפוח טבעיים באמת טובים יותור או שמדובר בהבטחות נעימות לאוזן שלא תמיד עומדת במבחן המציאות?",2024-10-07T06:26:02.000Z,2024-10-07T06:26:02.000Z
https://www.israelhayom.co.il/viralai/article/15228346,146991,7337,0.04991462062,לא צריך מתכון: כך תכינו סלטים מנצחים,לא צריך הוראות הכנה או רשימה קשיחה של רכיבים. סלט טוב יכול להכיל מגוון של שילובים בין ירקות מסוגים שונים ורכיבי בסיס להוספת שובע. הנה כמה כללים שיהפכו את הסלטים שלכם ליצירות מופת קולינריות,2024-02-07T08:00:24.000Z,2024-02-07T08:00:24.000Z
https://www.israelhayom.co.il/viralai/article/16857314,146581,9201,0.06277075474,לגלות את השורשים • 12 ירקות שורש שיחוללו פלאים בבריאות שלכם,"מתחת לאדמה, בדממה ובחשיכה, יש אוצרות תזונתיים • ירקות השורש – גיבורי בריאות המשלבים טעם, ערך תזונתי גבוה ורב-גוניות • הכירו מקרוב 12 ירקות שורש מופלאים שיחזקו את גופכם, ישפרו את תפקוד מערכות הגוף ויהפכו כל מנה לחגיגה קולינרית בריאה ומזינה",2024-11-27T10:08:32.000Z,2024-11-28T14:32:29.000Z
https://www.israelhayom.co.il/viralai/article/14852155,145245,13528,0.09313917863,"כוכב שביט ""שטני"" בגודל עיר נמצא בדרכו לכדור הארץ","“שביט השטן"", שנראה עד לאחרונה כמו יצור מרושע המרחף בשמיים, יגיע לאזור השמש באפריל ויחלוף סמוך לכדור הארץ ביוני. הוא לא מהווה סכנה, אבל כן יספק מופע צבעוני בשמי הלילה",2023-11-22T08:06:24.000Z,2023-11-22T08:06:24.000Z
https://www.israelhayom.co.il/viralai/article/17287437,148985,12217,0.08200154378,פרקינסון? לא בבית ספרנו! איך אורח חיים בריא יכול להבריח את המחלה,"תזונה נכונה, פעילות גופנית ושינה טובה – המתכון הסודי להפחתת הסיכון לפרקינסון. בואו נגלה איך בחירות יומיומיות יכולות לשמור על המוח שלנו בכושר שיא",2025-02-03T09:33:45.000Z,2025-02-03T09:33:45.000Z
https://www.israelhayom.co.il/viralai/article/15141503,146515,6556,0.04474627171,לנהל את זמן כמו אילון מאסק ולהיות יצרני יותר פי 5,"אילון הוא בין האנשים העסוקים ביותר על פני כדור הארץ כרגע. ובכל זאת הוא מוצא זמן לטסלה, SpaceX, X, פעילות גופנית וילדיו (יש לו עשרה!). ואיכשהו עדיין יש לו את היכולת לעסוק בתחביבים. איך הוא עושה את זה? באמצעות שיטה שפותחה בתחילת המילניום שעליכם להכיר ולנסות ליישם",2024-01-22T09:09:56.000Z,2024-01-22T13:15:25.000Z
https://www.israelhayom.co.il/viralai/article/17489828,146701,7955,0.05422594256,👨‍👩‍👧‍👦⚠️ 10 סימנים מובהקים להורות לקויה – וכיצד לשפר את הקשר עם ילדיכם,"האם אתם באמת ההורים שאתם רוצים להיות? כולנו רוצים להיות הורים טובים, אך לפעמים הרגלים והתנהגויות בלתי מודעות עלולים לפגוע בקשר עם ילדינו • איך תדעו אם אתם עושים טעויות נפוצות – ומה ניתן לעשות? 10 סימנים שיעזרו לכם להפוך את הקשר המשפחתי לבריא",2025-03-06T09:08:55.000Z,2025-03-06T09:08:55.000Z
https://www.israelhayom.co.il/viralai/article/17092573,144074,6455,0.04480336494,"טופו – הגיבור הצמחוני שמזין, טעים, גדוש בחלבון ומלא באפשרויות","טופו, הידוע גם כ""גבינת סויה"", הוא אחד המזונות המזינים והוורסטיליים ביותר שניתן לשלב בתפריט היומי. מקורו בסין, ותהליך ייצורו כולל קרישת חלב סויה , מה שיוצר גושים מוצקים שניתן לעצב ולשמר. מעבר להיותו בסיס טעים, טופו הוא מזון בריא יתרונות בריאותיים רבים ומהווה בחירה מעולה לכל מי שמעוניין לשפר את אורח חייו",2025-01-05T11:44:50.000Z,2025-01-05T11:54:39.000Z
https://www.israelhayom.co.il/viralai/article/16086132,146860,14891,0.1013958872,נשק יום הדין שמצמצם את כמות היתושים בבית לכמעט אפס,"עם חום יולי אוגוסט מגיע גם האויב המציק של כל בית ישראלי – היתושים. הגירוד, הנפיחות והאדמומיות, מלווים הקיץ גם בסכנת הידבקות במחלה הנגיפית קדחת מערב הנילוס שמועברת על ידי יתושים נגועים. אבל מה אם נספר לכם שיש פתרון פשוט, זול ויעיל להפליא שמסוגל לצמצם את כמות היתושים בביתכם לכמעט אפס?",2024-07-16T07:58:36.000Z,2024-07-16T07:58:36.000Z
https://www.israelhayom.co.il/viralai/article/16283551,145546,13950,0.09584598684,הכלבים שמעדיפים שתעזבו אותם בשקט,נכון שכל הכלבים הם חברים טובים ונאמנים – אבל יש גזעים שנוטים להעדיף להיות חברים כאלה בלי שתחבקו ותלטפו אותם כל הזמן. הנה כמה גזעים שלא מתאימים למי שרוצים חיית תמיכה,2024-08-19T07:10:43.000Z,2024-08-19T07:10:43.000Z
https://www.israelhayom.co.il/viralai/article/16848851,143029,21409,0.1496829314,אלו המאכלים שגורמים לכם להשמין,"מאכלים מסוימים, שנראים לנו כל-כך רגילים, יומיומיים או מפנקים, עלולים להפוך לאויבים השקטים של המאזניים. בין גלידה צוננת לצ'יפס פריך, ישנה אמת נסתרת – הקלוריות המצטברות. רוצים לדעת מה מתחבא במזונות האהובים עליכם? היכונו לגלות את האמת מאחורי הביס",2024-11-26T11:40:35.000Z,2024-12-01T13:12:27.000Z
https://www.israelhayom.co.il/viralai/article/17503465,138198,26056,0.1885410787,6 טעויות שאסור לכם לעשות לפני 9 בבוקר אם אתם מנסים לרדת במשקל ⏰🚫,הבוקר שלכם קובע איך תיראה הדיאטה שלכם! 🌅🥑 האם טעויות קטנות פוגעות בירידה במשקל שלכם? גלו את 6 ההרגלים שעלולים לחבל במטרות שלכם – וקחו שליטה!,2025-03-09T10:00:35.000Z,2025-03-09T10:00:35.000Z
https://www.israelhayom.co.il/viralai/article/15709483,139680,18613,0.1332545819,רוכבים על אופנוע? יש לנו חדשות רעות בשבילכם,"בדיקה מעמיקה גילתה שיצרניות אופנועים מקפחות חלק גדול מאוד מהלקוחות שלהן, וגורמות לרוכבים רבים לבעיות שניתן היה לפתור בקלות עם קצת יותר בדיקות",2024-05-07T13:00:11.000Z,2024-05-07T13:00:11.000Z
https://www.israelhayom.co.il/viralai/article/15061788,138627,21877,0.1578119703,רגע לפני גלובוס הזהב: השמלות הכי יפות בטקס ב-20 השנים האחרונות,"הלילה יתקיים בבוורלי הילס טקס פרסי גלובוס הזהב ה-81. 'היורשים' ו'ברביהיימר' מובילים עם מספר המועמדויות הגבוה ביותר. טיילור סוויפט תופיע ואולי גם תזכה. השטיח האדום צפוי, כמדי שנה, להיות מרהיב. הנה כמה מראות עבר שאהבנו במיוחד",2024-01-07T16:59:50.000Z,2024-01-07T19:19:33.000Z
https://www.israelhayom.co.il/viralai/article/15898033,140603,13109,0.09323414152,לחיות טוב ולשלם פחות: מדינות שבהן הכסף שלכם שווה יותר,"כשעלויות המחייה ממשיכות לעלות, יותר ויותר אנשים מחפשים יעדים בינלאומיים זולים, ולא רק לבטן-גב וקניות, אלא לחיות. יש מקומות בעולם שבהם עלויות המחיה נוחות ומאפשרות ליהנות מאורח חיים מפנק",2024-06-10T17:28:06.000Z,2024-06-11T13:24:54.000Z
https://www.israelhayom.co.il/viralai/article/15648069,133879,13430,0.1003144631,אלו המקצועות שיכניסו לכם יותר מחצי מיליון שקל בשנה,"השאלה באיזה מקצוע או מסלול מקצועי לבחור כדי ליהנות מחיים של נוחות כלכלית עוררה לאחרונה דיון ארוך, עם לא מעט חשיפות לגבי מקצועות שלא היינו חושבים עליהם – אבל גם אזהרות למי שחושב שמשכורת גבוהה מגיעה בלי הקרבה",2024-04-24T10:41:44.000Z,2024-04-24T10:41:44.000Z
https://www.israelhayom.co.il/viralai/article/17303458,138670,8013,0.05778466864,איך להפוך את הצ’יפס לפריך בלי להוסיף קלוריות מיותרות?,"טיגון באוויר הוא אלטרנטיבה בריאה יותר, אבל האם הוא באמת משאיר את הצ’יפס קריספי כמו בטיגון מסורתי? בואו נגלה איך לשמור על הפריכות המושלמת בלי לפגוע בבריאות!",2025-02-05T12:52:10.000Z,2025-02-05T12:52:10.000Z
https://www.israelhayom.co.il/viralai/article/16120853,133853,18200,0.1359700567,למה אנחנו מתעוררים ב-3:00 לפנות בוקר - וחושבים על כל מה שמפחיד אותנו?,"רבים מאיתנו מתעוררים בשעות הקטנות של הלילה ולא מצליחים לחזור לישון. בוהים בתקרה, מוצפים בחרדה. יש לזה סיבה (ויש גם מה לעשות)",2024-07-22T09:43:51.000Z,2024-07-22T09:43:51.000Z
https://www.israelhayom.co.il/viralai/article/17190698,134230,11222,0.08360277136,הסוד לבריאות מעיים ושריפת שומן? הכירו את פרי הסמבוק!,"מחקר חדש מגלה שמיץ סמבוק לא רק מחזק את המערכת החיסונית, אלא גם משפר את חילוף החומרים, תומך בבריאות המעיים ומסייע לשרוף שומן. מה יש בפרי הקטן והסגול שהופך אותו לכל כך יעיל?",2025-01-20T13:20:04.000Z,2025-01-20T13:20:04.000Z
https://www.israelhayom.co.il/viralai/article/16003937,139604,11693,0.08375834503,האיש שידע לצייר בדידות • תערוכה בברלין לציון 250 שנים להולדת הצייר הדגול הזה,"הוא ידע להעביר בעבודותיו תחושות של בדידות על רקע נוף אינסופי ואת הקשר העמוק בין הטבע לאדם. תערוכה בברלין, מציינת 250 שנה להולדתו של קספר דוד פרידריך, מגדולי הציירים הגרמנים בכל הזמנים, ומציגה מבט מעמיק על יצירותיו שבישרו את המודרניזם בציור והשפעתו המתמשכת",2024-07-01T14:20:28.000Z,2024-07-01T15:57:30.000Z
https://www.israelhayom.co.il/viralai/article/17124197,135594,3951,0.02913845745,ברוכים הבאים לעיר העתיד של טויוטה: המקום שבו טכנולוגיה ואנשים נפגשים,טויוטה בונה עיר חכמה שתשמש מעבדה חיה לניסויים בטכנולוגיות מתקדמות. מי יהיו התושבים הראשונים? ומה מחכה לנו שם?,2025-01-09T16:30:57.000Z,2025-01-09T16:30:57.000Z
https://www.israelhayom.co.il/viralai/article/16348770,131597,12122,0.09211456188,המים המסתוריים מהאורז: האם הם המפתח לשיער בריא יותר?,"במרחבי המטבח האסייתי, בין הקעריות המלאות אורז לבן מעלה אדים מסתתר סוד בן מאות שנים—מים שקופים, שמספקים לשיער לא רק ברק, אלא גם עמידות וחיוניות. בזמן שעולם הקוסמטיקה משקיע מיליארדים בפיתוח מוצרים, פתרון טבעי ישן מצא את דרכו לאור הזרקורים. האם מי האורז הם התשובה לשיער חלומי?",2024-08-29T11:31:40.000Z,2024-08-29T11:31:40.000Z
https://www.israelhayom.co.il/viralai/article/15397656,129710,5027,0.03875568576,מתנחלים – זה מה שאתם חייבים לעשות לקראת המעבר לשעון קיץ,מאות אלפי ישראלים עלולים לגלות בסוף השבוע שהטלפונים שלהם מציגים את השעה הלא נכונה לאחר המעבר לשעון קיץ. למה זה קורה ומה אפשר לעשות כדי למנוע את הבלבול?,2024-03-24T04:32:45.000Z,2024-03-25T11:51:40.000Z
https://www.israelhayom.co.il/viralai/article/15637491,130442,5895,0.04519249935,בירה בת 450 חשפה עובדות מדהימות על המשקה הנצחי,צמד חוקרים ניסו לשחזר בירה מהמאה ה-16 כדי לגלות מה ההבדלים בינה לבין הבירות הנפוצות כיום. התוצאות ניפצו כמה מיתוסים נפוצים בקשר למקורות הבירה,2024-04-22T06:32:15.000Z,2024-04-22T06:32:15.000Z
