Landing Page,Impressions,Url Clicks,URL CTR,title,subtitle,date_published,date_updated
https://www.israelhayom.co.il/viralai/article/14866738,39671,1208,0.03045045499,קשת גוונים נועזים וטבעיים: אלה צבעי השיער הלוהטים לשנת 2024,"החל מהשחור והבלונד המסורתיים, דרך ורוד בגוונים שונים ועד צבעי ניאון ואפור - אלה צבעי השיער שהולכים לבלוט בשנה הבאה",2023-11-26T08:52:50.000Z,2023-11-27T08:25:47.000Z
https://www.israelhayom.co.il/viralai/article/15562971,38822,750,0.01931894287,מחירי הקקאו מזנקים – אבל הם לא משפיעים על מחיר השוקולד,"מרגישים שמחירי מוצרי השוקולד עלו מאוד לאחרונה? לכאורה, יש לזה סיבה טובה – מחסור מתפתח בקקאו. אבל בפועל, העלייה נובעת משיקולים אחרים לחלוטין",2024-04-08T07:22:41.000Z,2024-04-08T07:22:41.000Z
https://www.israelhayom.co.il/viralai/article/16162627,38930,4376,0.1124068842,5 סימנים שאתם צריכים טיפול זוגי (יותר ממה שנדמה לכם),"אם מערכת היחסים שלכם נמצאת במקום לא טוב, ואתם תוהים האם אתם זקוקים לעזרה חיצונית, נסו לבחון את הדברים הבאים",2024-07-29T10:53:56.000Z,2024-07-29T10:53:56.000Z
https://www.israelhayom.co.il/viralai/article/15859958,38711,4723,0.1220066648,אם נולדת בתאריך הזה - אפשר לסמוך עליך,"אמון הוא דבר שקל לשבור, וקשה לתקן. האם נולדתם איתו? ומה לגבי האנשים הקרובים לכם ביותר?",2024-06-04T07:28:30.000Z,2024-06-04T07:28:30.000Z
https://www.israelhayom.co.il/viralai/article/15654006,37683,2683,0.0711992145,תקופת האבן: האם סטונהנג’ עומד לחשוף תגלית נוספת?,"האתר שמצליח לבלבל חוקרים כבר עשרות שנים עושה זאת שוב, כאשר כעת הם מתכוננים לאירוע אסטרונומי שיקרה בשנה הבאה, ובמהלכו ייתכן שייחשף פרט מדהים אודות המקום",2024-04-27T17:08:09.000Z,2024-04-27T17:08:09.000Z
https://www.israelhayom.co.il/viralai/article/14929087,37638,2446,0.06498751262,לא כולן נוצרו שוות: ״ארוחות בוקר״ להימנע מהן,"ארוחת בוקר בריאה נותנת את הטון ליום, ומספקת אנרגיה וחומרים מזינים חיוניים. על ידי הימנעות או צריכה מתונה של מאכלים אלו הנתפסים לא מעט כ״ארוחת בוקר״, תוכלו לקיים שגרת בוקר בריאה ומשביעה הרבה יותר",2023-12-10T11:52:23.000Z,2023-12-10T11:52:23.000Z
https://www.israelhayom.co.il/viralai/article/14853816,39132,2741,0.07004497598,"אילון מאסק חוגג: החללית התפוצצה, אבל הטיל הצליח לשבור שיא","השיגור הכושל לכאורה של SpaceX בשבת האחרונה לא מפריע לחברה ולבעליה, שמתמקדים בעובדה שהטיל הגדול בתולדות האנושות עבד בפעם הראשונה כמעט ללא תקלות",2023-11-22T13:58:04.000Z,2023-11-22T13:58:04.000Z
https://www.israelhayom.co.il/viralai/article/17201354,38008,2700,0.07103767628,הסוד של הצרפתים: איך הם שומרים על הגזרה עם קרואסון ויין?,"הדיאטה הצרפתית, או כפי שמכנים אותה ""הפרדוקס הצרפתי"", מוכיחה שאפשר לאכול וליהנות בלי לוותר על הבריאות. איך הצרפתים עושים את זה ומה אנחנו יכולים ללמוד מהם?",2025-01-21T16:45:51.000Z,2025-01-21T16:45:51.000Z
https://www.israelhayom.co.il/viralai/article/17157418,38380,1796,0.04679520584,האם עלינו להיצמד לשלוש ארוחות ביום?,"שלוש ארוחות ביום! – מנטרה מוכרת שנשמעת כמו חוק טבע • אבל האם אי פעם עצרנו לשאול אם ההרגל הזה באמת מבוסס על צרכים ביולוגיים, או שהוא פשוט תוצר של נורמות חברתיות שהתקבעו עם השנים? אולי הגיע הזמן לערער על השעון החברתי ולגלות מה באמת נכון לנו",2025-01-15T10:40:56.000Z,2025-01-15T10:40:56.000Z
https://www.israelhayom.co.il/viralai/article/17102736,38626,5264,0.1362812613,ילד פלא: בן שבע שרד חמישה ימים בפארק מלא אריות בזימבבואה,"איך בן שבע שרד חמישה ימים בפארק מלא אריות בזימבואה – סיפור יוצא דופן על תושייה, מזל, והרבה אומץ לב",2025-01-06T15:09:36.000Z,2025-01-06T15:09:36.000Z
https://www.israelhayom.co.il/viralai/article/15227113,37718,3192,0.08462802906,טיילור סוויפט וקייט מידלטון באותו מראה - מי לבשה את זה יותר טוב?,"תמיד יש מזהו שמזכיר לנו. והיום זה המראה של טיילור סוויפט בטקס פרסי הגראמי השבוע. לא התאמצנו יותר מדי ונזכרנו במראה של הנסיכה האהובה עלינו בטקס פרסי ה-BAFTA בשנה שעברה. מי לבשה את זה קודם ברור, אבל מי לבשה את זה יותר טוב?",2024-02-06T21:26:21.000Z,2024-02-08T19:08:19.000Z
https://www.israelhayom.co.il/viralai/article/15266010,36687,1842,0.05020852073,זה מדעי: כך תכינו ‘שיקוי אהבה’ ביום האהבה הזה,"מרצה לכימיה חושף ששיקוי אהבה הוא לא סתם מיתוס, אלא אפשרות שקיימת מבחינה מדעית – אלא שהוא טוען שחבל על המאמץ, משום שאפשר להתאהב בעזרת אמצעים הרבה יותר פשוטים וזמינים",2024-02-14T10:08:43.000Z,2024-02-14T10:08:43.000Z
https://www.israelhayom.co.il/viralai/article/14775442,36203,1152,0.03182056736,האם יש הבדל בקשר הרגשי בין כלבים לנשים ולגברים?,מדען שחוקר את השימוש בכלבים כאמצעי טיפולי עבור בני אנוש שם לב שבמחקרים הללו משתתפות כמעט אך ורק נשים. הוא החליט לנסות לאזן. מה היו התוצאות?,2023-11-01T12:36:05.000Z,2023-11-01T12:36:05.000Z
https://www.israelhayom.co.il/viralai/article/15086612,35994,2187,0.06076012669,"תערוכה חדשה על גבריאל 'גבי' חנוכה, צעירה יהודייה ממצרים שייסדה את בית אופנת העל קלואה","רבות סופר על הצלחת יהודים בתחום האופנה. דורות של מהגרים שעסקו בסחר טקסטיל הולידו אייקוני אופנה עכשוויים כמו דונה קארן, ראלף לורן, מארק ג'ייקובס, ועוד. אך סיפורה של מייסדת בית האופנה הצרפתי 'קלואה' שונה במקצת. התערוכה המוקדשת לה בוחנת באמצעות דגמים היסטוריים כיצד היא שינתה את פני האופנה עם סטייל חסר מאמץ, נשי וחדור רוח בוהמיינית",2024-01-11T17:20:48.000Z,2024-06-12T13:54:48.000Z
https://www.israelhayom.co.il/viralai/article/16260533,36076,4931,0.1366836678,10 סימנים שמישהו שאתם אוהבים מאבד קשר עם המציאות,"כאשר מישהו קרוב אליכם מתחיל להציג התנהגויות בלתי רגילות או תפיסות בלתי מציאותיות, זה יכול להיות מטריד ומדאיג • במקרים כאלה, חשוב לשים לב לסימנים המעידים על כך שהאדם עשוי לאבד קשר עם המציאות • מהם הסימנים הללו?",2024-08-14T14:20:33.000Z,2024-08-14T14:44:23.000Z
https://www.israelhayom.co.il/viralai/article/15232344,36625,3552,0.09698293515,בית הכפר האנגלי שבו ינוח המלך צ'ארלס בין טיפולי הסרטן,"לאחר שאובחן עם 'סוג של סרטן', המלך צ'ארלס יעבור בקרוב בעצת רופאיו סדרת טיפולים. יורש העצר הנסיך וויליאם ייקח על עצמו את מחוייבותיו של אביו. בזמן זה, המלך ישהה עם רעייתו המלכה קמילה באחד ממעונות משפחת המלוכה וינוח שם בין הטיפולים. הכירו את בית סנדרינגהאם, מפלט ירוק של שקט ושלווה בכפר האנגלי",2024-02-07T19:31:34.000Z,2024-02-08T07:01:22.000Z
https://www.israelhayom.co.il/viralai/article/16803226,36501,838,0.02295827512,אחרי הגשם: 7 סיבות מצוינות לאכול פטריות,"כשהקרקע מתמלאת חיים חדשים ואותו ניחוח של אחר הגשם ממלא את האויר, הפטריות עוברות לקדמת לבמה – כמזון על אמיתי. הן קטנות אך עוצמתיות ומלאות ברכיבים מזינים התומכים בכל מערכות הגוף. בין אם למרק חורפי או כתוספת מעודנת, הפטריות הן הסיבה הטובה ביותר להתרגש מעונת הגשמים",2024-11-18T13:25:35.000Z,2024-11-18T18:18:13.000Z
https://www.israelhayom.co.il/viralai/article/16849259,36589,1313,0.03588510208,בשר הודו מחזק את הזיכרון ויכול להגן על המוח מהזדקנות,"ממנת חלבון מושלמת ועד ויטמינים חיוניים – למה כדאי לחשוב מחדש על בשר הודו, בקרוב כוכב ארוחת חג ברחבי ארצות הברית, ולשלב אותו בתפריט היומי? וגם מתכון טעים וקל",2024-11-26T12:35:25.000Z,2024-11-26T12:35:25.000Z
https://www.israelhayom.co.il/viralai/article/17309751,37328,4410,0.1181418774,מניעת סרטן: 7 טיפים להפחתת הסיכון שלכם 🛡️,"שמירה על הבריאות היא אחת המתנות הגדולות שתוכלו להעניק לעצמכם. בחירות יומיומיות כמו תזונה נכונה, פעילות גופנית והימנעות מהרגלים מזיקים משפיעות משמעותית על הסיכון לסרטן. עם כמה שינויים פשוטים, אפשר להגן על הגוף ולחיות חיים בריאים ומאוזנים",2025-02-06T11:26:54.000Z,2025-02-06T11:26:54.000Z
https://www.israelhayom.co.il/viralai/article/16759733,37427,6755,0.1804846768,יש סיבה פשוטה ולא נעימה לכך שאתם מתקשים במערכות יחסים,"חולמים על דירה בשכונה טובה, רכב יוקרה וחופשות באיי יוון? יש סיבה טובה ולא נעימה שאתם מרגישים קושי לפתח מערכות יחסים משמעותיות",2024-11-11T09:09:16.000Z,2024-11-11T09:09:16.000Z
https://www.israelhayom.co.il/viralai/article/17549480,36324,1646,0.04531439269,🦋🌿🌸 10 רעיונות לעיצוב אביבי בסגנון כפרי צרפתי,"🌷 קבלו את האביב בסטייל: 10 רעיונות פשוטים לעיצוב הבית בסגנון כפרי צרפתי – עם צבעוניות נעימה, רעננות ותחושה של חופשה בפרובאנס",2025-03-16T13:22:37.000Z,2025-03-16T13:22:37.000Z
https://www.israelhayom.co.il/viralai/article/17301199,34620,3205,0.09257654535,🐟 הדגים הכי עשירים באומגה 3 – מי שוחה במקום הראשון? 🏆,"מוח חד,  לב בריא ועור זוהר? הכול מתחיל בתזונה עשירה באומגה 3 • חומצת השומן החיונית הזו תורמת לאנרגיה, מונעת דלקות ומשפרת את הבריאות הכללית. אז אילו דגים יספקו לך את הכמות האידיאלית? החמישיה המובילה − כולל מתכון!",2025-02-05T08:54:25.000Z,2025-02-05T08:54:25.000Z
https://www.israelhayom.co.il/viralai/article/15362648,34964,2089,0.05974716852,"ג'ון לנון טעה: הביטלס לא יותר פופולריים מהתנ""ך","היום לפני 58 שנים יצא סולן הביטלס בהכרזה דרמטית שחוללה סערה. לאחר מכן הוא התנצל על האופן שבו נאמרה, אבל לא על תוכנה. אבל איך בכלל אפשר לדעת אם הוא צדק?",2024-03-04T09:32:53.000Z,2024-03-04T10:49:43.000Z
https://www.israelhayom.co.il/viralai/article/15444153,34043,1449,0.04256381635,"שעון הקיץ מגיע – כך תימנעו מלהיכנס ל""ג’ט-לג"" לאחר השינוי","הזזת השעון שעה קדימה או אחורה משפיעה על הגוף, גם אם אנחנו חושבים שאנחנו מוכנים לקראתה. זה מה שצריך לעשות כדי שהגוף יתרגל ללו""ז החדש במהירות וביעילות",2024-03-18T13:28:25.000Z,2024-03-19T08:30:37.000Z
https://www.israelhayom.co.il/viralai/article/15195020,35428,1947,0.05495653156,חפשו מי מנענע: למה כלבים מכשכשים בזנב?,"אנחנו, ואתם, יודעים שכלבים מנענעים את זנבם בדרמטיות כשהם נלהבים ומרוצים – אבל מדענים עדיין לא מצליחים להבין איך בדיוק התפתחה ההתנהגות הזו, השונה מאוד מכל קרוביהם בטבע",2024-01-31T14:16:21.000Z,2024-01-31T14:16:21.000Z
https://www.israelhayom.co.il/viralai/article/14984018,32931,4543,0.1379551183,"""מייגן מרקל לא הבינה שלהארי אין הרבה כסף ושהיא לא תגור בארמון""","כשמייגן מרקל יצאה למסע הרומנטי עם הנסיך הארי, היא האמינה שכל שאיפותיה יתממשו, אך המציאות טפחה על פניה. סופר מלכותי טוען שהיא גילתה שהנסיך שלה הוא בעל אמצעים מוגבלים ולא עשיר מופלג, כמו שהיא האמינה שנסיך חייב להיות",2024-06-11T19:14:59.000Z,2024-06-11T19:14:59.000Z
https://www.israelhayom.co.il/viralai/article/15156367,35466,1524,0.04297073253,תמונות סלפי רעות? טיפים פשוטים לצילום עצמי מושלם,"תרבות הסלפי המוצאת ביטוי בערך בכל מקום היום חוללה מהפכה בביטוי האישי ובאינטראקציה החברתית שלנו. אנשים חוקרים את עצמם, מגבשים זהות ושולטים יותר בדימוי שלהם. לתופעה זו יש רלוונטיות חברתית משמעותית. טיפים בסיסיים לצילום עצמי שישמח אתכם, לשם שינוי",2024-01-24T11:17:48.000Z,2024-01-24T16:31:51.000Z
https://www.israelhayom.co.il/viralai/article/14884774,35983,2235,0.06211266431,מי פה האדם ומי הרובוט? תתפלאו כמה אנשים לא מזהים,ניסויים שנערכו על ידי צוות מדענים מחמישה מוסדות על מאות משתתפים גילו שהבינה המלאכותית יודעת ליצור פנים כל כך אמתיות שרוב האנשים לא מבדילים ביניהם לבין אנשים אמתיים,2023-11-29T13:06:13.000Z,2023-11-29T13:06:13.000Z
https://www.israelhayom.co.il/viralai/article/15792098,32977,3938,0.1194165631,סיבים תזונתיים: מדוע הם חשובים ואיך נעשיר את התזונה שלנו בהם?,"בכל מקום - מאמרי בריאות בתקשורת, פרסומות למזון בריא, או המלצות של רופאים ותזונאים - מעודדים אותנו לצרוך אותם באופן נרחב. הנה כמה מהסיבות המרכזיות לכך שתזונה עשירה בסיבים חשובה כל כך",2024-05-22T12:40:53.000Z,2024-06-11T16:09:16.000Z
https://www.israelhayom.co.il/viralai/article/15337745,33679,2892,0.08586953294,רק אתם והמקומיים: 7 יעדי חופשות בלי תיירים ודוברי אנגלית,רוצים לשכוח מהמלחמה בלי שאיזה תייר ישראלי או מקומי דובר אנגלית יפצחו איתכם בדיון פוליטי? קבלו שבעה מקומות שרוב התיירים לא מגיעים אליהם במדינות שהאנגלית לא שגורה בהן,2024-02-28T08:46:49.000Z,2024-02-28T08:46:49.000Z
https://www.israelhayom.co.il/viralai/article/16001401,33670,1259,0.03739233739,עשה זאת בעצמך: 5 דרכים קלות לעשות מייקאובר לבית,"רוצים לרענן את הבית ולהפיח בו חיים חדשים? עם כמה שינויים פשוטים וזולים, תוכלו לשדרג את המקום הכי חשוב בחיים שלכם",2024-07-01T09:30:57.000Z,2024-07-01T09:30:57.000Z
https://www.israelhayom.co.il/viralai/article/15776123,32455,3142,0.09681096903,איך רבי נחמן מברסלב הבריח את נפוליאון מעכו?,"לפני שעלה לשלטון, הנהיג המצביא הדגול את צבאו במסע לכיבוש ארץ ישראל. לאחר שהצליח לכבוש את רוב המדינה, הוא נתקל בעיר אחת שנהנתה מיותר הגנות מכפי שציפה",2024-05-20T05:45:22.000Z,2024-05-20T05:53:22.000Z
https://www.israelhayom.co.il/viralai/article/17149764,32813,1821,0.0554962972,כוכבים על הקו: שבעה כוכבי לכת מצטלמים יחד בשמי הלילה,"בפברואר 2025 יוכלו חובבי האסטרונומיה לצפות באירוע שמימי נדיר במיוחד, כאשר שבעה כוכבי לכת יסתדרו בשמי הלילה. הכינו את הטלסקופים ואת המשאלות",2025-01-14T09:32:04.000Z,2025-01-14T09:32:04.000Z
https://www.israelhayom.co.il/viralai/article/14770574,32582,1257,0.03857958382,מיאו אמר שהם מסתוריים? לחתולים יש הבעות פנים ברורות,"חוקרים גילו כי למרות התדמית החידתית, לחתולים יש הבעות פנים שמראות בדיוק מה מצב הרוח שלהם – ולא רק זה, אלא שהבעות הפנים שלהם מגוונות יותר משל בני אדם",2023-10-31T08:26:33.000Z,2023-10-31T08:57:23.000Z
https://www.israelhayom.co.il/viralai/article/15289912,32673,1897,0.05806017201,"טעים ומתוק: מתכון לטירמיסו קרמי, ממכר וקל להפליא","כמו שמלת שטיח אדום של ורסצ׳ה, קפה מול הדומו במילאנו או סרט איטלקי קלאסי, גם הקינוח הזה הוא הזמנה שקשה לסרב לה. עם שכבות של בישקוטים אווריריים  ספוגים באספרסו, קרם מסקרפונה טעים ואבקת קקאו, טירמיסו, קינוח חוצה גבולות מארץ המגף, הוא פינוק משמח לב, ולא רק בימים סגריריים",2024-02-19T13:02:47.000Z,2024-02-19T13:49:22.000Z
https://www.israelhayom.co.il/viralai/article/15016879,31925,1485,0.04651527016,החברים של בוב ספוג: 5 ספוגי איפור טובים ולמה אתן צריכות אחד כזה,"חובבות איפור, שימו לב! בין אם את מקצועניות או טירוניות איפור, הכלים הנכונים יכולים לעשות הבדל בין מראה חובבני לגימור הוליוודי. אקססורי יופי צנוע תופס את מרכז הבמה. ספוג יופי, ספוגית איפור, ביוטיבלנדר, לא משנה איך תקראו לו, הוא חיוני מאין כמותו. כל הקריטריונים למציאת ספוג האיפור המושלם ו-5 שמצאנו עבורכן",2023-12-28T08:24:32.000Z,2024-06-11T18:38:29.000Z
https://www.israelhayom.co.il/viralai/article/15718881,32076,2372,0.07394937025,סיינפלד: הסדרה על כלום שהפכה להיות הכל,"החודש לפני 26 שנים, שודר הפרק האחרון של 'סיינפלד', קומדיות מצבים אייקונית שערערה את חוקי הז'אנר. הסדרה שרשת NBC התלבטה לגביה שודרה ברצף 9 שנים והייתה לתופעה תרבותית. איך סדרה על כלום הפכה להיות אבן דרך טלוויזיונית?",2024-05-10T06:04:43.000Z,2024-06-11T19:07:38.000Z
https://www.israelhayom.co.il/viralai/article/17007746,32275,974,0.03017815647,משחקים עם אסלות: פורטנייט מכריזה על שיתוף פעולה עם 'סקיבידי טוילט',המשחק הלהיט בקרב צעירים השיק פריטים חדשים מסדרת היוטיוב שבה אנשים שגופם הוא אסלה נלחמים נגד בני אדם עם מצלמות במקום ראשים,2024-12-22T11:02:40.000Z,2024-12-22T11:02:40.000Z
https://www.israelhayom.co.il/viralai/article/17372572,31885,2364,0.07414144582,פטריות הולכות?! המדע מגלה: יש רגליים לסיפור!,"מחקר חדש מגלה שפטריות אלמוגים יכולות ""ללכת"" על קרקעית הים - בלי רגליים. האם זה אומר שיש עוד הרבה דברים שאנחנו לא יודעים על עולם הטבע?",2025-02-17T15:01:42.000Z,2025-02-17T15:01:42.000Z
https://www.israelhayom.co.il/viralai/article/17253974,32073,2559,0.07978673651,יש דברים שקורים רק ביבנה,העיר שמדרום לגוש דן עלתה ביממה האחרונה לכותרות בעקבות פרשייה מביכה שהפכה לפלילית – אבל ימי הזוהר שלה היו בכלל במאה הראשונה והשנייה לספירה,2025-01-29T11:26:18.000Z,2025-01-29T11:26:18.000Z
https://www.israelhayom.co.il/viralai/article/15888358,32225,2079,0.06451512801,"אלוהים, תעזור לי: איך לצאת משיחה שלא נגמרת","לפעמים אנו נקלעים לסיטואציה שבה נראה שהאדם השני לעולם לא יפסיק לדבר. בין אם זה בארוחה משפחתית, במסיבה או בתור לרופא - איך להימלט?",2024-06-09T10:01:39.000Z,2024-06-09T10:01:39.000Z
https://www.israelhayom.co.il/viralai/article/17357913,31414,1656,0.05271534984,הסרת עובש בחדר האמבטיה? - מדריך שלב אחר שלב 🛁✨,"עובש בחדר האמבטיה? זה הזמן להפתיע את עצמכם! המדריך המלא להסרת עובש בקלות ובמהירות, עם חומרים שכולם כבר בבית – כך תחזירו את המקלחת למצב חדש, רענן ונקי, והכל עם מה שיש בבית! 🪥🚿",2025-02-13T13:23:04.000Z,2025-02-13T13:23:04.000Z
https://www.israelhayom.co.il/viralai/article/15816537,29978,3333,0.1111815331,מדענים גילו מדוע הדינוזאורים הפכו כל כך גדולים,"במסגרת מחקר שנעקך באוניברסיטת סאו פאולו, ברזיל, התגלו שרידיו של דינוזאור קטן המהווה חוליה מקשרת בין הדינוזאורים הקטנים הראשונים לענקים שמעוררים את דמיוננו היום. התגלית הזו מספקת נקודת מבט חדשה על השאלה איך בעלי חיים מרתקים אלה התפתחו לאורך מיליוני שנים",2024-05-27T08:34:15.000Z,2024-06-11T15:53:35.000Z
https://www.israelhayom.co.il/viralai/article/15609299,30828,1952,0.06331906059,11 מיתוסים נפוצים על אוכל שהמדע ניפץ,"לא מעט מיתוסים ארוכי שנים על אוכל שסבתות חביבות עם כוונות טובות ותחבולות שיווקיות מנציחות, אבל היום ידועה האמת המדעית לגביהם. להלן כמה בולטים שיש להכיר כי אין סיבה שלא תיהנו מעוצמתן התזונתית של ביצים או פחמימות טובות",2024-04-16T08:20:54.000Z,2024-04-16T08:42:48.000Z
https://www.israelhayom.co.il/viralai/article/15143311,30616,1609,0.05255422002,"למה מנכ""ל נטפליקס מרוצה מהעובדה שהמוני עובדים מתפטרים כל חודש?","ריד הייסטינגס, שייסד את ענקית הסטרימינג ומנהל אותה כיום לצד טד סרנדוס, מספר בספר שכתב איך הצליחה החברה הצעירה והזעירה לנצח את ענקית השכרת הווידאו בלוקבאסטר, ולהישאר רלוונטית למרות אינספור שינויים בשוק",2024-01-22T13:30:59.000Z,2024-01-22T13:30:59.000Z
https://www.israelhayom.co.il/viralai/article/15265664,30326,2430,0.08012926202,יש לכם פולשים קטנים בבית? כך תתמודדו איתם בלי הדברה,"עכברים, חרקים, נמלים ועכבישים הם לא מראה מלבב כשהם נמצאים בתוך הבית שלכם – אבל רוב הדרכים המוכרות להתמודד איתם מסריחות או אכזריות. כך תיפטרו מהם בלי לרסס",2024-02-14T09:34:37.000Z,2024-02-14T09:34:37.000Z
https://www.israelhayom.co.il/viralai/article/16812308,31055,3302,0.1063274835,"""הר ההארה"": האם הפירמידה באינדונזיה משכתבת את תולדות האנושות?","לפי מאמר אקדמי שפורסם ואז הורד מהרשת, תיארוך האתר ""מאתגר את האמונה המקובלת שהציביליזציה האנושית והתפתחות טכניקות בנייה מתקדמות עלו רק עם תחילת החקלאות לפני כ-11,000 שנה""",2024-11-19T15:51:34.000Z,2024-11-19T15:51:34.000Z
