Landing Page,Impressions,Url Clicks,URL CTR,title,subtitle,date_published,date_updated
https://www.israelhayom.co.il/viralai/article/15396798,1211774,128947,0.1064117566,20 ביטויים שיכולים לצלק את ילדך לכל החיים,"ילדינו הם היצורים האהובים והיקרים לנו ביותר. אנו רוצים להגן עליהם, לגדל אותם באושר ולעזור להם לפרוח. עם זאת, לא תמיד אנו מודעים לכך שדברים שאנו אומרים להם, גם מתוך כוונות טובות, עלולים להותיר צלקות רגשיות עמוקות",2024-03-10T10:35:47.000Z,2024-03-10T19:10:42.000Z
https://www.israelhayom.co.il/viralai/article/15799850,1003787,69209,0.06894789432,15 הרגלים יומיים לשיפור חילוף החומרים ושריפת השומנים,דמיינו עולם שבו לא צריך להתייסר בחדר הכושר שעות על גבי שעות ולא להרגיש אשמה בכל פעם שאתם מתפנקים במאכלים האהובים עליכם. זו לא רק פנטזיה; זו מציאות אפשרית. ההרגלים הבאים ימקסמו את שריפת האנרגיה שלכם ויהפכו את גופכם למכונה יעילה יותר לשריפת שומנים,2024-05-23T14:25:47.000Z,2024-06-11T16:06:04.000Z
https://www.israelhayom.co.il/viralai/article/15503962,1049472,98784,0.0941273326,כך ילדים קוראים לעזרה: ביטויים שלעולם אין להתעלם מהם,"כל הורה מכיר את התסכול של ילד כעוס שעונה תשובות של מילה אחת או סתם מגיב בפרצפת. אבל מה אם השתיקה מסתירה בעיה עמוקה יותר? לעתים קרובות, המסרים החשובים ביותר של ילד מגיעים בתחפושת של ביטויים חסרי משמעות, אבל הם יכולים להיות אותות אזהרה",2024-03-28T11:19:26.000Z,2024-03-28T19:32:55.000Z
https://www.israelhayom.co.il/viralai/article/16369991,1059686,93522,0.08825444518,10 הרגלים שקטים שמובילים לשומן בטני (ומה לעשות במקומם),"כשאנחנו חושבים על הסיבות לשומן בטני, אנחנו מדמיינים בדרך כלל הרגלים ברורים כמו חוסר פעילות גופנית וצריכה גבוהה של סוכר ומזון מעובד. אך לפי מומחים השומן המטריד בבטן שלכם עשוי להצטבר בגלל הרגלים שקטים ויומיומיים שאולי כלל לא העליתם על דעתכם?",2024-09-02T09:23:08.000Z,2024-09-02T13:32:37.000Z
https://www.israelhayom.co.il/viralai/article/15823476,1132226,132861,0.117344947,9 סימנים לכך שאתם חכמים מהממוצע • ושלושה סימנים שאתם לא,האם אתם מרגישים שאתם חכמים מרוב האנשים? יש לכם אינטלקט חריף מהרגיל? בדקו את הסימנים הללו כדי לראות אם אתם בצד החכם של הספקטרום או שאולי אתם בצד השני,2024-05-28T12:33:11.000Z,2024-06-11T15:43:07.000Z
https://www.israelhayom.co.il/viralai/article/15368135,998355,92154,0.09230584311,מדע הורדת קילוגרמים: 23 מזונות שורפי שומן לירידה במשקל,"אתם במשימת הרזיה אבל לא בטוחים איפה להתחיל? יש הכול במטבח שלכם! בעוד משקל היעד מרגיש כמו מטרה אבודה, שילוב של מזונות מסוימים בתזונה שלכם יכול להוביל אל תמונת הנצחון במראה שלכם ואף לתרום לבריאותכם הכללית. מתבלינים מעודדי חילוף חומרים ועד לירוקים מזינים, 23 המזונות הללו הוכחו מדעית כשורפי שומן",2024-03-05T08:31:20.000Z,2024-03-07T09:13:30.000Z
https://www.israelhayom.co.il/viralai/article/16333182,1103670,108918,0.09868710756,20 סימנים שהיו לכם הורים באמת מדהימים,"לא כל אחד זוכה להורים שמבינים את אומנות ההורות • במאמר זה, נצלול לעומק עשרים סימנים המצביעים על כך שההורים שלכם היו יותר ממדהימים - הם היו דוגמה ומופת לאיך צריך לגדל ילדים • אולי תמצאו את עצמכם מחייכים בהכרת תודה, כשאתם מזהים את הדוגמאות הללו בחיים שלכם",2024-08-27T08:25:23.000Z,2024-08-27T08:48:33.000Z
https://www.israelhayom.co.il/viralai/article/16422542,1154302,92026,0.07972437023,לגדל ילדים עם ביטחון רגשי: 15 משפטים שכדאי לומר להם,"בניית עולם רגשי בטוח שבו הילד יכול לצמוח היא חלק משמעותי בהורות מודרנית • הכוח לעצב את נפשו של הילד  טמון במילים • כמו בניין רב-קומות הזקוק ליסודות איתנים, כך גם ילד זקוק למילים שיוצרות עבורו תחושת ביטחון, שייכות והכרה • 15 משפטים מהותיים לגידול ילד שיוכל להתמודד עם אתגרי החיים בצורה חיובית ובריאה",2024-09-11T07:37:05.000Z,2024-09-11T07:37:05.000Z
https://www.israelhayom.co.il/viralai/article/16808202,1062037,189022,0.1779806165,החתונה של אביה: הזמינה 75 אורחים לחתונה – רק 5 הגיעו,זוג שתכנן את חתונתו מאז מגיפת הקורונה התאכזב להיכנס לאולם ריק. הכלה המתוסכלת שיתפה את התיעוד בטיקטוק – וזכתה לאלפי תגובות מפרגנות,2024-11-19T08:54:40.000Z,2024-11-19T08:54:40.000Z
https://www.israelhayom.co.il/viralai/article/15766017,1371788,76909,0.05606478552,ליהנות מכל העולמות: 11 ירקות עתירי חלבון להוסיף לצלחת שלכם,"כשאתם חושבים על מזון עשיר בחלבון, ירקות הם כנראה לא הדבר הראשון שעולה לכם בראש. אבל יש לא מעט ירקות שמספקים כמות יפה. יתרה מזאת, חלבון צמחי קל יותר לעיכול מחלבון מן החי, דליל בשומן רווי וכולסטרול, ותורם לתחושת שובע ממושכת",2024-05-18T15:01:11.000Z,2024-06-11T18:47:04.000Z
https://www.israelhayom.co.il/viralai/article/16183672,904348,66926,0.07400469731,מה לאכול כדי לעזור בהצמחת שיער ובהפחתת נשירה,"נשירת שיער היא תופעה שכיחה שיכולה להיגרם ממגוון גורמים, כולל תורשה, תזונה לקויה, מתח נפשי ושינויים הורמונליים • תזונה נכונה ומאוזנת יכולה לשחק תפקיד מרכזי בשיפור מצב השיער ובהפחתת נשירה • להלן המזונות שיכולים לעזור בהצמחת שיער ובריאות הקרקפת",2024-08-01T11:53:59.000Z,2024-08-01T11:53:59.000Z
https://www.israelhayom.co.il/viralai/article/15570146,933294,78750,0.08437855595,עכברים בבית? צמח התבלין הזה מרחיק אותם באופן טבעי,"הוא רב-תכליתי, בעל ניחוח ייחודי וטעם מרענן, והשימוש בו נע בין המטבח ועד רפואה עממית, דרך טיפוח וקוסמטיקה ואפילו ניקוי הבית. לא פעם אתם נתקלים בו בסלטים, קוקטיילים ותה. גידולו קל ואפילו רוצחי צמחים סדרתיים מתקשים להרוג אותו. אבל צמח הנענע ניחן גם בתכונה נדירה יקרה - הוא מרחיק נמלים, עכבישים ועכברים!",2024-04-09T08:40:43.000Z,2024-04-09T08:40:43.000Z
https://www.israelhayom.co.il/viralai/article/16930557,947676,64847,0.06842739502,ביטויים שכדאי להפסיק לומר לילדים - עצות ממומחי פסיכולוגיה,"מילים יכולות להיות חיבוק חם או דקירה בלתי נשכחת. כשמדובר בילדים, האופן שבו אנו מדברים אליהם מעצב את עולמם הפנימי. במאמר זה נחשוף את הביטויים שכדאי להימנע מהם ואת הדרכים להחליפם במסרים מעצימים וחיוביים",2024-12-09T09:14:52.000Z,2024-12-09T09:14:52.000Z
https://www.israelhayom.co.il/viralai/article/15616146,963517,75271,0.07812109179,מקרר של קרדיולוגית: 10 מזונות בריאים במיוחד ללב,"תהיתם פעם מה מחזיקים רופאי לב במקרר שלהם? אולי תופתעו לגלות שזה לא אוכל בריאות אקזוטי, אלא אוצר של מרכיבים מוכרים וטעימים שנמצאים במרכול השכונתי שלכם. קרדיולוגית מומחית פותחת את המקרר שלה ומגלה מה היא אוכלת לבריאות הלב שלה. המלצה מהלב",2024-04-17T08:26:48.000Z,2024-06-13T07:26:31.000Z
https://www.israelhayom.co.il/viralai/article/14951579,929822,82306,0.08851801743,הכינו שעונים: מחר ישוגר טיל שנוחת בצורה מאוד מקורית,"“אלקטרון"" הוא טיל רב-פעמי שמיועד להוביל לחלל לוויינים קטנים, ומחר בבוקר הוא ישוגר בפעם ה-42, והנחיתה שלו תיראה שונה מזו שהתרגלנו לראות עם הטילים של מאסק",2023-12-14T14:53:53.000Z,2023-12-14T14:58:39.000Z
https://www.israelhayom.co.il/viralai/article/15777919,947787,91713,0.09676541248,שעת הזהב: פעילות גופנית בשעה זו של היום הכי טובה לירידה במשקל,הקיץ כבר פה והמוטיבציה שלנו להיות פעילים גבוהה. איך נפיק את המירב? נתעמל בזמן ביום שמחקר פורץ דרך מצא שהוא עשוי להיות הזמן האופטימלי עבור מי שמחפשים לנהל את משקלם ביעילות,2024-05-20T10:13:48.000Z,2024-06-11T18:33:42.000Z
https://www.israelhayom.co.il/viralai/article/16691574,891480,73408,0.08234396734,11 סיבות לשלב חומץ בכביסה: יתרונות שלא הכרתם,"בעידן שבו המודעות האקולוגית והבריאותית עולה, השימוש במרכיבים טבעיים ונגישים הופך לאטרקטיבי יותר מאי פעם • התכונות המיוחדות של החומץ מציעות פתרונות למגוון בעיות נפוצות בכביסה, החל בהלבנת בגדים ועד הסרת ריחות עיקשים • אם אתם מחפשים שדרוג ירוק וחסכוני לשגרת הכביסה שלכם, הנה כל הסיבות לעשות שימוש במוצר המטבח הפשוט והיומיומי",2024-10-30T10:55:38.000Z,2024-10-30T11:08:04.000Z
https://www.israelhayom.co.il/viralai/article/15584515,822299,45739,0.0556233195,21 יעדים עוצרי נשימה בעולם שחייבים לראות לפני שמתים,"החיים קצרים והעולם הוא מקום מופלא עשיר בטבע פראי עוצר נשימה ומונומנטים מעשה ידי אדם שמעיפים את המוח. לא לבקר לפחות פעם אחת במקומות הללו או כמה מהם יכול להיות עוול מצער. מהשלמות השמימית של 'עיר האינקה האבודה' בפרו ועד ליופי הרודף של סוואנת הסרנגטי בטנזניה, אלה המקומות שיש לראות לפני שנפרדים מהעולם",2024-04-12T07:40:51.000Z,2024-04-12T11:19:46.000Z
https://www.israelhayom.co.il/viralai/article/17023023,846955,58939,0.06958929341,9 המאכלים הטובים ביותר לשיפור הזיכרון,תוהים איך לשמור על מוח ממוקד וזיכרון חד? מחקרים עדכניים מראים שתזונה היא כלי עוצמתי לשיפור תפקודי המוח • אילו מאכלים יכולים לסייע לכם חשוב בבהירות רבה יותר ולזכור טוב יותר? רשימה משמחת,2024-12-24T12:33:23.000Z,2024-12-26T07:40:38.000Z
https://www.israelhayom.co.il/viralai/article/15961273,981171,81224,0.08278271575,10 צמחים דוחי יתושים שאתם צריכים בגינה או בחלון שלכם,"למה להשקיע בקוטלי חרקים או תרסיסים נגד יתושים אם אפשר להרחיק אותם באופן טבעי עם צמחים? להלן עשרה צמחים יעילים להרחקת יתושים, שיעשירו את יופי הגינה ואדני החלונות שלכם וירחיקו את המעופפים המציקים הללו",2024-06-24T07:14:08.000Z,2024-06-24T19:43:48.000Z
https://www.israelhayom.co.il/viralai/article/17378371,773923,67380,0.08706292486,איך להוריד לחץ דם בלי תרופות? 8 שיטות מוכחות שכדאי להכיר,"💓 האם לחץ הדם שלכם גבוה ואתם מחפשים פתרון טבעי? אתם לא לבד! מיליוני אנשים ברחבי העולם מתמודדים עם לחץ דם גבוה, אך החדשות הטובות הן שלא חייבים לפנות מיד לתרופות. שינויים קטנים באורח החיים יכולים להוריד את לחץ הדם בצורה טבעית, לשפר את הבריאות ולמנוע סיבוכים מסוכנים",2025-02-17T09:37:16.000Z,2025-02-17T09:37:16.000Z
https://www.israelhayom.co.il/viralai/article/15645716,730139,57616,0.07891100188,רוצים לחגוג יום הולדת מאה? אלו 5 מזונות שכדאי לוותר עליהם,"תשכחו ממעיין הנעורים, המפתח לחיים ארוכים נמצא בצלחת שלכם. 5 מזונות נפוצים הם האשמים התזונתיים שמחבלים בסיכוי שלכם לחגוג מאה. המזונות האלו עמוסים בפחמימות מזוקקות, שומנים לא בריאים וסוכרים חבויים הגורמים לדלקות כרוניות - שחקן מרכזי במחלות שגונבות שנים מחיינו",2024-04-24T06:44:50.000Z,2024-06-12T14:01:09.000Z
https://www.israelhayom.co.il/viralai/article/15048983,743368,128650,0.1730636777,נבואה מפחידה של נוסטרדמוס ל-2024 התגשמה שעות ספורות לתוך השנה החדשה,"כשהשעון צלצל בחצות ב-1 בינואר, העולם קיבל את השנה החדשה בחגיגות ובזרועות פתוחות. אבל רק כמה שעות לתוך 2024, הרעישה את יפן רעידת אדמה חזקה בעוצמה של 7.5 בסולם ריכטר, והטילה ספק בגבול שבין מציאות לנבואה. האם הרופא והאסטרולוג בן המאה ה-16 חזה את אסון הטבע ביפן?",2024-01-04T11:03:33.000Z,2024-06-11T19:27:26.000Z
https://www.israelhayom.co.il/viralai/article/15718583,750398,71037,0.09466576403,"7 ביטויים של מעוטי אינטליגנציה רגשית, לפי פסיכולוגית הארוורד","שיחות היומיומית שלנו, ישנם ביטויים הפורמים את המארג העדין של אמפתיה ומודעות עצמית. לדברי פסיכולוגית מומחית מאוניברסיטת הארוורד, ביטויים אלה הם סימנים מובהקים של אינטליגנציה רגשית נמוכה, המטילים צל על מערכות יחסים",2024-05-09T06:50:41.000Z,2024-06-11T19:14:50.000Z
https://www.israelhayom.co.il/viralai/article/15227905,716127,79211,0.1106102688,ילדים הופכים למבוגרים מאושרים כשההורים חוזרים על הביטויים האלה,"האמרה 'מעשים מדברים יותר ממילים' מתקיימת  בהיבטים רבים של החיים, כולל הורות. ילדים אכן לומדים על החיים על ידי התבוננות בהתנהגויות מבוגרים, אך אין להמעיט בחשיבות תקשורת מילולית. באמצעות הצהרות ספציפיות וחיוביות, להורים יש את הכוח להעצים את ילדיהם, תוך טיפוח ראייה עצמית חיובית. 13 ביטויים לעתיד מאושר יותר",2024-02-07T08:29:50.000Z,2024-02-08T07:03:46.000Z
https://www.israelhayom.co.il/viralai/article/16081205,714276,99825,0.1397569007,דברים שהורים עושים שגורמים לילדים טראומה לכל החיים,"ילדים הם רגישים ונוטים ללמוד מהסביבה, מה שהופך את פעולות ההורים לבעלות השפעה משמעותית על בריאותם הרגשית. הילדים יכולים ללמוד שיעורים חשובים מההורים, אך לפעמים, הורים רבים לא מודעים להשפעות ארוכות הטווח של התנהגותם על ילדים ועלולים לגרום נזק בלתי מכוון, אך מתמשך",2024-07-15T10:43:50.000Z,2024-07-16T07:42:25.000Z
https://www.israelhayom.co.il/viralai/article/15891499,732290,88974,0.1215010447,14 התנהגויות שהופכות אתכם למושכים בלי מאמץ,"מי לא רוצה שיחשבו עליו שהוא מושך? אנשים רבים משקיעים הון כדי להיראות טוב יותר, אבל להיות מושך זה הרבה מעבר לגזרת פסל יווני, עור פורצלן וריסים עבים. יופי מסוים חשוב יותר ממותניים חטובים, ויש הרבה דברים שיכולים להפוך אדם לאטרקטיבי בלי להתאמץ",2024-06-10T05:05:29.000Z,2024-06-11T13:28:15.000Z
https://www.israelhayom.co.il/viralai/article/16409228,716338,70846,0.09890023983,"ביטויים שגורמים לאנשים לא לחבב אתכם, לפי פסיכולוגים","אתם מנהלים שיחה, הכל זורם, אבל פתאום שינוי מפתיע  – חיוך מתעמעם, התרחקות פיזית, ואווירה קרירה. אמרתם משהו שגרם לאדם מולכם להירתע? פסיכולוגים טוענים שכן. לפעמים אנו משתמשים בביטויים לכאורה שגרתיים, אך בפועל הם מעוררים חוסר אהדה. 19 כאלו שהופכים אתכם ל'לא אהובים' מידית ועדיף להימנע מהם",2024-09-09T06:14:29.000Z,2024-09-09T06:14:29.000Z
https://www.israelhayom.co.il/viralai/article/16271035,721014,69848,0.09687467927,"מהם ""גירושים אפורים"" ומדוע זוגות בוחרים בהם?","בשני העשורים האחרונים, תופעה חדשה צוברת תאוצה ומאתגרת תפיסות מסורתיות – ""גירושים אפורים"". מדובר בבני זוג שנמצאים בשנות ה-50, ה-60, ולעיתים אף יותר, המחליטים להיפרד לאחר עשרות שנים יחד. מדוע יותר זוגות בוחרים במהלך אמיץ זה? התשובות מציגות מגמה חברתית חדשה שמאירה את גיל הזהב באור אחר",2024-08-18T09:02:46.000Z,2024-08-20T06:55:11.000Z
https://www.israelhayom.co.il/viralai/article/16710541,720326,44934,0.06238008902,ביטחון רגשי אצל ילדים מתחיל במילים: 15 משפטים מחזקים,"ביטחון רגשי של ילדינו אינו נבנה רק דרך חיבוקים או הגנה מפני קשיים; לפעמים, הכוח האמיתי טמון במילים שאנו אומרים להם. משפטים מעודדים ומחזקים יכולים להשפיע על הדרך שבה הם רואים את עצמם ואת העולם. רוצים לגדל ילדים בטוחים ומאושרים? הנה 15 משפטים שישנו את השיח בבית",2024-11-03T07:51:22.000Z,2024-11-03T08:08:54.000Z
https://www.israelhayom.co.il/viralai/article/16347897,714101,44142,0.0618147853,האם חומץ תפוחים עוזר לירידה במשקל?,"האם יתכן שפתרון קסם לירידה במשקל מסתתר דווקא בבקבוק חומץ תפוחים על מדף המטבח? המחשבה שאפשר להפוך מרכיב יומיומי לפתרון בריאותי מתוחכם קורצת לרבים מאיתנו, במיוחד בעידן שבו כולם מחפשים את הגימיק הבא שיאיץ את תהליך ההרזיה. אבל האם מאחורי השמועות והמיתוסים מסתתרת גם אמת מדעית?",2024-08-29T07:56:46.000Z,2024-08-29T07:56:46.000Z
https://www.israelhayom.co.il/viralai/article/17030698,694961,66558,0.09577228075,10 דברים להוציא מהמטבח ולזרוק לפני 1 בינואר,"בואו נודה על האמת — המטבח שלכם לא ממש מטבח מהמגזינים • בין קופסאות סדוקות לתבלינים בני עשור, מסתתר בלאגן שמכביד עליכם יותר משנדמה • שנת 2025 בפתח, ואין זמן טוב מזה להיפרד מכל מה שמיותר, מכביד ויוצר טעם רע, תרתי משמע!",2024-12-25T13:33:01.000Z,2024-12-26T07:36:05.000Z
https://www.israelhayom.co.il/viralai/article/14918371,680175,59555,0.08755834895,מזל טוב: אילון מאסק חוגג 90,"לא השתגענו – האיש העשיר בעולם אמנם בן 52, אבל הבוקר הוא חגג 90, ומקווה לחגוג גם 100 עד סוף השנה. איך הוא מתכוון לעשות את זה?",2023-12-07T12:32:53.000Z,2023-12-07T12:32:53.000Z
https://www.israelhayom.co.il/viralai/article/14968747,696529,86759,0.1245590636,"“חולת הנפש"" התעוררה אחרי 20 שנה – ושינתה את עולם הרפואה לנצח","אפריל חוותה בגיל 21 אירוע שגרם לה להתנתק מהעולם ולהסתגר בתוך מה שאובחן כסכיזופרניה חריפה. דבר דומה קרה לדיוויין קרוז בגיל 9. כעת שתיהן חוזרות לתפקוד מלא, בזכות גישה חדשה שמצאה כי מה שאובחן כמחלות פסיכולוגיות חסרות טיפול הוא למעשה מחלות פיזיות שאפשר לטפל בהן",2023-12-18T13:44:55.000Z,2023-12-18T13:44:55.000Z
https://www.israelhayom.co.il/viralai/article/15163747,698779,66477,0.09513308213,תזכרו את זה: טיפים של נוירולוג לשמירה על הזיכרון גם בגיל מבוגר,"רוצים לזכור את השם של כל מי שאתם פוגשים, מתי הייתם בחופשה ההיא באילת או איפה שמתם את המפתחות? כל אלה דברים שאתם בהחלט מסוגלים לעשות, ולא חשוב אם אתם בני 20 או 80. הנה כמה טיפים לשמירה על זיכרון רענן לאורך שנים",2024-01-25T15:33:05.000Z,2024-01-25T15:33:05.000Z
https://www.israelhayom.co.il/viralai/article/15048051,685480,87737,0.1279935228,במקום הזרקות: 3 מאכלים טעימים ובריאים לאכול להשבת קולגן ועור צעיר,"קולגן, חלבון רקמות החיבור בגופנו, מהווה 80% מחלבוני עור הפנים. אבל בסביבות גיל 30 ייצורו הטבעי הולך ופוחת. כאן נכנסת לתמונה תזונה שיכולה להשפיע. מבחינת מחקרי מזונות מגבירי קולגן וחוות דעת מומחים, מתגלים 3 מזונות שאכילתם היא בוסט רציני של קולגן",2024-01-04T09:25:42.000Z,2024-01-04T14:24:11.000Z
https://www.israelhayom.co.il/viralai/article/16323073,711173,57821,0.08130370529,כוס של בוקר: האם מים עם לימון הם באמת המפתח לבריאות טובה?,"בכל בוקר של יום חדש, רבים מאיתנו פונים לאותו הרגל בריאותי ששמעו עליו לא פעם: כוס מים עם לימון סחוט טרי • האם באמת מדובר במפתח נסתר לבריאות טובה או רק בעוד טרנד חולף בעולם הבריאות?",2024-08-26T06:10:56.000Z,2024-08-26T16:52:40.000Z
https://www.israelhayom.co.il/viralai/article/16839457,667081,46690,0.06999150028,גידול חתולים טוב – אבל גם רע - לבריאות,"הכנסת חתול הביתה, או אפילו ידידות עם חתולי רחוב, יכולה להועיל לבריאותנו הפיזית והנפשית – אבל גם לערער אותה. כך תחיו לצד חתולים ותיהנו מהיתרונות בלי לסבול מהחסרונות",2024-11-24T15:08:33.000Z,2024-11-24T15:08:33.000Z
https://www.israelhayom.co.il/viralai/article/14967391,690146,76558,0.110930151,"בני אדם הצליחו ""לתקשר עם חייזר"" - שחי בלב הים","אחד המוסדות היוקרתיים בעולם לחיפוש חיים תבוניים מחוץ לכדור הארץ פרסם מחקר שנמשך יותר משנה, ובמהלכו הוא שיתף פעולה עם מוסדות אחרים במטרה לדבר עם לווייתנים. איך קשורים היונקים הימיים האדירים לחוצנים?",2023-12-18T10:02:15.000Z,2023-12-18T10:02:15.000Z
https://www.israelhayom.co.il/viralai/article/17220114,706018,67610,0.09576243099,10 סימנים שההורים שלכם גידלו אתכם מצוין − ומצביעים על חינוך מוצלח!,"האם עצרתם פעם לחשוב איך החינוך שקיבלתם עיצב אתכם? 🏡👶 ערכים, הרגלים וגישה לחיים – כל אלו מתחילים בבית. אם אתם תוהים האם גדלתם בסביבה שטיפחה אתכם להצלחה, לפניכם 10 סימנים ברורים שכן",2025-01-24T14:36:45.000Z,2025-01-24T14:36:45.000Z
