Landing Page,Impressions,Url Clicks,URL CTR,title,subtitle,date_published,date_updated
https://www.israelhayom.co.il/podcasts/article/15050467,32308,1668,0.05162807973,"""החלטת המדינה להחזיר את תושבי שדרות לבתיהם, היא באמת מטומטמת""","תושבי שדרות זועמים על כוונת הממשלה להחזיר אותם לבתיהם עוד בטרם הוחלט שבטוח בעיר מבחינה ביטחונית • סגנית ראש העירייה, יהודית אוליאל מלכה טוענת: ""אני בעצמי חוששת להיכנס לבית שלי"" • וגם, ד""ר אורית רישפי לביא עונה על השאלה מתי יבוא היום שחברי מועצה יקבלו שכר על פועלם • ומדוע ראש עיריית גבעתיים הפסיק להעלות פוסטים בטוויטר?",2024-01-04T14:07:10.000Z,2024-01-05T10:39:46.000Z
https://www.israelhayom.co.il/you-may-find-interesting/article/14951487,27926,587,0.02101983814,מתגייסים לעסקים: מזרחי טפחות יוצא בסדרת הטבות לבעלי עסקים במילואים,"בעקבות המצב הביטחוני, בעלי עסקים שנקראו למילואים מצאו את עצמם באי ודאות כלכלית מתמשכת. במטרה לתת מענה יעיל ולסייע להמשך הפעילות, גיבש בנק מזרחי טפחות סל פתרונות והטבות לבעלי עסקים המשרתים בצו 8",2023-12-17T08:16:19.000Z,2023-12-26T14:37:47.000Z
https://www.israelhayom.co.il/you-may-find-interesting/article/17392299,24158,941,0.03895189999,מהתמודדות אישית למהפכה חינוכית: האישה שמצילה ילדים מחרמות ומכישלונות,"כשאלונה שטיינברג גילתה שבתה הבכורה מתמודדת עם הפרעת קשב וריכוז והיפראקטיביות, היא לא דמיינה עד כמה זה ישנה את חייה. חוסר השקט, הריבים האינסופיים בבית, והתחושה שהיא לא מצליחה להיות האמא שרצתה להיות – כל אלה הובילו אותה למסע אישי של גילוי עצמי ושינוי",2025-02-27T08:12:49.000Z,2025-02-27T09:16:27.000Z
https://www.israelhayom.co.il/you-may-find-interesting/article/17153068,31234,2454,0.07856822693,ישראל בדרך למהפכת אנרגיה ירוקה: האם נוביל את העולם?,"המהפכה הסולארית בישראל: דו-שימוש, בורסות חשמל ודחיפה ברגולציה יכולים להפוך את ישראל למובילה עולמית באנרגיה מתחדשת",2025-01-15T08:00:17.000Z,2025-01-15T13:11:46.000Z
https://www.israelhayom.co.il/you-may-find-interesting/article/16983341,29878,675,0.02259187362,2024: המכוניות האוטונומיות עולות שלב,"אחרי 20 שנה של ניסויים ומכשולים, המכוניות האוטונומיות סוף סוף על הכביש",2024-12-18T08:00:21.000Z,2024-12-18T08:10:35.000Z
https://www.israelhayom.co.il/you-may-find-interesting/article/16498041,25667,825,0.03214243971,"""מחסן התבואה"" של ישראל, חיות בר נדירות, ואתרי מורשת: שיקום העוטף, שקיבל על ידי הממשלה את הכינוי ""חבל תקומה"" – דורש תכנית סדורה שלא תפספס אף היבט","הוועידה השנתית למדע וסביבה תתקיים השנה כמחווה לדרום באוניברסיטת בן גוריון שבנגב. אחד הנושאים החשובים הוא שיקום יישובי העוטף והנגב המערבי ומעבר לבנייה מחדש של היישובים והתשתיות, כיוון שישנה חשיבות אדירה לשיקום אקולוגי באופן מדויק",2024-09-24T09:41:30.000Z,2024-09-24T09:42:56.000Z
https://www.israelhayom.co.il/podcasts/article/16333184,22686,3296,0.1452878427,"""זו הייתה האהבה הגדולה הראשונה שלי, וזה היה שברון לב. היה קשה""","השחקנית נאיה בינשטוק התארחה בפודקאסט ""החופרת"" וסיפרה על התגובות לתפקידה ב""בלקספייס"" * על העבודה בדרך לפריצה הגדולה: ""אני לייט בלומר. הרבה שנים כל 'ילדי התיאטרון' מאוד איימו עליי, הרגשתי שהם בפור עליי"" * איך הייתה הטירונות עם נועה קירל ועדי ביטי ומדוע היא לא מגיעה להשקות? הכל בפרק החדש * צפו",2024-08-27T07:05:25.000Z,2024-08-27T07:05:25.000Z
https://www.israelhayom.co.il/you-may-find-interesting/article/17202010,18101,1380,0.07623888183,"""הניסוי הקליני הגדול בעולם"": מחקר ישראלי פורץ דרך מזהה מזהמים במי קולחין בשלבים מוקדמים","ישראל ממשיכה להוביל בעולם בתחום מחזור מי הקולחין – תהליך קריטי, יקר ומורכב. מחקר חדש מתמקד באיתור הורמונים משאריות תרופות, שדי בננו-גרמים מהם כדי לגרום לנזק משמעותי, ומקדם את תחום טיהור המים לרמות דיוק וטיפול חסרות תקדים",2025-01-22T08:00:11.000Z,2025-02-05T14:03:27.000Z
https://www.israelhayom.co.il/you-may-find-interesting/article/16021617,18028,469,0.02601508764,ללמוד לתואר עם חברים מהעירייה,"בשורה לעובדי רשויות מקומיות ותאגידים ציבוריים: מסלול ייחודי של האוניברסיטה הפתוחה ובית הספר לשלטון מקומי מציע תוכנית לימודים לתואר ראשון או שני * ויש גם מלגה בסך 6,000 שקל בשנה",2024-07-07T09:07:50.000Z,2024-07-07T10:26:55.000Z
https://www.israelhayom.co.il/you-may-find-interesting/article/16456793,23182,1842,0.07945820033,בין ארמונות לקניונים: חופשה מושלמת בבוקרשט,"חולמים לטייל באירופה הקלאסית בלי לקרוע את הכיס? במרחק שעתיים וחצי טיסה מישראל, בוקרשט תאפשר לכם לחוות את אירופה במיטבה בעלויות ידידותיות",2024-09-17T09:28:20.000Z,2024-09-17T09:28:20.000Z
https://www.israelhayom.co.il/you-may-find-interesting/article/15464232,18580,679,0.03654467169,מזרחי-טפחות ממשיך להוביל בפער גדול את שוק המשכנתאות בישראל,"למרות התחרות העזה והאתגרים הרבים, בשוק המשכנתאות בישראל אין חדש: מזרחי-טפחות שומר על המקום הראשון עם נתח שוק של כ-34%, כשהבנק במקום השני מחזיק בנתח שוק של 27.5% - כך עולה מסיכום דוחות הבנקים לשנת 2023. דרור פלדמן מנהל זרוע המשכנתאות במזרחי-טפחות: זו תעודת כבוד לאלפי הבנקאיות והבנקאים שלנו, שעושים מדי יום את ההבדל בינינו לבין המתחרים, הודות לשירות יוצא דופן, מקצועי ומותאם אישית לכל לקוח ולקוח",2024-03-21T14:41:55.000Z,2024-03-26T07:58:23.000Z
https://www.israelhayom.co.il/you-may-find-interesting/article/16048130,23698,930,0.03924381804,מפעל מיחזור לסוללות רכב חדש בישראל,הפתרון הירוק לפסולת סוללות הרכבים החשמליים,2024-07-09T13:19:54.000Z,2024-08-15T10:06:49.000Z
https://www.israelhayom.co.il/you-may-find-interesting/article/16363090,18953,785,0.04141824513,404,עמוד 404,,
https://www.israelhayom.co.il/you-may-find-interesting/article/14928664,23950,899,0.03753653445,בשגרה ובחירום: כך הפך אגף הכירורגיה האורתופדית למוביל בתחומו,"המחלקה האורתופדית  במרכז הרפואי וולפסון טיפלה בפצועים רבים מאז ה-7 באוקטובר • שורדת מהמסיבה ברעים, לוחם יס""מ שנפצע בהיתקלות באופקים ואבא ובן שרכבו על אופניים ונורו הם רק חלק מהמטופלים שזכו למעטפת תומכת רחבה במחלקה • מנהל המחלקה ד""ר רפאל לוטן: ""נמשיך לעשות כמיטב יכולתנו למען הפצועים והמטופלים""",2023-12-10T09:28:31.000Z,2023-12-10T09:38:15.000Z
https://www.israelhayom.co.il/you-may-find-interesting/article/15422281,20137,1206,0.05988975518,קלנועית מתקפלת ATTO – פיתוח ישראלי מהפכני המציע ניידות ללא גבולות למי שמתמודד עם קשיי הליכה,"אנשים רבים עם מגבלות ניידות מצאו עצמם מוגבלים על ידי קלנועיות גדולות כבדות ומגושמות שלא באמת מאפשרות שיפור באיכות החיים ובתחושת המסוגלות והעצמאות שלהם.
הקלנועית המתקפלת ATTO, פטנט חדשני בפיתוח ישראלי של חברת מובינגלייף (Movinglife), נוחה, קלה ומתקפלת כך שניתן להכניס אותה אל תא המטען במכונית, להיכנס איתה לרכבת או לעלות איתה למטוס ולהמשיך לנוע עם חיוך על הפנים בכל מקום",2024-03-14T12:50:24.000Z,2024-03-24T11:31:08.000Z
https://www.israelhayom.co.il/podcasts/article/15229677,22988,2874,0.1250217505,"מפקד מחוז הצפון במשטרה לשעבר מזהיר: ""ישנם תאי טרור רדומים בערים ערביות ומעורבות בישראל""","המועמד לראשות עיריית חיפה, ניצב (בדימוס) יעקב בורובסקי, התייחס בפודקאסט ""העיר שלי"" מבית ""ישראל היום"" לפיגוע בחיפה בשבוע שעבר ואמר: ""אין דבר כזה פעולה של אדם בודד. אנשים מתארגנים בתאים ואף אחד לא יודע על זהותם"" • על הבחירות בעיר אמר: ""לא יהיה סיבוב שני"" • בנוסף השתתפו בפרק יועץ התקשורת גלעד גנץ והמועמדת לראשות המועצה המקומית שוהם, דפנה רביד-רבינוביץ'",2024-02-07T11:29:33.000Z,2024-02-07T11:29:33.000Z
https://www.israelhayom.co.il/mbl/article/875729/he,15317,1107,0.07227263825,500,,,
https://www.israelhayom.co.il/caricature/09-03-2025,15976,2195,0.1373935904,הקריקטורה היומית | יום ראשון 09.03.2025,,2025-03-08T22:49:39.000Z,2025-03-08T22:49:39.000Z
https://www.israelhayom.co.il/you-may-find-interesting/article/16126867,16926,2192,0.1295049037,"נתן לבתו מתנה ודרש לבטל אותה כי ניסה ""להתחמק מתשלום מס""","ביהמ""ש למשפחה באשדוד קיבל את תביעתו של האב והורה על ביטול הענקת דירתו לבתו הבכורה במתנה. זאת, על רקע טענות האב כי העביר את הדירה במטרה לחמוק ממס רכישה על דירה שנייה",2024-07-23T08:51:54.000Z,2024-07-23T08:51:54.000Z
https://www.israelhayom.co.il/you-may-find-interesting/article/17232046,17668,297,0.01681005207,המסך שמכיר אותך,"הטלוויזיות החדשות של סמסונג יודעות בדיוק מה אתם אוהבים לראות, מתי אתם הולכים לישון ואפילו איזו אמנות תרצו על הקיר • עם בינה מלאכותית מתקדמת ויכולות חדשניות, הן הופכות ממסך פשוט למרכז הבית החכם של כולנו",2025-01-26T12:01:42.000Z,2025-02-11T12:36:16.000Z
https://www.israelhayom.co.il/you-may-find-interesting/article/15027940,15727,273,0.01735868252,404,עמוד 404,,
https://www.israelhayom.co.il/flash/article/15698723,15497,376,0.02426276053,"ח""כ מהמחנה הממלכתי: ""בקרוב נצא מהממשלה""","ח""כ מיכאל ביטון אמר שבמפלגה יפעלו להגיע להסכמות על קיום הבחירות בחודש ספטמבר • ""אנחנו רוצים להשלים את משימת החזרת החטופים והביטחון למדינת ישראל"", הסביר ביטון את הישארות המפלגה בממשלה",2024-05-05T15:05:00.000Z,2024-05-05T15:10:07.000Z
https://www.israelhayom.co.il/you-may-find-interesting/article/16533337,16121,615,0.0381489982,הקפיצה השמיימה של ירושלים: מנחתי מסוקים ורחפנים אוטונומיים,"ירושלים, צועדת כעת לעבר העתיד עם תוכניות שאפתניות למודרניזציה. מעבר לחשיבותה הרוחנית, העיר עושה שינויים מרחיקי לכת  בתיירות, בתעסוקה ובתחבורה, וועדות התכנון והבניה בעיר מגבשות בימים אלה עקרונות תכנוניים לקידום תשתיות תעופתיות בדגש על רחפנים ומנחתים",2024-09-29T18:27:36.000Z,2024-09-29T18:36:47.000Z
https://www.israelhayom.co.il/you-may-find-interesting/article/14983766,17267,328,0.01899577228,מקדם ביטחון: מה חשוב לדעת על בנייה ומימון מרחב מוגן?,"נדמה שהתקופה האחרונה שינתה את סדרי העדיפויות של כולנו, ובעיקר הבהירה כמה חשוב שיהיה לנו מרחב מוגן בבית. זה הזמן להכיר את פתרונות המיגון הקיימים בשוק ואת אפשרויות המימון של מזרחי טפחות",2023-12-21T11:47:56.000Z,2023-12-26T14:40:41.000Z
https://www.israelhayom.co.il/you-may-find-interesting/article/16277473,14886,324,0.02176541717,מצילים את הים,הזיהומים שלא ידעתם שקיימים בחופי הים,2024-08-18T09:44:58.000Z,2024-09-08T14:35:30.000Z
https://www.israelhayom.co.il/you-may-find-interesting/article/17145053,17466,309,0.01769151494,"""צלילים מהעתיד: טכנולוגיית AI  פורצת דרך משפרת איכות חיים!""","חברת שטיינר מבית סונובה מציגה מכשירי שמיעה מהפכניים עם צ'יפ (שבב) בינה מלאכותית • הטכנולוגיה מאפשרת שמיעה ברורה גם בסביבות מאתגרות • ""מדובר על שינוי אמיתי באיכות החיים"", מסבירה רותי שרון, קלינאית תקשורת בכירה בחברה ומנהלת תחום Phonak",2025-01-14T08:00:25.000Z,2025-02-06T09:32:37.000Z
https://www.israelhayom.co.il/you-may-find-interesting/article/17242295,13311,948,0.07121929231,"שילוב טרנדים 2025 בעיצוב הבית? המלצת המעצבים - ""במינון הנכון""","המעצבות קורל חזין ודנית רוטמן מגלות - למי שמשפץ, בונה, מרענן או מחפש השראה -  איך מעצבים את הבית בלוק מעודכן שגם יישאר רלוונטי לאורך שנים. שיחות על פרזול וחומרי גלם, פלוס מחשבות שניות על איים",2025-01-30T12:50:03.000Z,2025-02-03T14:57:55.000Z
https://www.israelhayom.co.il/you-may-find-interesting/article/16763063,12873,474,0.03682125379,"נלחמים במזהם הגדול: תאגיד מא""י יוצא בתכנית חדשה למחזור פסולת אלקטרונית","המאבק בזיהום הסביבתי עולה שלב – תאגיד מא""י מוביל תכנית שתשפר את נגישות המחזור לציבור ותמנע מפסולת אלקטרונית להפוך למפגע סביבתי",2024-11-13T08:00:16.000Z,2024-11-13T12:40:17.000Z
https://www.israelhayom.co.il/israelnow,12829,202,0.01574557643,מבזקים,דסק החדשות,,
https://www.israelhayom.co.il/you-may-find-interesting/article/15498399,14876,648,0.0435600968,"""עמק הסיליקון של ישראל"": הפרויקט שיהפוך את שדרות למעצמה טכנולוגית","כדי לדאוג לעתיד הדור הבא בעיר הקימה אסם¬ נסטלה קרן מיוחדת שתתמקד בחינוך טכנולוגי ופיתוח התעשייה בשדרות. ""פיתוח התעשייה והייצור המקומי יוביל לחוסן אזורי ולאומי וישנה את המציאות בעיר"", מסביר מנכ""ל אסם נסטלה אבי בן אסאייג ● אז איך הפרויקט ישאיר את הצעירים לגור בשדרות גם בעתיד? ומי יכול להגיש מועמדות?",2024-03-27T15:31:17.000Z,2024-04-08T07:27:23.000Z
https://www.israelhayom.co.il/you-may-find-interesting/article/16512689,13644,431,0.03158897684,"המשרד להגנת הסביבה, מזהיר בעקבות בקשת קצא""א להגדלת שינוע הנפט מסיכונים חמורים, וראש הממשלה דורש לבחון את ההשלכות והסיכונים לעתיד.","המשרד להגנת הסביבה והארגונים הירוקים משתפים פעולה במאבק נגד חברת הנפט, אבל אינטרסים כלכליים וביטחוניים, שמקבלים חיזוק בעקבות המלחמה, מטילים צל על החשיבות של המאבק הסביבתי",2024-09-26T08:28:50.000Z,2024-09-29T14:21:31.000Z
https://www.israelhayom.co.il/you-may-find-interesting/article/15980807,12402,516,0.04160619255,"""נטל? שירות צבאי או אזרחי זו זכות""","המחלוקת סביב סוגיית הגיוס מעסיקה גם את הצעירים שיעלו על מדים הקיץ, ובהם בני מכינה ודתיים לשעבר שמכירים מקרוב את עולם ההלכה • הם מספרים שההכנה לגיוס מלווה בתחושת שליחות אמיתית, אך כועסים על המערכת שלדעתם לא עושה מספיק כדי למצוא סוף־סוף פתרון ראוי • תמר, בת הציונות הדתית: ""כשאמי התגייסה, לפני 30 שנה, הרבנים הרימו גבה וזה היה חריג - כיום זה הפך להיות סטנדרט, ואני חושבת שאין סיבה שזה לא יצליח גם עם המגזר החרדי""",2024-07-04T20:00:11.000Z,2024-07-04T20:00:11.000Z
https://www.israelhayom.co.il/you-may-find-interesting/article/16333943,13868,533,0.03843380444,האם אנחנו טובעים בזבל?,מהן שיטות המיחזור הנפוצות בישראל וכיצד נטפל בפסולת הביתית שאנחנו מייצרים?,2024-08-27T08:32:35.000Z,2024-09-16T09:09:31.000Z
https://www.israelhayom.co.il/you-may-find-interesting/article/16405311,11747,276,0.02349536052,ישראל 2050: איך ייראה העתיד האנרגטי שלנו?,"ישראל מפסיקה להתעלם מההתחממות הגלובלית, או לפחות שואפת לכך: מעבר לרכבים חשמליים ופאנלים סולאריים בכל מבנה ציבורי חדש הם רק קצה הקרחון. האם תצליח המדינה לעמוד ביעד שהציבה לעצמה – אפס פליטות עד 2050?",2024-09-12T07:01:09.000Z,2024-09-12T08:12:17.000Z
https://www.israelhayom.co.il/podcasts/article/15922975,13052,677,0.0518694453,"""אין יום שלא אומרים לי לפחות 10 פעמים גדלתי עלייך""","השחקנית חני נחמיאס הגיעה ל""חופרת"" לשיחה על הקריירה ועל המחזמר החדש, ""בלוז לחופש הגדול"" • בריאיון לשיר זיו היא מספרת על התחרות בתעשייה, על הצעות שקיבלה מריאליטי וגם על האהבה הגדולה בחייה, יהודה אליאס • ""גיליתי שאני יכולה לפתוח את הלב.  הייתי בטוחה שהוא סגור עם 80 מנעולים, נעול""",2024-06-17T07:00:07.000Z,2024-06-17T07:00:07.000Z
https://www.israelhayom.co.il/you-may-find-interesting/article/16342556,12978,883,0.06803821852,הקרב על המיחזור האלקטרוני: מה אנחנו נרוויח מזה?,"הפסולת האלקטרונית היא הגורם ל-70% מהזיהום הסביבתי. המשרד להגנת הסביבה חידש לאחרונה את הרישיון למיחזור המכשירים החשמליים לתאגיד מא""י מיחזור הוותיק, אבל הדרך להשגת היעדים עוד ארוכה",2024-09-05T09:01:15.000Z,2024-09-05T09:30:24.000Z
https://www.israelhayom.co.il/podcasts/article/15309384,11170,796,0.07126230976,"עינת קליש רותם: ""לא מאמינה בסקרים שמנבאים לי 5 אחוזי תמיכה""","לדברי ראש עיריית חיפה מדובר בסקרים מוזמנים שהדירו אותה מהם • לשאלה האם היא פופולרית יותר ממה שניתן לחשוב ענתה: ""בואו נראה עוד כמה ימים"" • עוד מזהירה קליש רותם מהתרחבות המלחמה בצפון: ""יהיה יותר גרוע מהמצב בדרום. לא רק חיפה תלך עשרות שנים אחורה – אלא כל המדינה שלנו • הריאיון המלא וראיונות נוספים בפרק המלא של ""העיר שלי"" - הפודקאסט המוניציפאלי של ""ישראל היום""",2024-02-22T14:40:12.000Z,2024-02-22T21:20:13.000Z
https://www.israelhayom.co.il/you-may-find-interesting/article/15483254,11335,625,0.05513895015,התחרות על חשבון החשמל שלנו עולה שלב: כך תוכלו לחסוך כסף,הרפורמה של משרד האנרגיה פותחת את הענף לתחרות ומאפשרת לצרכנים לרכוש חשמל מספקיות שונות – אז איך עוברים? למה המחירים יירדו? ולמי פונים במקרה של תקלה? ● כל מה שצריך לדעת על המהלך שצפוי לחסוך מאות שקלים בשנה עבור משקי הבית בישראל,2024-04-02T09:08:26.000Z,2024-05-29T12:49:45.000Z
https://www.israelhayom.co.il/you-may-find-interesting/article/16740215,9731,543,0.0558010482,שדרוג הרכב המשפחתי: 10 סיבות לבחירת קרוסאובר,"שמגיע הרגע לשדרוג הרכב המשפחתי, יותר ויותר משפחות בוחרות דווקא בקרוסאובר כרכב הבא שלהם – ויש לכך לא מעט סיבות טובות. כלי רכב אלה משלבים בין נוחות נסיעה ונגישות של רכבי כביש רגילים לבין גובה ויכולות שטח, המאפשרות לשמור על תחושת ביטחון ובו בזמן ליהנות מגמישות בכל סוגי הנסיעה",2024-11-07T09:59:51.000Z,2024-11-07T09:59:51.000Z
https://www.israelhayom.co.il/you-may-find-interesting/article/16197366,10892,223,0.0204737422,מיחזור עם ערך חברתי,כיצד נהפוך את מוצרי החשמל שהתקלקלו להזדמנות תעסוקתית ייחודית?,2024-08-04T08:46:44.000Z,2024-08-15T14:33:07.000Z
https://www.israelhayom.co.il/podcasts/article/16200308,9973,294,0.02947959491,"""אני לא אעזוב את הבית שלי כי יש אנשים שרוצים לחיות פה במקומי""","הזמר והיוצר איזי (ארז שרון) לא שומר כלום בבטן. כבר בשבעה באוקטובר חיבר את השיר הראשון על המלחמה, בו כתב ""הצבא המוסרי בעולם בתחת שלי"" • באולפן ""ישראל היום"" הוא אומר ""אני עומד מאחורי הטקסט, אנחנו כרגע נלחמים על זכות קיום""",2024-08-04T14:15:15.000Z,2024-08-04T15:11:16.000Z
https://www.israelhayom.co.il/you-may-find-interesting/article/15376681,10436,465,0.04455730165,פורצות דרך,"מעשי הגבורה של עשרות נשים ב־7 באוקטובר הפכו כבר לחלק ממורשת הקרב של אותה שבת שחורה * קרן קיימת לישראל הייתה הראשונה לתת מקום מיוחד לחוזק, לתושייה, לאומץ ולהקרבה חסרת התקדים של אותן גיבורות - גם בחזית וגם בעורף * מעבר לכך תופסות הנשים של קק""ל בשנים האחרונות יותר ויותר תפקידים בכירים - מיערניות ואדריכליות, דרך מנהלות מרחבים ועד מהנדסות בכירות",2024-03-06T10:59:23.000Z,2024-03-07T09:24:29.000Z
https://www.israelhayom.co.il/you-may-find-interesting/article/17060607,9706,518,0.05336905007,עיצוב הסלון הביתי- כיצד ספות וכורסאות לסלון תורמים?,"הסלון הביתי הוא אחד החללים המרכזיים ביותר בבית. מדובר על החלל שבו מתכנסים כל בני המשפחה בסופי יום או בסופי שבוע ונהנים משהייה משותפת, משיחה, מבילוי, מארוחות קלילות וצפייה בטלוויזיה. מדובר על החלל שבו לרוב מארחים חברים או בני משפחה וכמובן שמדובר במקום שבו אפשר להתרווח בכל סוף יום ארוך על הספה הנוחה מול הטלוויזיה, עם ספר טוב, עם עיתון ועוד",2025-01-01T07:25:14.000Z,2025-01-01T07:30:09.000Z
