Landing Page,Impressions,Url Clicks,URL CTR,title,subtitle,date_published,date_updated
https://www.israelhayom.co.il/you-may-find-interesting/article/16720742,122281,4234,0.03462516662,סמסונג ממשיכה לשבור את השיאים של עצמה: מסכי ה־OLED החדשים הופכים כל צפייה לחוויה,"המותג המוביל שובר את השוק עם טכנולוגיה חדשנית לשנת 2024 | עם בהירות מרשימה, שיפור ניכר באיכות הצבעים והפחתת השתקפויות, הטלוויזיות החדשות מבטיחות חוויית צפייה סוחפת גם באור יום | הבינה המלאכותית המשולבת במסכים משדרגת את התמונה והסאונד בזמן אמת, ומביאה אתכם קרוב יותר מאי פעם לתוכן שאתם אוהבים | בלאק נובמבר: ההזדמנות המושלמת להצטרף לעידן החדש",2024-11-05T09:45:50.000Z,2024-11-05T09:52:44.000Z
https://www.israelhayom.co.il/you-may-find-interesting/article/15938689,380680,29592,0.07773458022,מי זכאי לקצבת נכות כללית?,"המוסד לביטוח לאומי משלם קצבת נכות למי שנפגעה יכולת ההשתכרות שלו והעומד בתנאים הרלוונטיים. עו""ד לינוי אולניק, מומחית למימוש זכויות רפואיות, על הצעדים הנדרשים לקבלת הסיוע",2024-06-19T10:25:51.000Z,2024-06-25T08:35:37.000Z
https://www.israelhayom.co.il/you-may-find-interesting/article/14928426,169381,9839,0.05808797917,תוחלת חיים של כלבים:  אילו גזעים חיים יותר מאחרים?,"כמה זה ""עד 120"" בחיי כלב? כל מה שחשוב לדעת על  תוחלת החיים הממוצעת של הכלבים, איך היא משתנה בהתאם לסוג הגזע וגם: איזה פעולות יכולות לסייע לכלב שלכם להאריך חיים?",2023-12-10T09:13:10.000Z,2023-12-26T14:24:08.000Z
https://www.israelhayom.co.il/you-may-find-interesting/article/15996335,238314,23042,0.09668756347,האם הביטוח הלאומי שינה פרוטוקול ועדה רפואית לקביעת נכות?,"ביה""ד האזורי לעבודה מתח ביקורת על המוסד לביטוח הלאומי במסגרת תביעה של גבר בן 74, חולה בסרטן העור, כי מועד הזכאות שונה משנת 2010 לשנת 2021",2024-07-03T13:20:12.000Z,2024-07-03T13:20:12.000Z
https://www.israelhayom.co.il/you-may-find-interesting/article/16417379,116326,6724,0.05780307068,"ג'ינג'ית, חמקמקה, ואוהבת במבה: איך נמלת האש הקטנה מאיימת על הסביבה שלנו?","נמלת האש הקטנה היא מין פולש, שהתפשט כבר בכל חלקי הארץ. היא מזיקה למערכת האקולוגית ועקיצתה גורמת לכאב עז שיכול לפגוע באיכות החיים. היא הפכה למטרד של ממש במקומות כמו חופי הכינרת, ואף גורמת להפסדים בתעשיות שונות כמו למשל בחקלאות",2024-09-10T10:48:54.000Z,2024-09-15T12:46:42.000Z
https://www.israelhayom.co.il/you-may-find-interesting/article/16343287,117630,7800,0.06630961489,יעקב אביב: הבעיות הנפוצות בבתים הנמצאים בסמוך לים,"יעקב אביב, מפקח בנייה מקצועי ומוסמך שהקים מעל 400 וילות בשנים האחרונות מסביר שוילה ליד הים זה נשמע אולי כחלום אך מהר מאוד זה יכול להפוך לסיוט אם לא לוקחים מפקח בנייה שיודע את כל המורכבויות של בניית פרויקט ליד מליחות הים. לצד היתרונות הברורים, קיימים גם אתגרים שיכולים להשפיע על אורך החיים של הבית ועל איכות הבנייה בו. הסביבה הימית הינה סביבה אגרסיבית ביותר אשר דורשת תכנון מוקפד, בחירת חומרים מתאימים והקפדה על תקנים מחמירים כדי להתמודד עם השפעות המליחות הגבוהה",2024-08-28T12:53:48.000Z,2024-08-28T13:09:28.000Z
https://www.israelhayom.co.il/you-may-find-interesting/article/16417646,119483,7676,0.06424344886,משמעותו של יפוי כוח מתמשך,"יפוי כוח מתמשך הינו מסמך אשר מאפשר לעורך אותו, לקבוע מבעוד מועד, בעודו צלול וכשיר, מה יעשה בקשר לענייניו של אותו, במקרה בו בעתיד ימצא כלא כשיר לנהל איזה מענייניו",2024-09-10T11:19:40.000Z,2024-09-11T07:13:27.000Z
https://www.israelhayom.co.il/you-may-find-interesting/article/15939771,162741,7769,0.047738431,טוטאל לוק מושלם לכל אישה,"מותג האופנה הישראלי לנשים – נוחות, איכות וסטייל בכל מידה",2024-06-20T07:32:01.000Z,2024-07-01T13:50:29.000Z
https://www.israelhayom.co.il/you-may-find-interesting/article/16060548,612927,60682,0.09900363339,למה אסור לשתות מים שנמכרים בתחנת דלק?,כך נדע אילו מים מסוכנים לבריאותנו,2024-07-11T09:02:11.000Z,2024-08-15T14:06:45.000Z
https://www.israelhayom.co.il/you-may-find-interesting/article/16719051,144821,4737,0.03270934464,"מציאת פתרון הומני לבעיית חתולי הרחוב, כלבי הרחוב וחזירי הבר",הגישה הקיימת לדילול אוכלוסיות חיות רחוב ובעלי חיים פולשים אינה הומנית וגם לא יעילה. מחקר חדש מציע פתרון טבעי: פיתוח מזון שיפגע אך ורק בפוריות החיות,2024-11-06T08:00:30.000Z,2024-11-06T08:05:02.000Z
https://www.israelhayom.co.il/you-may-find-interesting/article/16442514,111194,8713,0.07835854453,מה הקשר בין תחנת הכוח בחדרה ל-50 מקרי תמותה באזור?,"תושבי שכונת חפציבה בחדרה סובלים מהזיהום הקשה שמקורו במערומי הפחם של תחנת הכוח. המאבק לצמצום הזיהום נמשך כבר שנים, אך נדחה שוב ושוב בגלל שיקולים ביטחוניים וכלכליים. עכשיו, התושבים דורשים ממקבלי ההחלטות להתערב ולספק פתרונות מידיים למצב הבלתי נסבל • כיצד הזיהום קשור לעשרות מקרי תמותה באזור ומה קבע בית המשפט?",2024-09-15T07:28:57.000Z,2024-09-15T12:48:36.000Z
https://www.israelhayom.co.il/you-may-find-interesting/article/17057635,68886,2774,0.04026943065,דגי סלמון במדבר: החזון הישראלי,הטכנולוגיה הישראלית שמביאה חידוש עולמי לחקלאות המים ותעשיית הדגים,2025-01-08T08:00:19.000Z,2025-01-08T08:15:21.000Z
https://www.israelhayom.co.il/you-may-find-interesting/article/15043034,70115,1902,0.02712686301,כללית בחזית הטיפול בבריאות הנפש,המטפלים של כללית מספרים על הצורך הגובר בטיפולים רגשיים ונפשיים מתחילת המלחמה,2024-01-03T10:03:18.000Z,2024-01-03T10:15:04.000Z
https://www.israelhayom.co.il/you-may-find-interesting/article/15225197,106352,8107,0.07622799759,מה עושים כשאין אפשרות להתקין  עמדת טעינה פרטית בחניה?,שוקלים לקנות רכב חשמלי? כך תוכלו להטעין אותו גם אם אין לכם עמדת טעינה פרטית בחנייה הביתית.,2024-02-06T14:39:26.000Z,2024-02-06T14:39:26.000Z
https://www.israelhayom.co.il/you-may-find-interesting/article/16458573,82865,3296,0.03977553853,"ידוע שמים ממוחזרים משמשים להשקייה בחקלאות, אך לא ראויים לשתייה. מה זה אומר לגבי הפירות והירקות שאותם אנו אוכלים?",מדינת ישראל מובילה בעולם במחזור מי השפכים ומפיקה מהם את המיטב בחקלאות • כשמשבר המים העולמי הולך ומחמיר נשאלת השאלה: למה הם אינם ראויים לשתייה?,2024-09-19T07:00:07.000Z,2024-09-19T11:43:56.000Z
https://www.israelhayom.co.il/podcasts/article/16202036,81799,8970,0.1096590423,"אמי פלמור: ""יחיא סינוואר סדיסט ופסיכופת. הוא הכניס כלי נשק חדש לקרב""","פלמור, לשעבר מנהלת מחלקת החנינות במשרד המשפטים ומנכ""לית המשרד, הייתה חברה בצוות המשא ומתן לשחרורו של גלעד שליט והתבקשה על ידי הדרג המדיני להכין את תיקו של סינוואר, ששוחרר בעסקה • היא הגיעה לאולפן ""ישראל היום"" לשוחח עם עידן טנדלר בפודקאסט ""בשביל ישראל"" וסיפרה על אישיותו הפסיכופתית של סיוונאר, על תהליך הכנת התיק לעסקה ההיא, ועל האתגרים כיום בתפקידה כיו""ר נט""ל (נפגעי טראומה על רקע לאומי) בישראל של אחרי ה- 7 באוקטובר",2024-08-05T07:00:35.000Z,2024-09-17T14:22:13.000Z
https://www.israelhayom.co.il/you-may-find-interesting/article/17423191,70185,2025,0.02885231887,פתיתים של תקווה,"שיתוף פעולה ייחודי בין השף איל שני לאסם: מנת פתיתים בפיתה שכל הכנסותיה קודש לילדי עוטף עזה * במשך עשרה ימים יוגש התבשיל המיוחד בכל סניפי רשת המסעדות ""מזנון"", כשההכנסות יועברו לעמותת ""עטופים באהבה"" המסייעת ליתומי 7 באוקטובר",2025-02-24T09:24:37.000Z,2025-03-02T14:01:43.000Z
https://www.israelhayom.co.il/you-may-find-interesting/article/16199096,98594,5621,0.05701158285,בני 70 ומעלה? מגיעות לכם הטבות בפרויקטים של התחדשות עירונית,"שורה של תיקוני חקיקה ועדכונים, מסדירה המדינה את זכויות האוכלוסייה המבוגרת בפרויקטים של פינוי-בינוי ותמ""א 38. האם השינויים האלו ירתמו גם את הקשישים להתחדשות העירונית?",2024-08-04T12:18:45.000Z,2024-08-04T12:18:45.000Z
https://www.israelhayom.co.il/you-may-find-interesting/article/16363296,85843,5319,0.0619619538,רכב חשמלי: כמה זה באמת עולה לנו?,"בשנים האחרונות אנחנו רואים יותר ויותר רכבים חשמליים על הכבישים, בעיקר בבעלות של אוכלוסייה אמידה. כיצד ישראל מתמודדת עם המגמה לעומת מדינות אחרות בעולם והאם זה עומד להשתנות בעתיד הקרוב?",2024-09-01T09:10:41.000Z,2024-09-05T11:25:54.000Z
https://www.israelhayom.co.il/you-may-find-interesting/article/16343203,104093,3926,0.03771627295,קפה VS תה: איזה משקה מתאים לאורח חיים בריא?,"שני המשקאות הפופולריים בעולם, קפה ותה, הם חלק בלתי נפרד מאורח החיים היומיומי של רבים מאיתנו. לכל אחד מהם יש יתרונות ייחודיים והשפעות בריאותיות שונות. בשנים האחרונות, ככל שמתגברת המודעות לאורח חיים בריא, רבים תוהים מה עדיף לשתות – קפה או תה?",2024-08-28T12:42:25.000Z,2024-08-28T12:42:25.000Z
https://www.israelhayom.co.il/caricature/06-03-2025,63355,3626,0.05723305185,הקריקטורה היומית | יום חמישי 06.03.2025,,2025-03-05T22:12:31.000Z,2025-03-05T22:12:31.000Z
https://www.israelhayom.co.il/you-may-find-interesting/article/17287618,61572,2546,0.04134996427,לנהוג ברכב חדש – בלי לקנות אותו,"מהפכת הליסינג הפרטי משנה את פני שוק הרכב בישראל, כשיותר ויותר נהגים מגלים את היתרונות של שימוש על פני בעלות • עם תשלום חודשי קבוע הכולל את כל ההוצאות, מעטפת שירותים מקיפה ואפשרות להחליף רכב בתום התקופה, מדובר בפתרון המשלב חיסכון כלכלי עם נוחות תפעולית",2025-02-03T09:48:13.000Z,2025-02-05T09:17:43.000Z
https://www.israelhayom.co.il/you-may-find-interesting/article/14872613,52117,2568,0.04927374945,אור ירוק לעסקים הקטנים,"מצב המלחמה אליה נקלעה החברה הישראלית ובעלי עסקים בפרט מחייב כל בעל עסק לחשב מסלול מחדש. ומהר.  לצורך ההמחשה, ניתן לדמות את המצב לרמזורים בצומת",2023-11-28T12:05:23.000Z,2023-11-28T12:07:18.000Z
https://www.israelhayom.co.il/you-may-find-interesting/article/15246919,64738,3117,0.04814791931,"ד""ר חן שפירא - פיתוח ה-WAZE של הרופאים","ד""ר חן שפירא אחת השותפות ב- Quai.MD, עם פיתוח שעוזר לרופא ומבצע מהפכה בתהליך האבחון של המטופל במיון, תוך הצעת הצעד הבא הנכון ביותר לביצוע. 
בדומה לאפליקציית WAZE שהביאה את המהפכה בנהיגה (המהפכה בדרכים), כך גם Quai.MD מביאה למהפכה בסיוע לאבחון הרפואי בחדר המיון, תוך אוטומציה של התהליך",2024-02-11T08:38:08.000Z,2024-02-11T08:38:08.000Z
https://www.israelhayom.co.il/flash/article/15152330,47192,2347,0.04973300559,אושרה הקמתם של 40 מבנים בקיבוץ משמר העמק - עבור מפוני נחל עוז,"המועצה הארצית לתכנון ולבנייה הפעילה לראשונה סעיף בחוק המאפשר שהמבנים והתשתיות, ישמשו באופן קבוע ולא יוסרו • ההחלטה הינה חלק משורה של צעדים שמקדמת המועצה למציאת פתרונות מגורים, בלוחות זמנים קצרים, למפונים מיישובי העוטף • יו""ר מטה התכנון הלאומי: ""אני מקווה שמציאת פתרון מגורים למפוני נחל עוז תסייע להם בתקופה קשה זו, עד חזרתם לביתם""",2024-01-23T18:31:31.000Z,2024-01-23T18:31:31.000Z
https://www.israelhayom.co.il/flash/article/17043279,50356,4689,0.09311700691,"אביה של התצפיתנית רוני אשל ז""ל: ""חליוה מטייל ואני מרגיש סמרטוט""","על רקע סערת ההקלטות, אייל אשל השתתף באירוע ""שישי תרבות"" ותקף בחריפות • ""הדרגים הגבוהים, 'הפלאפלים', לא סופרים חיילות זוטרות"" • חלק מהמשפחות נחשפו להקלטות המלאות הבוקר",2024-12-27T10:12:57.000Z,2024-12-27T10:41:37.000Z
https://www.israelhayom.co.il/you-may-find-interesting/article/17030335,63223,1713,0.02709457001,מוזיאון אלפא רומיאו שיקח אותכם למסע בזמן,"המוזיאון  של אלפא רומיאו ייפתח באופן חד פעמי בחופשת החנוכה ,בין התאריכים 25.12.2024 ועד 2.01.2025",2024-12-25T12:18:13.000Z,2024-12-25T13:30:25.000Z
https://www.israelhayom.co.il/you-may-find-interesting/article/17418247,51076,1238,0.02423838985,בוגרי נבחרות ישראל במדעים: מכשירים את הדור הבא של המדליסטים,"בוגרי נבחרות ישראל במדעים מביאים איתם כמדריכים ערך ייחודי: הם מתחברים לחוויית התלמידים מתוך ניסיון אישי ויודעים בדיוק כיצד להכין אותם לתחרויות הבינלאומיות • שון חנץ, מדריך בנבחרת ישראל בכימיה: ""כשאתה מבין את הבן אדם שמולך זה עוזר לתמוך בו ולחזק אותו"" • ליהיא ניב, מדריכה בנבחרת ישראל בפיזיקה: ""החלטתי להמשיך ולהדריך כאן כי הנבחרת נהייתה לי ממש משפחה, כמו בית שני"" • השבוע ייערכו המיונים לנבחרות הכימיה והפיזיקה והם פתוחים לתלמידות ותלמידים מכל רחבי הארץ",2025-02-23T13:13:54.000Z,2025-02-25T09:30:43.000Z
https://www.israelhayom.co.il/podcasts/article/16324402,55399,7033,0.12695175,"רווקות מאוחרת אצל נשים חרדיות - מבט מבפנים: ""הקפאת ביציות? לקח לי שנה וחצי להתאושש מהטראומה""","באיזה שלב מבינה רווקה חרדית שעליה לשקול הקפאת ביציות? למי היא יכולה לפנות לעצה? מה עמדת ההלכה בנושא? ד""ר מיכל דבירי, רופאת נשים בכירה, בשיחה עם מרב סבר • צפו",2024-08-25T18:27:15.000Z,2024-08-26T13:59:00.000Z
https://www.israelhayom.co.il/you-may-find-interesting/article/16140331,51080,1701,0.03330070478,דונלד טראמפ בדרך חזרה לבית הלבן,הקרב על עתיד הסביבה שיכול לשנות את אמריקה והעולם,2024-07-25T09:14:19.000Z,2024-08-15T14:21:59.000Z
https://www.israelhayom.co.il/you-may-find-interesting/article/14963306,42845,1566,0.03655035593,כיסא בר – איך בוחרים את המתאים ביותר?,"פעם היינו נתקלים בכיסאות גבוהים רק כשהיינו נכנסים אל ברים או אל מסעדות. כיום, ניתן למצוא אותם כמעט בכל מטבח ביתי. זאת בשל המהפך שעבר המטבח הישן אל מול המטבח המודרני שהנראות שלו הפכה לעניין מרכזי, דבר שלא היה קיים במטבחים של פעם",2023-12-26T12:08:48.000Z,2023-12-26T14:45:23.000Z
https://www.israelhayom.co.il/you-may-find-interesting/article/17575645,45046,2111,0.0468632065,הישראלים בוחרים נכון: JAECOO 7 PHEV,"מותג הפרימיום שכבש את השוק המקומי מציג את הדגם הבא – מתקדם יותר, משודרג, ומותאם לחובבי טכנולוגיה וחדשנות",2025-03-19T15:54:56.000Z,2025-03-23T12:36:41.000Z
https://www.israelhayom.co.il/you-may-find-interesting/article/15011629,35428,2613,0.07375522186,"מכשיר אחד, יתרונות רבים: הכירו את הוֶרְטִיקָה","מכשיר רפואי חדשני לטיפול בבעיות אין אונות שאינו מצריך מרשם רופא, מתאים לכלל האוכלוסייה, ללא תופעות לוואי וללא כאבים. זה נשמע טוב מכדי להיות אמיתי - אבל זה אמיתי לגמרי, והוא כבר שינה את חייהם של אלפי גברים בכל רחבי העולם. מכשיר הוֶרְטִיקָה, קווים לדמותו",2023-12-27T09:27:10.000Z,2023-12-27T12:28:27.000Z
https://www.israelhayom.co.il/you-may-find-interesting/article/16857915,35185,2585,0.07346880773,"""התפיסה היום היא להפסיק לעבוד עבור הרכב, ולתת לו לעבוד עבורי""","בעולם שבו הזמן הפנוי שלנו הולך ומצטמצם והמשימות היומיומיות נערמות ללא הפסקה, הצרכן המודרני מחפש פתרונות שמפשטים את החיים. אחד התחומים שבהם השינוי הזה בולט במיוחד הוא עולם הרכב. אם בעבר רכישת רכב נחשבה לסמל סטטוס ולסוג של ""נכס"", היום ברור יותר מאי פעם שרכב הוא הוצאה מתמשכת – כספית, נפשית ואפילו תפעולית. המגמה המובילה כיום היא מעבר מבעלות על רכב לשימוש חכם בו, והמושג ליסינג פרטי תופס מקום מרכזי בתפיסה החדשה",2025-01-19T13:18:57.000Z,2025-01-20T11:28:12.000Z
https://www.israelhayom.co.il/you-may-find-interesting/article/16014939,37375,4482,0.1199197324,"ניסה לספח חניות אורחים אך נעצר: ""רכוש משותף""","בעל דירה, שגם שימש כקבלן בבניין משותף, ביקש לספח לעצמו שתי חניות אורחים וטען כי הוצמדו לו בזכות הסכם. המפקח על המקרקעין דחה את גרסתו",2024-07-03T09:28:59.000Z,2024-07-03T09:28:59.000Z
https://www.israelhayom.co.il/you-may-find-interesting/article/16837275,40944,614,0.01499609222,"כנס שלוש מדעניות פורצות דרך במאה ה-20 ב-HIT: מדע, השראה ושוויון","הכנס החמישי בסדרת ""המדענים הדגולים"" אותה מוביל בכל שנה פרופ' אדיר פרידור, יו""ר הוועד המנהל, הוקדש השנה לשלוש מדעניות פורצות דרך מהמאה ה-20: מארי קירי, ליזה מייטנר ורוזלינד פרנקלין. הכנסים לפניו הוקדשו למדענים ניוטון, דה וינצ'י, ארכימדס והומבולט",2024-11-24T10:15:57.000Z,2024-11-24T11:01:45.000Z
https://www.israelhayom.co.il/you-may-find-interesting/article/16350249,33514,911,0.02718266993,הקשר בין מחלות לב לבשר מעובד וההשפעות הסביבתיות של תעשיית הבשר,"ישראל היא מהמובילות בעולם בצריכת בשר מעובד, כזה שקבע ארגון הבריאות העולמי כמסרטן וודאי. מהן ההשלכות הסביבתיות של צריכת הבשר שלנו בנוסף לאלו הבריאותיות? וגם: טיפים לבניית תפריט חלופי, בלי לוותר לגמרי על מוצרי הבשר שאנחנו אוהבים",2024-08-29T11:56:44.000Z,2024-09-16T09:03:08.000Z
https://www.israelhayom.co.il/you-may-find-interesting/article/16285553,36767,2326,0.06326325237,עולה לנו בבריאות: הצעת החוק שהולכת לחייב הצללה במרחב הציבורי,"הצורך בצל הוא הרבה מעבר לעניין של נוחות – מדובר בבריאות שלנו, שנפגעת בצורה חמורה מהחום הקיצוני שרק ימשיך לעלות. האם הצעת החוק החדשה תצליח לעשות שינוי אמיתי?",2024-09-08T08:53:12.000Z,2024-09-08T08:53:12.000Z
https://www.israelhayom.co.il/you-may-find-interesting/article/16239279,34249,1047,0.03057023563,הטבע משיב מלחמה,האם ישראל מוכנה להתמודד עם אסונות הטבע הצפויים עקב משבר האקלים?,2024-08-11T10:10:06.000Z,2024-08-15T14:42:14.000Z
https://www.israelhayom.co.il/podcasts/article/16387988,33040,5891,0.1782990315,"״מסוכן להסתובב בחוץ אחרי תשע בערב, נהגים מפחדים לצפור״","עו""ד רסול סעדה מדבר עם עידן טנדלר על האתגרים של הערבים בישראל, הפשיעה במגזר ולמה הוא חושב ששירות לאומי לצעירי החברה הערבית יכול לסייע להילחם בתופעה, ועל התקווה לעתיד משותף",2024-09-05T07:00:46.000Z,2024-09-08T11:26:10.000Z
https://www.israelhayom.co.il/you-may-find-interesting/article/15219200,32500,993,0.03055384615,"מהיר וחסכוני: הקטנועים של ""מטרו מוטור"" הם הבחירה של הסטודנטים","הנסיעה לפקולטה מעולם לא היתה נוחה יותר: סאן יאנג ממשיך להיות העדפת ההתניידות של רבים 
- והמגמה לא עוצרת לרגע * הסיבות: חיסכון בזמן, הימנעות מפקקים והיעדר הצורך לחפש חניה *
""התלמידים חוסכים לעצמם המון כסף ונהנים מבטיחות ומיעילות לעומת שאר האלטרנטיבות בחוץ""",2024-02-05T14:54:41.000Z,2024-02-05T14:54:41.000Z
https://www.israelhayom.co.il/flash/article/15585760,29574,429,0.01450598499,"חוקר את כוכבי הלכת: פרופ' צבי מזא""ה הוא הזוכה בפרס ישראל בתחום הפיזיקה","שר החינוך הודיע כי פרופסור צבי מזא""ה, חוקר באוניברסיטת ת""א בתחום האסטרופיזיקה התיאורטית והאסטרונומיה התצפיתית הוא הזוכה האחרון בפרס • לרשימת הזוכים המלאה",2024-04-11T15:09:50.000Z,2024-04-11T15:40:28.000Z
https://www.israelhayom.co.il/you-may-find-interesting/article/16002809,28826,2976,0.1032401304,האם רומן חולף יכול לסבך כלכלית?,"צעירה כבת 27 דרשה 3.5 מיליון שקל מבן זוגה לשעבר, לאחר שלטענתה הבטיח לה אחוזים מההון שצבר. ביהמ""ש: ""לא הייתה כוונת שיתוף""",2024-07-01T13:47:30.000Z,2024-07-01T13:47:30.000Z
https://www.israelhayom.co.il/you-may-find-interesting/article/16579665,25933,1790,0.06902402345,עגבניות הן רק ההתחלה: המשבר התזונתי מאיים על ביטחון ישראל,"המשבר התזונתי מחמיר: האוכלוסייה גדלה, היבולים מצטמצמים, והמצב הביטחוני מעלה את השאלה לאן אנחנו הולכים מכאן?",2024-10-10T07:00:21.000Z,2024-10-10T15:03:41.000Z
