Landing Page,Impressions,Url Clicks,URL CTR,title,subtitle,date_published,date_updated
https://www.israelhayom.co.il/you-may-find-interesting/article/15996815,3093,231,0.07468477207,"חצויים: דילמת המגזר החרדי והגיוס לצה""ל","מתקפת 7 באוקטובר וההבנה שישראל נמצאת במלחמת קיום עוררו דיון מחודש בחברה החרדית על סוגיית הגיוס לצה""ל • הדילמה שבה מתחבטים אנשי המגזר - שבעבר כלל לא היתה קיימת - מעלה שאלות מורכבות על זהות, על אחריות לאומית ועל שוויון בנטל, תוך התמודדות עם מציאות ביטחונית מאתגרת • וכשברקע הדיונים על חוק הגיוס, ההבדלים בין מי שסבורים כי חייבים לקחת חלק במאמץ הלאומי לבין מי שעבורם הגיוס הוא ""ייהרג ובל יעבור"" - רק הולכים ומתחדדים",2024-07-04T20:00:42.000Z,2024-07-04T20:00:42.000Z
https://www.israelhayom.co.il/you-may-find-interesting/article/16812210,2781,174,0.06256742179,"הפחתה דרמטית בהורמונים, אנטיביוטיקה וזיהומים במזון שלנו: המהפכה הישראלית בטיהור מים באמצעות בינה מלאכותית",חוקרים ישראלים פיתחו טכנולוגיה מבוססת בינה מלאכותית שמזהה מזהמים במים לחקלאות בזמן אמת,2024-11-20T08:00:43.000Z,2024-11-20T09:02:03.000Z
https://www.israelhayom.co.il/you-may-find-interesting/article/16168150,1927,36,0.01868188895,חוסן חשמלי בשעת חירום,האם מדינת ישראל מסוגלת להבטיח אספקת חשמל רציפה במצב התקפה כוללת על תשתיות המדינה?,2024-08-01T07:35:15.000Z,2024-08-15T14:28:13.000Z
https://www.israelhayom.co.il/writer/%D7%96%D7%95%D7%94%D7%A8%D7%94-%D7%A1%D7%99%D7%9C%D7%9E%D7%9F,1392,28,0.02011494253,זוהרה סילמן,פסיכולוג במבצע,,
https://www.israelhayom.co.il/writer/%D7%9E%D7%A2%D7%A8%D7%9B%D7%AA-%D7%99%D7%A9%D7%A8%D7%90%D7%9C-%D7%94%D7%99%D7%95%D7%9D,1554,10,0.006435006435,מערכת ישראל היום,"נתניהו: ""יודעים בוודאות שיש 21 חטופים בחיים, שלושה בספק""",,
https://www.israelhayom.co.il/flash/article/15267653,1900,70,0.03684210526,"משרדי הבריאות והחקלאות: הימנעו מהכנסת בעלי חיים מעזה, מהרשות הפלשתינית ומהצפון לשטח הארץ","המומחים קושרים בין כניסת בעלי החיים לישראל לבין הפצתן של מחלות קשות ביניהן כלבת ועכברת • במקרה של חשיפה או נשיכה על-ידי כלב או חתול שנכנס לארץ, יש לפנות ללא דיחוי לקבלת טיפול רפואי • מאז החלה המלחמה, כ-5,000 כלבים מעזה נכנסו לשטח הארץ",2024-02-14T14:43:14.000Z,2024-02-14T14:44:18.000Z
https://www.israelhayom.co.il/you-may-find-interesting/article/14867503,1917,81,0.04225352113,"לצדנו במלחמה, לצדנו באזרחות: דרכון גרמני –עשרות אלפי זכאים בישראל.","בזכות מהפכה מרשימה בחקיקה הגרמנית נכנסו המוני ישראלים למעגל הזכאות לאזרחות גרמנית, אחת המדינות המובילות והמשגשגות ביותר ביבשת אירופה",2023-12-04T13:00:14.000Z,2023-12-04T13:07:11.000Z
https://www.israelhayom.co.il/writer/%D7%93%D7%A0%D7%99%D7%90%D7%9C%D7%94-%D7%92%D7%99%D7%A0%D7%96%D7%91%D7%95%D7%A8%D7%92,1584,35,0.0220959596,דניאלה גינזבורג,"חברה אחת, שתי אוזניות, שני מחירים: CMF Buds Pro 2 מול Nothing Ear",,
https://www.israelhayom.co.il/flash/article/15120409,1520,455,0.2993421053,"שריפה קטלנית במרכז ת""א: הממצאים מצביעים על חשד לאירוע רצח","שריפה פרצה בדירה בבניין מגורים ברחוב דיזנגוף בעיר • לאחר שחולצה, צוות רפואה שהגיע לזירה נאלץ לקבוע במקום את מותה של תיירת כבת 35 • פאראמדיק מד""א: ""לוחמי האש חילצו אלינו אישה מחוסרת הכרה, עם כוויות ולאחר ששאפה עשן רב""",2024-01-18T05:34:24.000Z,2024-02-08T07:49:12.000Z
https://www.israelhayom.co.il/writer/%D7%A9%D7%9C%D7%95%D7%9E%D7%99%D7%AA-%D7%9E%D7%90%D7%9C%D7%99,1799,26,0.0144524736,שלומית מאלי,גם בפריז נניף את דגל ישראל גבוה,,
https://www.israelhayom.co.il/you-may-find-interesting/article/16099538,1854,77,0.04153182309,כיצד תשפיע המלחמה על אספקת החשמל?,המלחמה מאיימת על החשמל בבתים שלנו. האם האנרגיה הסולארית היא הפתרון?,2024-07-18T09:22:12.000Z,2024-08-15T14:14:39.000Z
https://www.israelhayom.co.il/you-may-find-interesting/article/17015194,1633,18,0.01102265769,הדור החדש של מוצרי החשמל: חיסכון באנרגיה בלי להתפשר על עיצוב,"כך חברות המובילות בתחום משלבות טכנולוגיות ירוקות ומצמצמות את ההשפעה הסביבתית, תוך חיסכון משמעותי לצרכן",2024-12-25T08:00:03.000Z,2024-12-25T08:55:37.000Z
https://www.israelhayom.co.il/podcasts/article/16395670,1658,74,0.04463208685,"יו""ר ארגון ""לגדל"": ""לא צריך לשאול את הרב על הקפאת ביציות""","הרב שלמה טאוב טוען כי אין בעיה הלכתית בשימור פריון, ואפילו שמדובר במצווה • ""רוב הרבנים נותנים את ברכת הדרך - יש אחד שלא מתיר, אבל זה מהנימוק שאם בת תקפיא ביציות היא לא תרצה להתחתן""",2024-09-05T22:51:43.000Z,2024-09-06T07:18:11.000Z
https://www.israelhayom.co.il/writer/%D7%A9%D7%99%D7%A8%D7%94-%D7%9E%D7%9C%D7%9E%D7%93,1026,19,0.01851851852,שירה מלמד,תל אביב חייבת לחזור להיות תל אביב,,
https://www.israelhayom.co.il/writer/%D7%90%D7%95%D7%A4%D7%99%D7%A8-%D7%96%D7%99%D7%9C%D7%91%D7%99%D7%92%D7%A8-%D7%9E%D7%95%D7%91%D7%99%D7%9C-%D7%A4%D7%A2%D7%99%D7%9C%D7%95%D7%AA-%D7%94%D7%A1%D7%99%D7%99%D7%91%D7%A8-%D7%94%D7%92%D7%9C,1373,56,0.04078659869,"אופיר זילביגר, מוביל פעילות הסייבר הגלובלית ברשת BDO","זירת הסייבר רותחת, ואסור לנו להיתפס לא מוכנים",,
https://www.israelhayom.co.il/writer/%D7%A8%D7%95%D7%A0%D7%99%D7%AA-%D7%96%D7%99%D7%9C%D7%91%D7%A8%D7%A9%D7%98%D7%99%D7%99%D7%9F,1006,55,0.05467196819,רונית זילברשטיין,אילת: הרוג ו-10 נפגעים בתאונה ימית בין שתי סירות,,
https://www.israelhayom.co.il/podcasts/article/14915524,810,42,0.05185185185,"""המשימה החשובה: לאפשר את חזרת תושבי הדרום לבתיהם""","כשלושה שבועות אחרי שנכנס לתפקידו, הפרויקטור האזרחי לשיקום העורף, טל בסכס מסביר לראשונה ל""ישראל היום"" את משימותיו וטוען: ""באופן יחסי משרדי הממשלה התעשתו די מהר"" אך הודה ""יש במה להשתפר"" • לדבריו התקווה היא להחזיר את תושבי היישובים הראשונים בדרום לבתיהם בסוף ינואר • האזינו",2023-12-06T14:48:14.000Z,2023-12-06T15:36:49.000Z
https://www.israelhayom.co.il/you-may-find-interesting/article/17064911,1000,38,0.038,"ברצלונה, ונציה וטוקיו: המחאות בעולם נגד תיירות יתר והטרנד הסביבתי שמנסה לפתור את הבעיה","לאחר השנה הלא פשוטה שעברה על אזרחי ישראל, רבים רוצים להשתחרר מהדאגות ולטייל. אבל תיירות היא גם נזק סביבתי וכדי לצמצם אותו אנחנו צריכים להיות יותר מודעים לסביבה שלנו בזמן החופשה",2025-01-01T08:00:58.000Z,2025-01-01T08:06:59.000Z
https://www.israelhayom.co.il/you-may-find-interesting/article/16860460,1080,56,0.05185185185,"קניתם ""מוצר ירוק""? ייתכן שנפלתם לגרינוושינג","גרינוושינג הוא תרגיל שיווקי שמציג חברות כ""ירוקות"" למרות שהן לא באמת שומרות על הסביבה. כך תזהו ותמנעו מהטעיה סביבתית",2024-12-01T08:10:57.000Z,2024-12-02T09:01:44.000Z
https://www.israelhayom.co.il/flash/article/15034255,1268,35,0.02760252366,עד 40%: גם סוגת מעלה מחירים,"בין מוצרי החברה נמנים: קטניות, סוכר לבן ועוד • חברות נוספות הודיעו על העלאת מחירים קרובה",2024-01-01T16:18:46.000Z,2024-01-01T16:24:45.000Z
https://www.israelhayom.co.il/you-may-find-interesting/article/16718308,948,21,0.02215189873,כל מה שרציתם לדעת על פנקייק ועוד הרבה יותר,"הפנקייק הוא אחד המאכלים האהובים ביותר בתבל, הוא הפך למנה קלסית במטבחים רבים, וניתן ליהנות ממנו בכל שעות היממה. פשטות ההכנה שלו בשילוב המצרכים הזמינים הופכים אותו לפופולרי במיוחד והוא מתאים לכל חך. אבל מה בעצם אנחנו יודעים עליו? במאמר הזה נביא לפניכם מידע מרתק על ההיסטוריה שלו, הסוגים השונים הקיימים ורעיונות איך להכין אותו מגוון וטעים",2024-11-04T08:44:25.000Z,2024-11-04T08:44:25.000Z
https://www.israelhayom.co.il/you-may-find-interesting/article/15983372,933,13,0.0139335477,הבינה המלאכותית: חידוש סביבתי או איום אקולוגי?,אין ספק שהבינה המלאכותית משנה לחלוטין את העולם – והשינוי מחלחל גם אל מכשירי החשמל הביתיים שלנו. האם ה-AI צפוי להפוך את המכשירים שלנו ליעילים וסביבתיים יותר? או שמא לעשות נזק? איך ייראו חיי היומיום שלנו בעידן ה-AI? והאם הבינה המלאכותית צפויה להשתלט על העולם?,2024-06-27T14:22:57.000Z,2024-08-15T09:35:09.000Z
https://www.israelhayom.co.il/hostage-agreement,1051,33,0.03139866794,עסקת חטופים 2025: מלחמת חרבות ברזל - כל הדיווחים על העסקה,"בכיר חמאס: ""דוחים את כל ההסכמים החלקיים""",,
https://www.israelhayom.co.il/writer/%D7%9E%D7%99%D7%9B%D7%9C-%D7%9E%D7%99%D7%A7%D7%99-%D7%A6%D7%A1%D7%9C%D7%94,563,3,0.005328596803,מיכל (מיקי) צ'סלה,לא סתם אסקפיזם: קריאה כמזור לנפש,,
https://www.israelhayom.co.il/writer/%D7%A0%D7%95%D7%A2%D7%9D-%D7%93%D7%91%D7%95%D7%9C-%D7%93%D7%91%D7%99%D7%A8,608,7,0.01151315789,נועם (דבול) דביר,"מהומה במכללת ספיר: עשרות הפגינו נגד הקרנת הסרט ""אין ארץ אחרת"", שהוצג - אך נקטע באמצע",,
https://www.israelhayom.co.il/tag/%D7%90%D7%95%D7%A4%D7%99%D7%A8%D7%94-%D7%90%D7%A1%D7%99%D7%99%D7%92,613,35,0.05709624796,אופירה אסייג,אופירה אסייג,,
https://www.israelhayom.co.il/writer/%D7%A7%D7%95%D7%91%D7%99-%D7%90%D7%9C%D7%99%D7%A8%D7%96,475,3,0.006315789474,קובי אלירז,עסקה - טוב או רע?,,
https://www.israelhayom.co.il/you-may-find-interesting/article/16127404,682,14,0.02052785924,הבריאות שלכם תחת אש,השרפות שהפכו את מרכז הארץ לאחד האזורים המזוהמים בישראל,2024-07-30T08:07:42.000Z,2024-08-15T14:25:46.000Z
https://www.israelhayom.co.il/you-may-find-interesting/article/16038044,802,130,0.1620947631,"ביהמ""ש העליון מצמצם את ההכרה ב""ידועים בציבור"": חיים משותפים זה לא הכל","לאחר שבמשך שנים הלכה והתרחבה ההגדרה של ""ידועים בציבור"", מגיע פס""ד של השופטת יעל וילנר וקובע גבולות גזרה: כוונה להינשא וחשבון בנק משותף לא בהכרח מספיקים להוכחה",2024-07-07T15:10:08.000Z,2024-07-07T15:15:31.000Z
https://www.israelhayom.co.il/you-may-find-interesting/article/15402990,512,19,0.037109375,גינדי במיזם נדל״ני חברתי חדשני,"בשנה האחרונה התחוללה מהפכה של ממש בתחום ההתחדשות העירונית בישראל. מנור וכפיר גינדי, מיזמי גינדי TLV, שינו את כללי המשחק. לראשונה, יזמי הנדל״ן המובילים, הקימו את המיזם הנקרא בשם iGindi בו הם מתייצבים לצידם של הדיירים ומלווים אותם בדרך המורכבת של פרויקטים של התחדשות עירונית. כל הפרטים בכתבה",2024-03-11T10:22:08.000Z,2024-03-11T10:22:08.000Z
https://www.israelhayom.co.il/you-may-find-interesting/article/16155158,453,37,0.08167770419,הגנת הסביבה: המאבק מתחיל עכשיו,"כיצד פועלת מדינת ישראל נגד עבריינים שפוגעים בסביבה, ואיך כל אחת ואחד מאיתנו קשורים לזה?",2024-07-28T09:20:07.000Z,2024-08-15T14:24:02.000Z
https://www.israelhayom.co.il/you-may-find-interesting/article/17125096,490,13,0.02653061224,האם העתיד טמון באנרגיה גרעינית?,"גוגל, אמזון ומיקרוסופט מובילות את המגמה העולמית: האנרגיה הגרעינית הופכת לנושא חם. האם גם ישראל תצטרף למהפכה?",2025-01-12T08:00:36.000Z,2025-01-12T08:02:08.000Z
https://www.israelhayom.co.il/,771,12,0.01556420233,"חדשות, דעות, תרבות, ספורט, כלכלה מהארץ והעולם | ישראל היום","נתניהו: ""יודעים בוודאות שיש 21 חטופים בחיים, שלושה בספק""; טראמפ: ""אתם תדעו מה קורה בעזה תוך 24 שעות""",,
https://www.israelhayom.co.il/writer/%D7%A8%D7%A0%D7%A0%D7%94-%D7%9C%D7%95%D7%99%D7%90%D7%A0%D7%99,435,3,0.006896551724,רננה לויאני,"מוסר, מלחמה",,
https://www.israelhayom.co.il/writer/%D7%90%D7%91%D7%99-%D7%A6%D7%93%D7%A7%D7%94,290,7,0.02413793103,אבי צדקה,הבינה המלאכותית נכשלת במבחן האנטישמיות: מה אפשר לעשות כדי לשפר את המצב?,,
https://www.israelhayom.co.il/writer/%D7%A2%D7%95%D7%A4%D7%A8-%D7%A4%D7%98%D7%A8%D7%A1%D7%91%D7%95%D7%A8%D7%92,277,5,0.01805054152,עופר פטרסבורג,"דורית גבאי, מומחית במיסוי מקרקעין",,
https://www.israelhayom.co.il/flash/article/15722519,346,18,0.05202312139,"באופן סופי: הילולת ל""ג בעומר תתקיים באופן מצומצם ביותר",פיקוד העורף דורש לסגור באופן הרמטי את הר מירון החל מעוד מספר ימים • ככל הנראה תיאסר גם האפשרות להשכיר צימרים באזור ותותר כניסה של עד עשרה אנשים למספר הדלקות מצומצמות • קיים חשש כי למרות האיסור ישנה כוונה של פלגים קיצוניים להגיע למקום,2024-05-09T16:34:52.000Z,2024-05-09T20:00:48.000Z
https://www.israelhayom.co.il/you-may-find-interesting/article/14872219,285,9,0.03157894737,מיזם מרגש להנצחה דיגיטלית,"חברת ממוריז+ הקימה בהתנדבות מעל 1,200 אתרי זיכרון עבור משפחות החללים להנצחה דיגיטלית של חללי הטבח והמלחמה",2023-11-27T11:06:16.000Z,2023-12-26T12:52:43.000Z
https://www.israelhayom.co.il/flash/article/15831555,265,11,0.04150943396,הותר לפרסום: שני לוחמים נהרגו בפיגוע דריסה,"סמ""ר אליה הלל וסמ""ר דייגו שוישה הרסאג' מחטיבת כפיר, נהרגו בפיגוע הדריסה סמוך לשכם  • לא רחוק מאזור הפיגוע ערבים יידו אבנים לעבר רכבים בעוקף חווארה, אין נפגעים",2024-05-29T18:45:23.000Z,2024-05-30T03:56:51.000Z
https://www.israelhayom.co.il/you-may-find-interesting/article/16075558,402,66,0.1641791045,קדחת הנילוס: סכנה מתפשטת,כיצד משבר האקלים מחריף את המחלה וכיצד אפשר למנוע אותה?,2024-07-14T10:57:37.000Z,2024-08-15T14:09:01.000Z
https://www.israelhayom.co.il/podcasts/article/16281998,322,36,0.1118012422,"הרב דוד סתיו: ״חלק מהציבור הדתי לאומי מתנשא על החילונים, לא מגיע אליהם בענווה״","יו״ר ארגון רבני צהר טוען כי המגזר החרדי לא יתגייס לצה״ל בין היתר משום שהצבא לא פועל כדי לכלול בתוכו את הציבור הזה • בשיחה עם עידן טנדלר מספר הרב סתיו על דאגתו הגוברת מהקרע בעם ואומר: ״ישראלים פוחדים מיהדות, זה לא ייתכן״",2024-08-19T06:00:35.000Z,2024-08-21T11:35:38.000Z
https://www.israelhayom.co.il/podcasts/article/16144123,246,9,0.03658536585,"""מעריך שנחזור עם 5-4 מדליות, המלחמה תיתן מוטיבציה לספורטאים שלנו""","אריק זאבי התארח באולפן ""ישראל היום"" וסיפר לשיר זיו: ""הבת שלי נועם רוצה להיות באולימפיאדה"" • וגם - האם זאבי חושש מהאבטחה בתחרויות? ולאן טס בפעם הראשונה בחייו? צפו",2024-07-26T07:00:16.000Z,2024-07-28T09:30:31.000Z
https://www.israelhayom.co.il/podcasts/article/16643547,305,5,0.01639344262,"מנכ""ל מידברן שחיסל את המחבל בפיגוע ביפו: ""מדובר באינסטינקט טהור""","מנכ""ל מידברן לב קרייטמן מגולל בפודקאסט של יניב ריבלין את הערב שבו הסתער לתוך זירת פיגוע ביפו: ״מדובר באינסטינקט טהור. אתה מחליט בהרף עין בלי בכלל לחשוב על ההחלטה שלך, וכך אתה רץ להרוג את המחבל״",2024-10-22T03:00:20.000Z,2024-10-22T09:59:50.000Z
https://www.israelhayom.co.il/writer/%D7%A6%D7%91%D7%99%D7%A7%D7%94-%D7%95%D7%99%D7%A0%D7%A8,182,8,0.04395604396,צביקה וינר,מתנה ושמה בחירות,,
https://www.israelhayom.co.il/writer/%D7%96%D7%90%D7%91-%D7%A7%D7%99%D7%A6%D7%99%D7%A1,177,5,0.02824858757,זאב קיציס,חסיד - לא חרדי,,
https://www.israelhayom.co.il/flash/article/15509535,242,11,0.04545454545,תחת הלחץ: נתניהו נכנע לדרישה להמשך המשא ומתן לעסקה וראש המוסד יצא לקטאר,"רה""מ יאפשר לראש המוסד ולראש השב""כ לנסוע יחד עם משלחותיהם לשיחות לקידום המשא ומתן בקהיר ובדוחא  • בהודעה מטעם לשכת נתניהו נמסר כי ""יינתן להם מרחב הפעולה הדרוש לקידום המגעים"" • גורם בקיא בפרטים אמר ל""ישראל היום"": ""צפויות לעלות הצעות חדשות""",2024-03-29T13:16:09.000Z,2024-03-29T13:19:41.000Z
https://www.israelhayom.co.il/you-may-find-interesting/article/16487776,191,9,0.04712041885,404,עמוד 404,,
https://www.israelhayom.co.il/you-may-find-interesting/article/14909872,175,0,0.0,מחקר חדש קובע- בי-קיור לייזר יעיל בשיקום!,"בי-קיור לייזר המכשיר הרפואי הביתי היחיד בעולם לטיפול בכאב שהוכח מחקרית ב6 מחקרים קליניים 
היחיד שנותן מענה רפואי מתקדם לכאבים, פציעות ושיקום בבית! 
ועכשיו מכשיר הבי- קיור לייזר נמכר ב 30% הנחה ובנוסף 24 תשלומים",2023-12-07T14:39:59.000Z,2023-12-28T13:12:37.000Z
https://www.israelhayom.co.il/you-may-find-interesting/article/16894752,185,4,0.02162162162,תובעים את המזהמים: עשיית עושר ולא במשפט,מחקר חדש בוחן כיצד ניתן להשתמש בעילה המשפטית כדי לחייב תעשיות מזהמות לשלם על רווחים שפגעו בסביבה והעמיקו את משבר האקלים,2024-12-04T08:00:15.000Z,2024-12-04T08:03:53.000Z
https://www.israelhayom.co.il/you-may-find-interesting/article/15175073,222,0,0.0,כדאי לכם לשמוע את זה,"הידעתם ששמיעה תקינה תומכת בבריאות המוח ומהווה גורם מפתח להזדקנות בריאה? * מחקרים מובילים בתחום 
מצאו כי ירידת שמיעה היא גורם סיכון גדול ביותר לדמנציה * ואולם, ככל שנטפל מוקדם יותר נוכל לשפר את איכות 
החיים שלנו * מכשירי השמיעה המתקדמים של חברת סונובה, המוצעים בסניפי רשת שטיינר ואצל סוכנים מורשים 
ברחבי הארץ, מביאים את הבשורה ישירות לאוזניים שלכם * ""להמשיך לעשות בדיוק את אותן הפעילויות שאוהבים""",2024-01-28T08:29:28.000Z,2024-02-29T15:08:13.000Z
https://www.israelhayom.co.il/podcasts/article/15426824,188,9,0.04787234043,"""זו טעות לא לחזק את הרשות הפלשתינית"": ראש השב""כ לשעבר יעקב פרי בשיחה עם ירון בלום בפודקאסט ""בסיווג גבוה""","ירון בלום מארח את יעקב פרי לשיחה על מאחורי הקלעים של מערכת הביטחון בפודקאסט ""בסיווג גבוה"" • ""כשהרשות הפלשתינית רוצה, היא מסוגלת לסכל טרור""",2024-03-14T18:52:17.000Z,2024-03-14T18:58:42.000Z
https://www.israelhayom.co.il/flash/article/16167160,175,10,0.05714285714,15 פצועים בהתנגשות בין משאית למיניבוס בכביש 6,"שתי נשים וגבר נפצעו קשה וסובלים מפגיעה רב מערכתית • שני נוסעים במיניבוס פונו לבית החולים רמב""ם במצב בינוני ו-10 אחרים במצב קל, בהם ילדים כבני עשר",2024-07-30T06:25:48.000Z,2024-07-30T07:15:35.000Z
https://www.israelhayom.co.il/you-may-find-interesting/article/17057476,232,10,0.04310344828,משבר בשדה התעופה: מתי ואיך תקבלו פיצוי?,"בשנה האחרונה, ישראלים רבים שתכננו טיסה מבעוד מועד, מצאו את עצמם ברגע האחרון מתמודדים עם חוסר ודאות בשל ביטולים ודחיות של טיסות מהארץ ומחו""ל | עורכת הדין סילביה סגל, מנהלת מחלקת פניות הציבור ב""אמון הציבור"", התגייסה לעשות קצת סדר בבלגן ולהסביר מה הן הזכויות שמגיעות לנו במקרים של ביטול טיסה",2024-12-30T09:08:38.000Z,2025-03-10T14:03:20.000Z
https://www.israelhayom.co.il/you-may-find-interesting/article/16938649?amp=1,77,7,0.09090909091,מחקר חושף גילוי מטלטל על עוצמת ההשפעה האנושית על כדור הארץ,"פרופ' רון מילוא, זוכה פרס רוטשילד 2024, חושף כיצד אנו מחליפים את הטבע ביצירות האדם",2024-12-11T10:00:08.000Z,2024-12-12T14:06:52.000Z
https://www.israelhayom.co.il/writer/%D7%94%D7%9C%D7%9F-%D7%92%D7%9C%D7%91%D7%A8,86,0,0.0,הלן גלבר,ניסיתי להציל את אשדוד - וזה מה שקרה,,
https://www.israelhayom.co.il/writer/%D7%99%D7%94%D7%95%D7%93%D7%99%D7%AA-%D7%9E%D7%99%D7%9C%D7%A6%D7%A7%D7%99,98,1,0.01020408163,יהודית מילצקי,חרדים לכלכלה,,
https://www.israelhayom.co.il/flash/article/15239466,114,10,0.08771929825,"דיווח ראשוני: מטח כבד לאזור הצפון, כעשרים רקטות שוגרו למרחב צבעון ולדובב בגליל העליון.",,2024-02-08T17:52:25.000Z,2024-02-08T17:54:14.000Z
https://www.israelhayom.co.il/general/article/14848764,135,11,0.08148148148,404,עמוד 404,,
https://www.israelhayom.co.il/flash/article/15120455,119,8,0.06722689076,"הערכה במשטרה: השר בן גביר יכריז על מועמד לתפקיד המפכ""ל בעוד שלושה חודשים","לאחר שכהונת המפכ""ל קובי שבתאי התארכה בחצי שנה צפוי להכריז השר לביטחון פנים על המועמד הבא • בין המעומדים הבולטים: ניצב אבשלום פלד • סגן המפכ""ל ידוע כמי שסובר כי היחלשות תחנות המשטרה פגעה באמון הציבור ובביטחונו",2024-01-18T05:47:44.000Z,2024-01-18T05:53:16.000Z
