Landing Page,Impressions,Url Clicks,URL CTR,title,subtitle,date_published,date_updated
https://www.israelhayom.co.il/you-may-find-interesting/article/16774702,10064,126,0.01251987281,זבל חלל הוא אחד האתגרים הגדולים ביותר שעומדים כיום בפני חקר החלל. אז מה בדיוק קורה שם מעבר לאטמוספירה?,"החלל שמעלינו מתמלא בכמות עצומה של פסולת: לוויינים ישנים, חלקי טילים ואפילו חפצים אישיים של אסטרונאוטים. מי אחראי על ניקוי החלל, מה הסכנות בהצטברות הפסולת וכיצד זה משפיע גם על כדור הארץ?",2024-11-17T08:00:06.000Z,2024-11-17T08:54:10.000Z
https://www.israelhayom.co.il/you-may-find-interesting/article/16127141,10527,413,0.03923244989,מדוע האוויר בישראל כה מזוהם?,מדוע זיהום האוויר עולה לנו כסף וכיצד אפשר לצמצם את נזקיו?,2024-07-23T09:11:32.000Z,2024-08-15T14:20:10.000Z
https://www.israelhayom.co.il/you-may-find-interesting/article/16997278,10830,449,0.04145891043,המאבק על עמק הצבאים: תושבי מודיעין נלחמים על הטבע,פנינת טבע עשירה בבעלי חיים ומסלול נדידה למאות מיני ציפורים בסכנה. המאבק לשימור עמק הצבאים נמשך מול תכניות פיתוח מאיימות,2024-12-22T08:00:59.000Z,2024-12-22T08:59:27.000Z
https://www.israelhayom.co.il/writer/%D7%9E%D7%99%D7%98%D7%9C-%D7%99%D7%A1%D7%A2%D7%95%D7%A8-%D7%91%D7%99%D7%AA-%D7%90%D7%95%D7%A8,7987,121,0.01514961813,מיטל יסעור בית-אור,מטריד: זינוק עצום בתסמיני פוסט-טראומה בקרב לוחמים מאז 7 באוקטובר,,
https://www.israelhayom.co.il/flash/article/15119621,8979,1813,0.2019155808,"דיווח בארה""ב: יורש העצר הסעודי הציע לנרמל את היחסים עם ישראל כחלק משיקום עזה","בלינקן קיבל התחייבות מבן סלמאן וארבעה מנהיגים ערבים אחרים, לסייע לשקם את רצועת עזה אחרי המלחמה • הדרישה להליכה להסדרת היחסים - הסכמה ישראלית לספק לפלשתינים מסלול למדינה משלהם",2024-01-17T22:49:31.000Z,2024-01-17T23:14:30.000Z
https://www.israelhayom.co.il/you-may-find-interesting/article/16938649,9650,805,0.08341968912,מחקר חושף גילוי מטלטל על עוצמת ההשפעה האנושית על כדור הארץ,"פרופ' רון מילוא, זוכה פרס רוטשילד 2024, חושף כיצד אנו מחליפים את הטבע ביצירות האדם",2024-12-11T08:00:08.000Z,2024-12-12T12:06:52.000Z
https://www.israelhayom.co.il/you-may-find-interesting/article/17079805,7815,112,0.01433141395,על גבול הטעם הטוב: מזבל למנת גורמה,"הכירו את אונקום: הפטרייה שגורמת לנו לא לזרוק גרגר אחד של אוכל. מאפי שמרים ולחם חם מהתנור, או גבינות דליקטס עם עובש – נשמע מגרה, נכון? ומה לגבי פטריות שצומחות על פסולת מזון, הייתם אוכלים? כי זה למעשה אותו הדבר",2025-01-05T08:00:53.000Z,2025-01-05T08:08:10.000Z
https://www.israelhayom.co.il/you-may-find-interesting/article/16319826,8089,239,0.02954629744,אנרגיה גרעינית: פתרון ירוק או סכנה?,"אנרגיה גרעינית והאתגר הישראלי, בין מיתוסים למציאות",2024-08-25T09:07:45.000Z,2024-09-16T09:17:00.000Z
https://www.israelhayom.co.il/you-may-find-interesting/article/17197465,9672,238,0.02460711332,כשאין עם מי לדבר,"שירות הלקוחות של חברות התעופה בישראל יכול לגרום לתסכול רב אצל הצרכנים, שעומדים לעיתים חסרי אונים מול המתנה אינסופית למענה של נציג אנושי | מה האחריות של החברות עצמן, ומה אפשר לעשות אם משהו השתבש ואנחנו בסך הכל רוצים שמישהו יעזור לנו",2025-01-21T08:16:57.000Z,2025-03-10T13:55:20.000Z
https://www.israelhayom.co.il/you-may-find-interesting/article/17037533,7659,354,0.04622013318,מהפכה בשוק הישראלי: הרפורמה שפותחת את שוק הייבוא ומשנה את כללי המשחק,איך הרפורמה החדשה תשפיע על הכיס שלנו? אילו מוצרים חדשים ייכנסו למדפים? ומה זה אומר על חשבון החשמל שלנו? • כל מה שצריך לדעת על המהלך שמוביל משרד האנרגיה והכלכלה,2024-12-29T08:00:36.000Z,2024-12-29T08:05:11.000Z
https://www.israelhayom.co.il/olympic2024,8221,485,0.05899525605,אולימפיאדת פריז 2024,אולימפיאדת פריז 2024,,
https://www.israelhayom.co.il/you-may-find-interesting/article/16264404,7900,328,0.04151898734,תחבורה ציבורית בפקק,מבט על התכנון העירוני המורכב בישראל והפתרונות שיוכלו לשפר את המצב,2024-08-15T08:28:51.000Z,2024-08-15T08:39:43.000Z
https://www.israelhayom.co.il/you-may-find-interesting/article/16826182,8767,278,0.03170982092,להכניס קצת אופטימיות הביתה: עמותות בעלי החיים במעמסה עצומה מאז השבעה באוקטובר. דווקא עכשיו זה הזמן לאמץ,"סיום המלחמה עדיין לא נראה באופק ולעמותות לא נותר מקום להכיל את בעלי החיים הנטושים והמשוטטים. כשהמדינה לא בדיוק עוזרת להתמודד עם המצב, מנכ""לית ""תנו לחיות לחיות"" קוראת לאמץ בן משפחה חדש שיעניק קצת אור בתוך אי הוודאות",2024-11-24T08:00:39.000Z,2024-11-24T08:05:28.000Z
https://www.israelhayom.co.il/writer/%D7%90%D7%99%D7%99%D7%9C-%D7%95%D7%99%D7%A0%D7%98%D7%A8,7047,88,0.01248758337,אייל וינטר,"""אנו חייבים להמשיך - וכך גם נעשה!""",,
https://www.israelhayom.co.il/writer/%D7%94%D7%99%D7%90%D7%9C%D7%99-%D7%99%D7%A2%D7%A7%D7%91%D7%99%D6%BE%D7%94%D7%A0%D7%93%D7%9C%D7%A1%D7%9E%D7%9F,6362,96,0.01508959447,היאלי יעקבי-הנדלסמן,"זעקת המורים שנשברו מהקיצוץ: ""אני אוכל בצהרון, לא מחזיק רכב ונמנע ממותגים, כמה אפשר?""",,
https://www.israelhayom.co.il/podcasts/article/14867717,6642,683,0.1028304727,המודל שעשוי להציל את העסקים הקטנים והבינוניים ברחבי הארץ,"חברת מועצת עיריית אשדוד, סטלה ויינשטיין, מספרת ב""העיר שלי"" – הפודקאסט המוניציפאלי של ""ישראל היום"" על מצב העיר במלחמה, סוקרת את הבעיות וההזדמנויות שיש לעסקים בכל רחבי הארץ בעת הזו, ואינה חוסכת ביקורת מהממשלה • וגם החוקרת הראשית במשרד מבקר המדינה שתבדוק את המחדל בעורף כועסת – ויש לה הרבה מאוד סיבות • האזינו",2023-11-26T11:05:37.000Z,2023-11-26T11:05:37.000Z
https://www.israelhayom.co.il/podcasts/article/15505545,7571,133,0.0175670321,"""שחקן זה לא מקצוע, זו דיאגנוזה""","השחקן ולדימיר פרידמן הגיע ל""חופרת"" עם שיר זיו לריאיון על המלחמה, האנטישמיות בעולם, חווית הקליטה בישראל וגם על התפקיד ב-""הצבי"" בכאן 11. ""אני אוהב אודישנים, זה כמו הרפתקה"".",2024-03-28T14:36:10.000Z,2024-03-28T15:24:03.000Z
https://www.israelhayom.co.il/you-may-find-interesting/article/16563364,6502,149,0.02291602584,כיצד הפנסיה שלנו יכולה להציל את העולם ועדיין לשמור על האינטרסים שלנו?,מחקר בבריטניה הראה שהעברת כספי ההשקעות מחברות מזהמות הוא פי 21 יותר אפקטיבי מכל פעולה אחרת שנוכל לעשות בכדי לצמצם את טביעת הרגל הפחמנית שלנו,2024-10-06T07:41:42.000Z,2024-10-06T07:41:42.000Z
https://www.israelhayom.co.il/you-may-find-interesting/article/17015423,6547,173,0.02642431648,אנחנו נשארים בארץ,"במציאות הנוכחית,קשה להיות בטוחים במאה אחוז ששום דבר לא יעמוד בינינו לבין הטיסה שהזמנו | לרשות הנוסעים עומדות זכויות
המאפשרות לקבל החזר אם נאלצו לבטל ביוזמתם את העסקה,אבל חשוב לדעת מה הם התנאים שיש לעמוד בהם כדי לקבל את הכסף",2024-12-23T11:21:07.000Z,2025-03-10T14:07:55.000Z
https://www.israelhayom.co.il/you-may-find-interesting/article/17512405,6704,157,0.02341885442,בהתאם  למצב הנוכחי,"הצורך להתאים את ענף התעופה למצב המלחמה הוביל לתיקון לחוק שירותי התעופה המאפשר בין היתר להגביל את חובת מתן הלינה בעת ביטול טיסות, ולשנות את תנאי הפיצויים. מה התאריכים שבהם נקבעו תנאים מיוחדים ומתי אי אפשר להשתמש בתירוץ ""כוח עליון""? כל מה שצריך לדעת",2025-03-10T10:55:16.000Z,2025-03-10T14:01:12.000Z
https://www.israelhayom.co.il/you-may-find-interesting/article/16035272,6547,751,0.114709027,"אתם מרגישים שמזג האוויר השתגע? בעתיד זה רק יחמיר, ויש לזה השלכות מרחיקות לכת","משבר האקלים הוא בין הנושאים המדוברים ביותר בעולם - ובצדק. המודעות של כולנו עלתה, מפני שלא מדובר רק בנושא סביבתי, אלא גם חברתי, כלכלי ובריאותי.
בתקופה שבה האקלים של כדור הארץ עובר שינויים משמעותיים ומהירים, כתוצאה מפעילות אנושית , גם בישראל מודאגים מהשפעות השינויים הללו שמורגשות יותר ויותר, והן צפויות להחמיר בעתיד הקרוב. מומחים מתריעים ומבקר המדינה פרסם דוח מדאיג, ישראל עדיין אינה ערוכה להתמודד עם התופעות שצפויות להגיע",2024-07-07T13:36:54.000Z,2024-08-15T09:57:39.000Z
https://www.israelhayom.co.il/flash/article/17390169,6582,345,0.05241567912,"הוותיקן מבטל אירועים בהשתתפות האפיפיור: ""מצב מורכב""","""בדיקות המעבדה, צילומי החזה והמצב הקליני של האפיפיור ממשיכים להציג תמונה מורכבת"", נכתב בהודעה • השתתפותו של פרנציסקוס בן ה-88 באירועי הסופ""ש בוטלה",2025-02-18T19:39:25.000Z,2025-02-18T20:00:41.000Z
https://www.israelhayom.co.il/you-may-find-interesting/article/17418040,6531,99,0.01515847497,רוצים לייצג את ישראל באולימפיאדות המדעים? ההזדמנות שלכם אולי מחכה כאן,"עתיד וחלומות הן מילים גדולות, ועבור חברי נבחרות ישראל במדעים הן חלק מהדרך • בימים אלה מתקיימים המיונים לנבחרות, שפתוחים לכלל תלמידי כיתות ט'-י""א בכל רחבי הארץ • רגע לפני שאתם רצים למיונים, נסו לענות על כמה חידות מהנות וראו אם גם אתם יכולים להיות בנבחרות שייצגו את ישראל באולימפיאדות • לא למדענים בלבד",2025-02-23T13:02:30.000Z,2025-02-25T09:32:33.000Z
https://www.israelhayom.co.il/writer/%D7%A9%D7%97%D7%A8-%D7%A4%D7%98%D7%9C,5041,130,0.02578853402,שחר פטל,מי מרוויח מהתקופה?,,
https://www.israelhayom.co.il/you-may-find-interesting/article/16252564,6121,523,0.08544355497,404,עמוד 404,,
https://www.israelhayom.co.il/you-may-find-interesting/article/15026509,5423,220,0.04056795132,בטיחות ללא פשרות: כיצד רכבי יוקרה חשמליים מציבים סטנדרטים חדשים בתחום,זה כבר לא סקופ - טרנד הרכבים החשמליים כבש את כבישי ישראל בסערה!,2023-12-31T08:20:04.000Z,2023-12-31T08:20:04.000Z
https://www.israelhayom.co.il/you-may-find-interesting/article/16900977,4962,126,0.0253929867,משבר האקלים: למה זה צריך להטריד את חברות הביטוח ואתכם?,"אירועי אקלים קיצוניים מגדילים את תביעות הביטוח, מעלים את הפרמיות ועלולים להפוך את הביטוח לבלתי משתלם לכולם",2024-12-08T08:00:19.000Z,2024-12-08T08:08:39.000Z
https://www.israelhayom.co.il/you-may-find-interesting/article/15397849,4804,214,0.04454621149,"""השמירה על היער - אינטרס  עליון של מדינת ישראל""","הישראלים נוהרים לטייל ולנפוש ביערות ובשטחים הפתוחים - אולם למרבה הפלא היער אינו זוכה להגנה מוסדרת * כעת, כ""יערן של המדינה"", קק""ל מובילה חוק שיעניק לו את המעמד הראוי * ""מדובר במהלך היסטורי"", מבהירה יו""ר קק""ל יפעת עובדיה לוסקי, ""נפסיק את המצב שבו אין ליער בעל בית""",2024-03-13T08:41:03.000Z,2024-03-13T10:49:14.000Z
https://www.israelhayom.co.il/you-may-find-interesting/article/16253353,6334,101,0.01594568993,חזרה ללימודים 2024:  הרשת שהכי הפתיעה אותי,"שנת הלימודים החדשה מתקרבת בצעדי ענק וכמו כל הורה, חיפשתי את המקום המושלם לרכוש את כל הציוד הדרוש לחזרה לבית הספר. כמו אמהות רבות אחרות, רציתי לוודא שאבחר במקום שיציע מבחר מוצרים עשיר ושירות טוב, כדי שלא אלך לאיבוד עם הרשימה שקיבלנו מבית הספר. לשם כך יצאתי למסע בין רשתות השיווק השונות",2024-08-14T14:09:09.000Z,2024-09-01T12:01:11.000Z
https://www.israelhayom.co.il/you-may-find-interesting/article/17145034,6223,104,0.01671219669,"אנרגיה מקיימת כמקור לצמיחה כלכלית ברשויות המקומיות, ולעתיד נקי יותר","המעבר לאנרגיה מקיימת מהווה הזדמנות לרשויות המקומיות לצמצם את עלויות האנרגיה שלהם, להפחית את טביעת הרגל הפחמנית ולהפנות משאבים תקציביים לטובת שירותים חיוניים כמו חינוך ורווחה",2025-01-19T08:00:58.000Z,2025-01-19T08:04:21.000Z
https://www.israelhayom.co.il/you-may-find-interesting/article/16291679,5254,171,0.03254663114,שיקום ירוק בעוטף עזה,היוזמה הירוקה החדשה ששמה לה למטרה את שיקום העוטף,2024-08-20T08:29:43.000Z,2024-09-05T11:32:42.000Z
https://www.israelhayom.co.il/you-may-find-interesting/article/16866241,5511,123,0.02231899837,מהורה למאמן: כך מגדלים ילדים חזקים,כלים לחיזוק אמהות וילדים: לבנות ביטחון ומשמעות אמיתית במשפחה,2024-11-28T16:03:07.000Z,2024-12-10T15:14:48.000Z
https://www.israelhayom.co.il/you-may-find-interesting/article/16472657,5571,372,0.06677436726,"התקפי חרדה, פחד ותחושת חוסר אונים: משבר האקלים יוצר חרדה ודיכאון מסוג חדש שתוקף בעיקר צעירים","גלי חום קיצוניים שרק הולכים ומחמירים, מינים שלמים שנכחדים ואסונות טבע בלתי פוסקים ברחבי העולם • כיצד אפשר לא להיות חרדים לגבי העתיד?",2024-09-22T07:00:11.000Z,2024-09-22T07:18:39.000Z
https://www.israelhayom.co.il/you-may-find-interesting/article/16857351,4410,107,0.02426303855,טיסה בוטלה או התעכבה? אלו הפיצויים שחברות התעופה מסתירות מכם,"תופעת העיכובים וביטולי הטיסות התרחבה בשנה האחרונה, לנוכח אי הוודאות שכפתה המלחמה | לפני שאתם רוכשים כרטיסים ליעד הבא, חשוב לדעת מה הזכויות שלכם למקרה שתמצאו את עצמכם תקועים בשדה התעופה, מה עושים במקרה של אובר-בוקינג ומה קובע החוק לגבי טיסה שהתבטלה",2024-11-27T09:38:20.000Z,2025-04-23T09:47:02.000Z
https://www.israelhayom.co.il/flash/article/17023666,4693,156,0.03324099723,חשש לחלב במוצר: ריקול לוופלים של עלית,"חברת שטראוס מבקשת ליידע את ציבור הצרכנים האלרגיים לחלב ואגוזי לוז, כי במקרים בודדים קיים חשש להימצאות אריזה פנימית של מוצר חלבי • כל הפרטים",2024-12-24T12:51:52.000Z,2024-12-24T13:02:35.000Z
https://www.israelhayom.co.il/you-may-find-interesting/article/16251634,4249,90,0.02118145446,הקשר בין היהדות לסביבה,האם הדת היהודית יכולה להוביל לפתרון המשבר האקולוגי?,2024-08-13T08:53:07.000Z,2024-08-15T14:44:02.000Z
https://www.israelhayom.co.il/podcasts/article/15080397,3939,519,0.1317593298,"יו""ר הרשות לפיתוח הנגב, בני ביטון, נגד סמוטריץ': ""רוצים לסגור את הרשות - כנראה שמישהו באוצר החליק על השכל""","ראש עיריית דימונה, המשמש גם כסגן יו""ר מרכז השלטון המקומי, יוצא גם נגד הכוונה לקצץ במענקי האיזון: ""זה קו אדום – נעצור ונשבית את כל השלטון המקומי"" • את הדברים אמר ב""העיר שלי"" – הפודקאסט המוניצפאלי של ""ישראל היום"" • וגם מה דורשת חברת מועצת עיריית כפר סבא, הדר לביא, מגורמי הביטחון?",2024-01-10T16:46:13.000Z,2024-01-10T18:03:58.000Z
https://www.israelhayom.co.il/you-may-find-interesting/article/16266345,4264,147,0.03447467167,מומחי פיננסים או רואי חשבון? כך תיקחו את עצמכם לשלב הבא באמצעות כלי דאטה ו-AI,"הגברת היעילות וחיסכון בזמן, הפקת תובנות בעלות ערך מכמות עצומה של נתונים, התמודדות עם אתגרי השוק הדינמיים ושיפור חוויית הלקוח – את הדברים הללו ועוד תוכלו לעשות באמצעות כלים כמו SQL, Python ו-ChatGPT",2024-08-15T11:47:29.000Z,2024-08-15T11:49:28.000Z
https://www.israelhayom.co.il/you-may-find-interesting/article/17341024,4271,89,0.02083821119,לכוון הכי גבוה שאפשר,"נבחרות ישראל במדעים - מתמטיקה, פיזיקה, כימיה, ביולוגיה ומדעי המחשב - חוזרות בכל שנה מהאולימפיאדות עם הישגים מרשימים • בימים אלו מתקיימים המיונים לנבחרות, לצעירות ולצעירים בכיתות ט'-י""א , עבור מי שרוצה להצטרף לדור העתיד של המדע בישראל • דניאל ובר, מדליסט זהב שלוש פעמים: ""הלימודים פה דוחפים אותך לשפר את סגנון החשיבה באופן כזה שאין בהרבה תחומים""",2025-02-11T11:23:37.000Z,2025-02-18T14:49:41.000Z
https://www.israelhayom.co.il/you-may-find-interesting/article/16224195,4500,171,0.038,עבריינות ירוקה,כיצד העולם התחתון בישראל מעורב בעבירות סביבה?,2024-08-08T09:41:53.000Z,2024-08-15T14:40:14.000Z
https://www.israelhayom.co.il/you-may-find-interesting/article/16319781,3771,178,0.0472023336,צלילים מן העתיד: מכשירי שמיעה מבוססי בינה מלאכותית,"כיצד טכנולוגיה מתקדמת תשפר את איכות החיים של
אנשים עם ירידה בשמיעה באמצעות AI?",2024-08-27T09:00:20.000Z,2024-09-11T09:37:26.000Z
https://www.israelhayom.co.il/you-may-find-interesting/article/16319389,3264,220,0.06740196078,ספונסר חדש לליגת העל בכדורגל: זו החסות חסרת התקדים שאושרה על ידי מנהלת הליגות,"בשורה גדולה לליגת העל בכדורגל ולקבוצות עצמן – הסכם חסות חדש לליגת העל אושר על ידי דירקטוריון מנהלת הליגות. ההסכם הכלכלי חסר התקדים בין הטוטו לליגות המקצועניות שאושר יעמוד על סכום שיא של כ-40 מיליון ש""ח לעונת 24-25",2024-08-28T11:01:17.000Z,2024-08-28T15:23:17.000Z
https://www.israelhayom.co.il/vacation-calendar,3357,505,0.1504319333,לוח חופשות משרד החינוך 2024-2025 לשנת הלימודים תשפ''ה,,,
https://www.israelhayom.co.il/writer/%D7%A8%D7%91%D7%A7%D7%94-%D7%A0%D7%A8%D7%99%D7%94-%D7%91%D7%9F%D6%BE%D7%A9%D7%97%D7%A8,2163,89,0.04114655571,רבקה נריה בן־שחר,ליזיסטרטה 2024,,
https://www.israelhayom.co.il/you-may-find-interesting/article/17242300,3007,157,0.05221150648,העתיד כבר כאן,"השקעה בהון האנושי היא המפתח להמשך ההצלחה הישראלית בתחום המדעים, ומשרד החינוך ומרכז מדעני העתיד של קרן מיימונידיס מזמינים צעירות וצעירים מכל הארץ להשתתף במיונים של נבחרות ישראל במדעים ולהיות חלק מפורצי הדרך הבאים | נבחרות ישראל במדעים מובילות הכשרה מתקדמת, מטפחות כישורים חיוניים להתמודדות עם אתגרים אישיים ומקצועיים, דרך חשיבה יצירתית, חוויה חברתית ושילוב בין לימוד מעמיק לבין צמיחה. תלמידות ותלמידים מהנבחרות הבוגרות זוכים לייצג את ישראל באולימפיאדות הבינלאומיות במדעים",2025-01-27T17:08:07.000Z,2025-02-18T14:52:51.000Z
https://www.israelhayom.co.il/you-may-find-interesting/article/17388281,3146,117,0.03719008264,מעבר לתחרות: הקהילה שמעצבת את דור העתיד של המדע הישראלי,"לא רק מדליות – איך נבחרות המדעים מטפחות יצירתיות, שותפות והתמודדות עם כישלון בדרך למצוינות? | טור דעה",2025-02-18T15:09:44.000Z,2025-02-19T09:28:18.000Z
https://www.israelhayom.co.il/podcasts/article/15192426,2155,100,0.0464037123,"""עשינו שיעורי בית - מציעה לאויבים לא לאתגר אותנו"": המועמדת לראשות עיריית ת""א אורנה ברביבאי בשיחה עם ירון בלום","ירון בלום מארח את אלופה (מיל') אורנה ברביבאי לשיחה על מאחורי הקלעים של מערכת הביטחון בפודקאסט הביטחוני של ""ישראל היום"" • ""חייבים להחזיר את ההרתעה שיבינו - איתנו לא משחקים"" • על עסקה אפשרית להחזרת החטופים אמרה: ""הציווי הערכי הוא להחזיר את כולם הביתה""",2024-01-31T09:32:55.000Z,2024-01-31T13:00:39.000Z
https://www.israelhayom.co.il/you-may-find-interesting/article/17481892,3037,120,0.03951267698,פורצות דרך: המורשת הנשית המרשימה של מרצדס,"מברתה בנץ שהפכה לאגדה ועד ההנהלה הבכירה כיום, מרצדס מציגה 137 שנים של תעוזה נשית: לרגל יום האישה הבינלאומי, הנה סיפוריהן מעורר ההשראה של הנשים המובילות של מותג הרכב הגרמני והיוקרתי גם בישראל",2025-03-05T08:42:01.000Z,2025-03-05T08:54:52.000Z
https://www.israelhayom.co.il/you-may-find-interesting/article/15157006,2314,18,0.007778738116,"דווקא השנה - ""ט""ו בשבט הוא מסר של צמיחה, תקווה, התחדשות ושורשיות""","מפרוץ המלחמה עומדת קק""ל בחזית הסיוע לאזרחים ולמערכת הביטחון • רגע לפני ציון החג בצל הלחימה, שמענו על הפעילות הענפה בחודשים האחרונים - ועל מה צפוי בעתיד • יו""ר קק""ל יפעת עובדיה לוסקי: ""אנחנו כאן, לא יעקרו אותנו""",2024-01-25T08:32:43.000Z,2024-01-25T13:20:48.000Z
https://www.israelhayom.co.il/you-may-find-interesting/article/16966537,2690,56,0.02081784387,מיליוני טונות של חומרים מסוכנים במטרופולין חיפה: איום מתמשך או שינוי מתקרב?,"חומרים מסוכנים בלב אזור מגורים צפוף בחיפה מעוררים שאלות קריטיות על בטיחות ובריאות הציבור. על הסיכונים המיידיים, החלטת הממשלה לסגור את בתי הזיקוק וההיערכות הדרושה לשמירה על רציפות משק האנרגיה",2024-12-15T08:09:24.000Z,2024-12-15T08:09:24.000Z
